pmid,citations,title,date,text
31951162,1.0,A Review of Recent Developments and Progress in Computational Drug Repositioning,2020;26(26):3059-3068.,"Computational drug repositioning is an efficient approach towards discovering new indications for existing drugs. In recent years, with the accumulation of online health-related information and the extensive use of biomedical databases, computational drug repositioning approaches have achieved significant progress in drug discovery. In this review, we summarize recent advancements in drug repositioning. Firstly, we explicitly demonstrated the available data source information which is conducive to identifying novel indications. Furthermore, we provide a summary of the commonly used computing approaches. For each method, we briefly described techniques, case studies, and evaluation criteria. Finally, we discuss the limitations of the existing computing approaches."
31950592,6.0,Radiomics and Machine Learning in Oral Healthcare,2020 May;14(3):e1900040.,"The increasing storage of information, data, and forms of knowledge has led to the development of new technologies that can help to accomplish complex tasks in different areas, such as in dentistry. In this context, the role of computational methods, such as radiomics and Artificial Intelligence (AI) applications, has been progressing remarkably for dentomaxillofacial radiology (DMFR). These tools bring new perspectives for diagnosis, classification, and prediction of oral diseases, treatment planning, and for the evaluation and prediction of outcomes, minimizing the possibilities of human errors. A comprehensive review of the state-of-the-art of using radiomics and machine learning (ML) for imaging in oral healthcare is presented in this paper. Although the number of published studies is still relatively low, the preliminary results are very promising and in a near future, an augmented dentomaxillofacial radiology (ADMFR) will combine the use of radiomics-based and AI-based analyses with the radiologist's evaluation. In addition to the opportunities and possibilities, some challenges and limitations have also been discussed for further investigations."
31945959,,Outlier Detection in Health Record Free-Text using Deep Learning,2019 Jul;2019:550-555.,"In recent years, machine learning approaches have been successfully applied to analysis of patient symptom data in the context of disease diagnosis, at least where such data is well codified. However, much of the data present in Electronic Health Records (EHR) is unlikely to prove suitable for classic machine learning approaches. In particular, the use of free (or unstructured) text for clinical notes presents significant analytical opportunities, but also unique difficulties. Furthermore, the wide dispersal of health data relating to individuals necessitates the development of decentralized solutions. We provide, in this paper, an overview of our approach to develop a neural network framework for patient classification in the environment of EHRs where data may be heterogeneous, incomplete (containing missing values), and noisy. In this paper we describe our system which provides prediction of outlier cases which are likely to relate to frequent attender patients, which acheives an Area-Under-the-Curve score of up to 0.92."
31939856,7.0,"Artificial Intelligence in Anesthesiology: Current Techniques, Clinical Applications, and Limitations",2020 Feb;132(2):379-394.,"Artificial intelligence has been advancing in fields including anesthesiology. This scoping review of the intersection of artificial intelligence and anesthesia research identified and summarized six themes of applications of artificial intelligence in anesthesiology: (1) depth of anesthesia monitoring, (2) control of anesthesia, (3) event and risk prediction, (4) ultrasound guidance, (5) pain management, and (6) operating room logistics. Based on papers identified in the review, several topics within artificial intelligence were described and summarized: (1) machine learning (including supervised, unsupervised, and reinforcement learning), (2) techniques in artificial intelligence (e.g., classical machine learning, neural networks and deep learning, Bayesian methods), and (3) major applied fields in artificial intelligence.The implications of artificial intelligence for the practicing anesthesiologist are discussed as are its limitations and the role of clinicians in further developing artificial intelligence for use in clinical care. Artificial intelligence has the potential to impact the practice of anesthesiology in aspects ranging from perioperative support to critical care delivery to outpatient pain management."
31938923,,Of Machines and Men: Intelligent Diagnosis and the Shape of Things to Come,2020 Jan 14;22(1):9.,"Artificial Intelligence (AI), although well established in many areas of everyday life, has only recently been trialed in the diagnosis and management of common clinical conditions. This editorial review highlights progress to date and suggests further improvements in and trials of AI in the management of conditions such as hypertension."
31936321,7.0,Machine-Learning-Assisted De Novo Design of Organic Molecules and Polymers: Opportunities and Challenges,2020 Jan 8;12(1):163.,"Organic molecules and polymers have a broad range of applications in biomedical, chemical, and materials science fields. Traditional design approaches for organic molecules and polymers are mainly experimentally-driven, guided by experience, intuition, and conceptual insights. Though they have been successfully applied to discover many important materials, these methods are facing significant challenges due to the tremendous demand of new materials and vast design space of organic molecules and polymers. Accelerated and inverse materials design is an ideal solution to these challenges. With advancements in high-throughput computation, artificial intelligence (especially machining learning, ML), and the growth of materials databases, ML-assisted materials design is emerging as a promising tool to flourish breakthroughs in many areas of materials science and engineering. To date, using ML-assisted approaches, the quantitative structure property/activity relation for material property prediction can be established more accurately and efficiently. In addition, materials design can be revolutionized and accelerated much faster than ever, through ML-enabled molecular generation and inverse molecular design. In this perspective, we review the recent progresses in ML-guided design of organic molecules and polymers, highlight several successful examples, and examine future opportunities in biomedical, chemical, and materials science fields. We further discuss the relevant challenges to solve in order to fully realize the potential of ML-assisted materials design for organic molecules and polymers. In particular, this study summarizes publicly available materials databases, feature representations for organic molecules, open-source tools for feature generation, methods for molecular generation, and ML models for prediction of material properties, which serve as a tutorial for researchers who have little experience with ML before and want to apply ML for various applications. Last but not least, it draws insights into the current limitations of ML-guided design of organic molecules and polymers. We anticipate that ML-assisted materials design for organic molecules and polymers will be the driving force in the near future, to meet the tremendous demand of new materials with tailored properties in different fields."
31936210,5.0,Practices and Trends of Machine Learning Application in Nanotoxicology,2020 Jan 8;10(1):116.,"Machine Learning (ML) techniques have been applied in the field of nanotoxicology with very encouraging results. Adverse effects of nanoforms are affected by multiple features described by theoretical descriptors, nano-specific measured properties, and experimental conditions. ML has been proven very helpful in this field in order to gain an insight into features effecting toxicity, predicting possible adverse effects as part of proactive risk analysis, and informing safe design. At this juncture, it is important to document and categorize the work that has been carried out. This study investigates and bookmarks ML methodologies used to predict nano (eco)-toxicological outcomes in nanotoxicology during the last decade. It provides a review of the sequenced steps involved in implementing an ML model, from data pre-processing, to model implementation, model validation, and applicability domain. The review gathers and presents the step-wise information on techniques and procedures of existing models that can be used readily to assemble new nanotoxicological in silico studies and accelerates the regulation of in silico tools in nanotoxicology. ML applications in nanotoxicology comprise an active and diverse collection of ongoing efforts, although it is still in their early steps toward a scientific accord, subsequent guidelines, and regulation adoption. This study is an important bookend to a decade of ML applications to nanotoxicology and serves as a useful guide to further in silico applications."
31935669,6.0,Artificial intelligence in digital breast pathology: Techniques and applications,2020 Feb;49:267-273.,"Breast cancer is the most common cancer and second leading cause of cancer-related death worldwide. The mainstay of breast cancer workup is histopathological diagnosis - which guides therapy and prognosis. However, emerging knowledge about the complex nature of cancer and the availability of tailored therapies have exposed opportunities for improvements in diagnostic precision. In parallel, advances in artificial intelligence (AI) along with the growing digitization of pathology slides for the primary diagnosis are a promising approach to meet the demand for more accurate detection, classification and prediction of behaviour of breast tumours. In this article, we cover the current and prospective uses of AI in digital pathology for breast cancer, review the basics of digital pathology and AI, and outline outstanding challenges in the field."
31934891,1.0,Environmental mixtures and children's health: identifying appropriate statistical approaches,2020 Apr;32(2):315-320.,"Purpose of review:                    Biomonitoring studies have shown that children are constantly exposed to complex patterns of chemical and nonchemical exposures. Here, we briefly summarize the rationale for studying multiple exposures, also called mixture, in relation to child health and key statistical approaches that can be used. We discuss advantages over traditional methods, limitations and appropriateness of the context.              Recent findings:                    New approaches allow pediatric researchers to answer increasingly complex questions related to environmental mixtures. We present methods to identify the most relevant exposures among a high-multitude of variables, via shrinkage and variable selection techniques, and identify the overall mixture effect, via Weighted Quantile Sum and Bayesian Kernel Machine regressions. We then describe novel extensions that handle high-dimensional exposure data and allow identification of critical exposure windows.              Summary:                    Recent advances in statistics and machine learning enable researchers to identify important mixture components, estimate joint mixture effects and pinpoint critical windows of exposure. Despite many advantages over single chemical approaches, measurement error and biases may be amplified in mixtures research, requiring careful study planning and design. Future research requires increased collaboration between epidemiologists, statisticians and data scientists, and further integration with causal inference methods."
31934647,11.0,Photoplethysmography based atrial fibrillation detection: a review,2020 Jan 10;3:3.,"Atrial fibrillation (AF) is a cardiac rhythm disorder associated with increased morbidity and mortality. It is the leading risk factor for cardioembolic stroke and its early detection is crucial in both primary and secondary stroke prevention. Continuous monitoring of cardiac rhythm is today possible thanks to consumer-grade wearable devices, enabling transformative diagnostic and patient management tools. Such monitoring is possible using low-cost easy-to-implement optical sensors that today equip the majority of wearables. These sensors record blood volume variations-a technology known as photoplethysmography (PPG)-from which the heart rate and other physiological parameters can be extracted to inform about user activity, fitness, sleep, and health. Recently, new wearable devices were introduced as being capable of AF detection, evidenced by large prospective trials in some cases. Such devices would allow for early screening of AF and initiation of therapy to prevent stroke. This review is a summary of a body of work on AF detection using PPG. A thorough account of the signal processing, machine learning, and deep learning approaches used in these studies is presented, followed by a discussion of their limitations and challenges towards clinical applications."
31932230,4.0,Toward Addiction Prediction: An Overview of Cross-Validated Predictive Modeling Findings and Considerations for Future Neuroimaging Research,2020 Aug;5(8):748-758.,"Substance use is a leading cause of disability and death worldwide. Despite the existence of evidence-based treatments, clinical outcomes are highly variable across individuals, and relapse rates following treatment remain high. Within this context, methods to identify individuals at particular risk for unsuccessful treatment (i.e., limited within-treatment abstinence), or for relapse following treatment, are needed to improve outcomes. Cumulatively, the literature generally supports the hypothesis that individual differences in brain function and structure are linked to differences in treatment outcomes, although anatomical loci and directions of associations have differed across studies. However, this work has almost entirely used methods that may overfit the data, leading to inflated effect size estimates and reduced likelihood of reproducibility in novel clinical samples. In contrast, cross-validated predictive modeling (i.e., machine learning) approaches are designed to overcome limitations of traditional approaches by focusing on individual differences and generalization to novel subjects (i.e., cross-validation), thereby increasing the likelihood of replication and potential translation to novel clinical settings. Here, we review recent studies using these approaches to generate brain-behavior models of treatment outcomes in addictions and provide recommendations for further work using these methods."
31927437,8.0,"Computational approaches in cancer multidrug resistance research: Identification of potential biomarkers, drug targets and drug-target interactions",2020 Jan;48:100662.,"Like physics in the 19th century, biology and molecular biology in particular, has been fertilized and enhanced like few other scientific fields, by the incorporation of mathematical methods. In the last decades, a whole new scientific field, bioinformatics, has developed with an output of over 30,000 papers a year (Pubmed search using the keyword ""bioinformatics""). Huge databases of mass throughput data have been established, with ArrayExpress alone containing more than 2.7 million assays (October 2019). Computational methods have become indispensable tools in molecular biology, particularly in one of the most challenging areas of cancer research, multidrug resistance (MDR). However, confronted with a plethora of different algorithms, approaches, and methods, the average researcher faces key questions: Which methods do exist? Which methods can be used to tackle the aims of a given study? Or, more generally, how do I use computational biology/bioinformatics to bolster my research? The current review is aimed at providing guidance to existing methods with relevance to MDR research. In particular, we provide an overview on: a) the identification of potential biomarkers using expression data; b) the prediction of treatment response by machine learning methods; c) the employment of network approaches to identify gene/protein regulatory networks and potential key players; d) the identification of drug-target interactions; e) the use of bipartite networks to identify multidrug targets; f) the identification of cellular subpopulations with the MDR phenotype; and, finally, g) the use of molecular modeling methods to guide and enhance drug discovery. This review shall serve as a guide through some of the basic concepts useful in MDR research. It shall give the reader some ideas about the possibilities in MDR research by using computational tools, and, finally, it shall provide a short overview of relevant literature."
31926317,,Key indicators of phase transition for clinical trials through machine learning,2020 Feb;25(2):414-421.,"A significant number of drugs fail during the clinical testing stage. To understand the attrition of drugs through the regulatory process, here we review and advance machine-learning (ML) and natural language-processing algorithms to investigate the importance of factors in clinical trials that are linked with failure in Phases II and III. We find that clinical trial phase transitions can be predicted with an average accuracy of 80%. Identifying these trials provides information to sponsors facing difficult decisions about whether these higher risk trials should be modified or halted. We also find common protocol characteristics across therapeutic areas that are linked to phase success, including the number of endpoints and the complexity of the eligibility criteria."
31924424,2.0,Contrast-Enhanced Ultrasound Quantification: From Kinetic Modeling to Machine Learning,2020 Mar;46(3):518-543.,"Ultrasound contrast agents (UCAs) have opened up immense diagnostic possibilities by combined use of indicator dilution principles and dynamic contrast-enhanced ultrasound (DCE-US) imaging. UCAs are microbubbles encapsulated in a biocompatible shell. With a rheology comparable to that of red blood cells, UCAs provide an intravascular indicator for functional imaging of the (micro)vasculature by quantitative DCE-US. Several models of the UCA intravascular kinetics have been proposed to provide functional quantitative maps, aiding diagnosis of different pathological conditions. This article is a comprehensive review of the available methods for quantitative DCE-US imaging based on temporal, spatial and spatiotemporal analysis of the UCA kinetics. The recent introduction of novel UCAs that are targeted to specific vascular receptors has advanced DCE-US to a molecular imaging modality. In parallel, new kinetic models of increased complexity have been developed. The extraction of multiple quantitative maps, reflecting complementary variables of the underlying physiological processes, requires an integrative approach to their interpretation. A probabilistic framework based on emerging machine-learning methods represents nowadays the ultimate approach, improving the diagnostic accuracy of DCE-US imaging by optimal combination of the extracted complementary information. The current value and future perspective of all these advances are critically discussed."
31923803,,Power dynamics in intergroup relations,2020 Jun;33:250-255.,"Power and intergroup relations are complex, multilevel, and dynamic. Using Power Basis Theory, we explain our criteria for deciding whether theory or research addresses intergroup power dynamics: it must (a) address power and not authority or other topics, (b) involve attempted or real change regarding groups and power, or the prevention of change, (c) involve protracted interactions among multiple actors through more than one channel, (d) involve more than one level of social organization (e.g. person, group, superordinate group). We organize our 10-year review by these criteria. Research meeting all our criteria is rare. We explain relevant new theory and new research tools, including multi-level modelling, multi-player games, agent-based models, big data, and machine-learning, that can help fill the gap."
31922268,28.0,Machine intelligence in peptide therapeutics: A next-generation tool for rapid disease screening,2020 Jul;40(4):1276-1314.,"Discovery and development of biopeptides are time-consuming, laborious, and dependent on various factors. Data-driven computational methods, especially machine learning (ML) approach, can rapidly and efficiently predict the utility of therapeutic peptides. ML methods offer an array of tools that can accelerate and enhance decision making and discovery for well-defined queries with ample and sophisticated data quality. Various ML approaches, such as support vector machines, random forest, extremely randomized tree, and more recently deep learning methods, are useful in peptide-based drug discovery. These approaches leverage the peptide data sets, created via high-throughput sequencing and computational methods, and enable the prediction of functional peptides with increased levels of accuracy. The use of ML approaches in the development of peptide-based therapeutics is relatively recent; however, these techniques are already revolutionizing protein research by unraveling their novel therapeutic peptide functions. In this review, we discuss several ML-based state-of-the-art peptide-prediction tools and compare these methods in terms of their algorithms, feature encodings, prediction scores, evaluation methodologies, and software utilities. We also assessed the prediction performance of these methods using well-constructed independent data sets. In addition, we discuss the common pitfalls and challenges of using ML approaches for peptide therapeutics. Overall, we show that using ML models in peptide research can streamline the development of targeted peptide therapies."
31922162,10.0,Recent advances in fast-scan cyclic voltammetry,2020 Feb 17;145(4):1087-1102.,"Fast-scan cyclic voltammetry (FSCV) at carbon-fiber microelectrodes (CFMEs) is a versatile electrochemical technique to probe neurochemical dynamics in vivo. Progress in FSCV methodology continues to address analytical challenges arising from biological needs to measure low concentrations of neurotransmitters at specific sites. This review summarizes recent advances in FSCV method development in three areas: (1) waveform optimization, (2) electrode development, and (3) data analysis. First, FSCV waveform parameters such as holding potential, switching potential, and scan rate have been optimized to monitor new neurochemicals. The new waveform shapes introduce better selectivity toward specific molecules such as serotonin, histamine, hydrogen peroxide, octopamine, adenosine, guanosine, and neuropeptides. Second, CFMEs have been modified with nanomaterials such as carbon nanotubes or replaced with conducting polymers to enhance sensitivity, selectivity, and antifouling properties. Different geometries can be obtained by 3D-printing, manufacturing arrays, or fabricating carbon nanopipettes. Third, data analysis is important to sort through the thousands of CVs obtained. Recent developments in data analysis include preprocessing by digital filtering, principal components analysis for distinguishing analytes, and developing automated algorithms to detect peaks. Future challenges include multisite measurements, machine learning, and integration with other techniques. Advances in FSCV will accelerate research in neurochemistry to answer new biological questions about dynamics of signaling in the brain."
31921555,2.0,Progress and Challenges Toward the Rational Design of Oxygen Electrocatalysts Based on a Descriptor Approach,2019 Nov 27;7(1):1901614.,"Oxygen redox catalysis, including the oxygen reduction reaction (ORR) and oxygen evolution reaction (OER), is crucial in determining the electrochemical performance of energy conversion and storage devices such as fuel cells, metal-air batteries,and electrolyzers. The rational design of electrochemical catalysts replaces the traditional trial-and-error methods and thus promotes the R&D process. Identifying descriptors that link structure and activity as well as selectivity of catalysts is the key for rational design. In the past few decades, two types of descriptors including bulk- and surface-based have been developed to probe the structure-property relationships. Correlating the current descriptors to one another will promote the understanding of the underlying physics and chemistry, triggering further development of more universal descriptors for the future design of electrocatalysts. Herein, the current benchmark activity descriptors for oxygen electrocatalysis as well as their applications are reviewed. Particular attention is paid to circumventing the scaling relationship of oxygen-containing intermediates. For hybrid materials, multiple descriptors will show stronger predictive power by considering more factors such as interface reconstruction, confinement effect, multisite adsorption, etc. Machine learning and high-throughput simulations can thus be crucial in assisting the discovery of new multiple descriptors and reaction mechanisms."
