pmid,title,text,date,citations
31756920,"Bubbles, Foam Formation, Stability and Consumer Perception of Carbonated Drinks: A Review of Current, New and Emerging Technologies for Rapid Assessment and Control","Quality control, mainly focused on the assessment of bubble and foam-related parameters, is critical in carbonated beverages, due to their relationship with the chemical components as well as their influence on sensory characteristics such as aroma release, mouthfeel, and perception of tastes and aromas. Consumer assessment and acceptability of carbonated beverages are mainly based on carbonation, foam, and bubbles, as a flat carbonated beverage is usually perceived as low quality. This review focuses on three beverages: beer, sparkling water, and sparkling wine. It explains the characteristics of foam and bubble formation, and the traditional methods, as well as emerging technologies based on robotics and computer vision, to assess bubble and foam-related parameters. Furthermore, it explores the most common methods and the use of advanced techniques using an artificial intelligence approach to assess sensory descriptors both for descriptive analysis and consumers' acceptability. Emerging technologies, based on the combination of robotics, computer vision, and machine learning as an approach to artificial intelligence, have been developed and applied for the assessment of beer and, to a lesser extent, sparkling wine. This, has the objective of assessing the final products quality using more reliable, accurate, affordable, and less time-consuming methods. However, despite carbonated water being an important product, due to its increasing consumption, more research needs to focus on exploring more efficient, repeatable, and accurate methods to assess carbonation and bubble size, distribution and dynamics.",2019 Nov 20;8(12):596.,3.0
31756390,Data generation and network reconstruction strategies for single cell transcriptomic profiles of CRISPR-mediated gene perturbations,"Recent advances in single-cell RNA-sequencing (scRNA-seq) in combination with CRISPR/Cas9 technologies have enabled the development of methods for large-scale perturbation studies with transcriptional readouts. These methods are highly scalable and have the potential to provide a wealth of information on the biological networks that underlie cellular response. Here we discuss how to overcome several key challenges to generate and analyse data for the confident reconstruction of models of the underlying cellular network. Some challenges are generic, and apply to analysing any single-cell transcriptomic data, while others are specific to combined single-cell CRISPR/Cas9 data, in particular barcode swapping, knockdown efficiency, multiplicity of infection and potential confounding factors. We also provide a curated collection of published data sets to aid the development of analysis strategies. Finally, we discuss several network reconstruction approaches, including co-expression networks and Bayesian networks, as well as their limitations, and highlight the potential of Nested Effects Models for network reconstruction from scRNA-seq data. This article is part of a Special Issue entitled: Transcriptional Profiles and Regulatory Gene Networks edited by Dr. Dr. Federico Manuel Giorgi and Dr. Shaun Mahony.",2020 Jun;1863(6):194441.,1.0
31755816,Sepsis 2019: What Surgeons Need to Know,"The definition of sepsis continues to be as dynamic as the management strategies used to treat this. Sepsis-3 has replaced the earlier systemic inflammatory response syndrome (SIRS)-based diagnoses with the rapid Sequential Organ Failure Assessment (SOFA) score assisting in predicting overall prognosis with regards to mortality. Surgeons have an important role in ensuring adequate source control while recognizing the threat of carbapenem-resistance in gram-negative organisms. Rapid diagnostic tests are being used increasingly for the early identification of multi-drug-resistant organisms (MDROs), with a key emphasis on the multidisciplinary alert of results. Novel, higher generation antibiotic agents have been developed for resistance in ESKCAPE (Enterococcus faecium, Staphylococcus aureus, Klebsiella pneumoniae, Acinetobacter baumannii, Pseudomonas aeruginosa, and Enterobacter species) organisms while surgeons have an important role in the prevention of spread. The Study to Optimize Peritoneal Infection Therapy (STOP-IT) trial has challenged the previous paradigm of length of antibiotic treatment whereas biomarkers such as procalcitonin are playing a prominent role in individualizing therapy. Several novel therapies for refractory septic shock, while still investigational, are gaining prominence rapidly (such as vitamin C) whereas others await further clinical trials. Management strategies presented as care bundles continue to be updated by the Surviving Sepsis Campaign, yet still remain controversial in its global adoption. We have broadened our temporal and epidemiologic perspective of sepsis by understanding it both as an acute, time-sensitive, life-threatening illness to a chronic condition that increases the risk of mortality up to five years post-discharge. Artificial intelligence, machine learning, and bedside scoring systems can assist the clinician in predicting post-operative sepsis. The public health role of the surgeon is key. This includes collaboration and multi-disciplinary antibiotic stewardship at a hospital level. It also requires controlling pharmaceutical sales and the unregulated dispensing of antibiotic agents globally through policy initiatives to control emerging resistance through prevention.",2020 Apr;21(3):195-204.,
31755802,An overview of deep learning algorithms and water exchange in colonoscopy in improving adenoma detection,"Introduction: Among the Gastrointestinal (GI) Endoscopy Editorial Board top 10 topics in advances in endoscopy in 2018, water exchange colonoscopy and artificial intelligence were both considered important advances. Artificial intelligence holds the potential to increase and water exchange significantly increases adenoma detection.Areas covered: The authors searched MEDLINE (1998-2019) using the following medical subject terms: water-aided, water-assisted and water exchange colonoscopy, adenoma, artificial intelligence, deep learning, computer-assisted detection, and neural networks. Additional related studies were manually searched from the reference lists of publications. Only fully published journal articles in English were reviewed. The latest date of the search was Aug10, 2019. Artificial intelligence, machine learning, and deep learning contribute to the promise of real-time computer-aided detection diagnosis. By emphasizing near-complete suction of infused water during insertion, water exchange provides salvage cleaning and decreases cleaning-related multi-tasking distractions during withdrawal, increasing adenoma detection. The review will address how artificial intelligence and water exchange can complement each other in improving adenoma detection during colonoscopy.Expert opinion: In 5 years, research on artificial intelligence will likely achieve real-time application and evaluation of factors contributing to quality colonoscopy. Better understanding and more widespread use of water exchange will be possible.",2019 Dec;13(12):1153-1160.,1.0
31754741,"Highlights of the special scientific sessions of the 46th Annual Scientific Meeting of the International Skeletal Society (ISS) 2019, Vancouver, Canada","This paper summarizes the highlights of the Scientific Sessions of the 46th Annual Scientific Meeting of the International Skeletal Society (ISS) which was hosted in Vancouver, Canada, in September 2019.",2020 Feb;49(2):333-335.,
31753325,A machine learning approach to predict surgical learning curves,"Background:                    Contemporary surgical training programs rely on the repetition of selected surgical motor tasks. Such methodology is inherently open ended with no control on the time taken to attain a set level of proficiency, given the trainees' intrinsic differences in initial skill levels and learning abilities. Hence, an efficient training program should aim at tailoring the surgical training protocols to each trainee. In this regard, a predictive model using information from the initial learning stage to predict learning curve characteristics should facilitate the whole surgical training process.              Methods:                    This paper analyzes learning curve data to train a multivariate supervised machine learning model. One factor is extracted to define the trainees' learning ability. An unsupervised machine learning model is also utilized for trainee classification. When established, the model can predict robustly the learning curve characteristics based on the first few trials.              Results:                    We show that the information present in the first 10 trials of surgical tasks can be utilized to predict the number of trials required to achieve proficiency (R2=0.72) and the final performance level (R2=0.89). Furthermore, only a single factor, learning index, is required to describe the learning process and to classify learners with unique learning characteristics.              Conclusion:                    Using machine learning models, we show, for the first time, that the first few trials contain sufficient information to predict learning curve characteristics and that a single factor can capture the complex learning behavior. Using such models holds the potential for personalization of training regimens, leading to greater efficiency and lower costs.",2020 Feb;167(2):321-327.,1.0
31749705,Applications of Deep-Learning in Exploiting Large-Scale and Heterogeneous Compound Data in Industrial Pharmaceutical Research,"In recent years, the development of high-throughput screening (HTS) technologies and their establishment in an industrialized environment have given scientists the possibility to test millions of molecules and profile them against a multitude of biological targets in a short period of time, generating data in a much faster pace and with a higher quality than before. Besides the structure activity data from traditional bioassays, more complex assays such as transcriptomics profiling or imaging have also been established as routine profiling experiments thanks to the advancement of Next Generation Sequencing or automated microscopy technologies. In industrial pharmaceutical research, these technologies are typically established in conjunction with automated platforms in order to enable efficient handling of screening collections of thousands to millions of compounds. To exploit the ever-growing amount of data that are generated by these approaches, computational techniques are constantly evolving. In this regard, artificial intelligence technologies such as deep learning and machine learning methods play a key role in cheminformatics and bio-image analytics fields to address activity prediction, scaffold hopping, de novo molecule design, reaction/retrosynthesis predictions, or high content screening analysis. Herein we summarize the current state of analyzing large-scale compound data in industrial pharmaceutical research and describe the impact it has had on the drug discovery process over the last two decades, with a specific focus on deep-learning technologies.",2019 Nov 5;10:1303.,6.0
31749074,Pre- and Paralinguistic Vocal Production in ASD: Birth Through School Age,"Purpose of review:                    We review what is known about how pre-linguistic vocal differences in autism spectrum disorder (ASD) unfold across development and consider whether vocalization features can serve as useful diagnostic indicators.              Recent findings:                    Differences in the frequency and acoustic quality of several vocalization types (e.g., babbles and cries) during the first year of life are associated with later ASD diagnosis. Paralinguistic features (e.g., prosody) measured during early and middle childhood can accurately classify current ASD diagnosis using cross-validated machine learning approaches. Pre-linguistic vocalization differences in infants are promising behavioral markers of later ASD diagnosis. In older children, paralinguistic features hold promise as diagnostic indicators as well as clinical targets. Future research efforts should focus on (1) bridging the gap between basic research and practical implementations of early vocalization-based risk assessment tools, and (2) demonstrating the clinical impact of targeting atypical vocalization features during social skill interventions for older children.",2019 Nov 20;21(12):126.,2.0
31748800,Promises and Perils of Artificial Intelligence in Neurosurgery,"Artificial intelligence (AI)-facilitated clinical automation is expected to become increasingly prevalent in the near future. AI techniques may permit rapid and detailed analysis of the large quantities of clinical data generated in modern healthcare settings, at a level that is otherwise impossible by humans. Subsequently, AI may enhance clinical practice by pushing the limits of diagnostics, clinical decision making, and prognostication. Moreover, if combined with surgical robotics and other surgical adjuncts such as image guidance, AI may find its way into the operating room and permit more accurate interventions, with fewer errors. Despite the considerable hype surrounding the impending medical AI revolution, little has been written about potential downsides to increasing clinical automation. These may include both direct and indirect consequences. Directly, faulty, inadequately trained, or poorly understood algorithms may produce erroneous results, which may have wide-scale impact. Indirectly, increasing use of automation may exacerbate de-skilling of human physicians due to over-reliance, poor understanding, overconfidence, and lack of necessary vigilance of an automated clinical workflow. Many of these negative phenomena have already been witnessed in other industries that have already undergone, or are undergoing ""automation revolutions,"" namely commercial aviation and the automotive industry. This narrative review explores the potential benefits and consequences of the anticipated medical AI revolution from a neurosurgical perspective.",2020 Jul 1;87(1):33-44.,
31746287,An Overview of Computational Tools of Nucleic Acid Binding Site Prediction for Site-specific Proteins and Nucleases,"Understanding the interaction mechanism of proteins and nucleic acids is one of the most fundamental problems for genome editing with engineered nucleases. Due to some limitations of experimental investigations, computational methods have played an important role in obtaining the knowledge of protein-nucleic acid interaction. Over the past few years, dozens of computational tools have been used for identification of nucleic acid binding site for site-specific proteins and design of site-specific nucleases because of their significant advantages in genome editing. Here, we review existing widely-used computational tools for target prediction of site-specific proteins as well as off-target prediction of site-specific nucleases. This article provides a list of on-line prediction tools according to their features followed by the description of computational methods used by these tools, which range from various sequence mapping algorithms (like Bowtie, FetchGWI and BLAST) to different machine learning methods (such as Support Vector Machine, hidden Markov models, Random Forest, elastic network and deep neural networks). We also make suggestions on the further development in improving the accuracy of prediction methods. This survey will provide a reference guide for computational biologists working in the field of genome editing.",2020;27(5):370-384.,
31746088,Role of Breast MRI in the Evaluation and Detection of DCIS: Opportunities and Challenges,"Historically, breast magnetic resonance imaging (MRI) was not considered an effective modality in the evaluation of ductal carcinoma in situ (DCIS). Over the past decade this has changed, with studies demonstrating that MRI is the most sensitive imaging tool for detection of all grades of DCIS. It has been suggested that not only is breast MRI the most sensitive imaging tool for detection but it may also detect the most clinically relevant DCIS lesions. The role and outcomes of MRI in the preoperative setting for patients with DCIS remains controversial; however, several studies have shown benefit in the preoperative evaluation of extent of disease as well as predicting an underlying invasive component. The most common presentation of DCIS on MRI is nonmass enhancement (NME) in a linear or segmental distribution pattern. Maximizing breast MRI spatial resolution is therefore beneficial, given the frequent presentation of DCIS as NME on MRI. Emerging MRI techniques, such as diffusion-weighted imaging (DWI), have shown promising potential to discriminate DCIS from benign and invasive lesions. Future opportunities including advanced imaging visual techniques, radiomics/radiogenomics, and machine learning / artificial intelligence may also be applicable to the detection and treatment of DCIS. Level of Evidence: 3 Technical Efficacy Stage: 3 J. Magn. Reson. Imaging 2019. J. Magn. Reson. Imaging 2020;52:697-709.",2020 Sep;52(3):697-709.,2.0
31743905,Artificial Intelligence Techniques for Automated Diagnosis of Neurological Disorders,"Background:                    Authors have been advocating the research ideology that a computer-aided diagnosis (CAD) system trained using lots of patient data and physiological signals and images based on adroit integration of advanced signal processing and artificial intelligence (AI)/machine learning techniques in an automated fashion can assist neurologists, neurosurgeons, radiologists, and other medical providers to make better clinical decisions.              Summary:                    This paper presents a state-of-the-art review of research on automated diagnosis of 5 neurological disorders in the past 2 decades using AI techniques: epilepsy, Parkinson's disease, Alzheimer's disease, multiple sclerosis, and ischemic brain stroke using physiological signals and images. Recent research articles on different feature extraction methods, dimensionality reduction techniques, feature selection, and classification techniques are reviewed. Key Message: CAD systems using AI and advanced signal processing techniques can assist clinicians in analyzing and interpreting physiological signals and images more effectively.",2019;82(1-3):41-64.,3.0
31742424,CAD and AI for breast cancer-recent development and challenges,"Computer-aided diagnosis (CAD) has been a popular area of research and development in the past few decades. In CAD, machine learning methods and multidisciplinary knowledge and techniques are used to analyze the patient information and the results can be used to assist clinicians in their decision making process. CAD may analyze imaging information alone or in combination with other clinical data. It may provide the analyzed information directly to the clinician or correlate the analyzed results with the likelihood of certain diseases based on statistical modeling of the past cases in the population. CAD systems can be developed to provide decision support for many applications in the patient care processes, such as lesion detection, characterization, cancer staging, treatment planning and response assessment, recurrence and prognosis prediction. The new state-of-the-art machine learning technique, known as deep learning (DL), has revolutionized speech and text recognition as well as computer vision. The potential of major breakthrough by DL in medical image analysis and other CAD applications for patient care has brought about unprecedented excitement of applying CAD, or artificial intelligence (AI), to medicine in general and to radiology in particular. In this paper, we will provide an overview of the recent developments of CAD using DL in breast imaging and discuss some challenges and practical issues that may impact the advancement of artificial intelligence and its integration into clinical workflow.",2020 Apr;93(1108):20190580.,4.0
31737621,Raman Spectroscopy: Guiding Light for the Extracellular Matrix,"The extracellular matrix (ECM) consists of a complex mesh of proteins, glycoproteins, and glycosaminoglycans, and is essential for maintaining the integrity and function of biological tissues. Imaging and biomolecular characterization of the ECM is critical for understanding disease onset and for the development of novel, disease-modifying therapeutics. Recently, there has been a growing interest in the use of Raman spectroscopy to characterize the ECM. Raman spectroscopy is a label-free vibrational technique that offers unique insights into the structure and composition of tissues and cells at the molecular level. This technique can be applied across a broad range of ECM imaging applications, which encompass in vitro, ex vivo, and in vivo analysis. State-of-the-art confocal Raman microscopy imaging now enables label-free assessments of the ECM structure and composition in tissue sections with a remarkably high degree of biomolecular specificity. Further, novel fiber-optic instrumentation has opened up for clinical in vivo ECM diagnostic measurements across a range of tissue systems. A palette of advanced computational methods based on multivariate statistics, spectral unmixing, and machine learning can be applied to Raman data, allowing for the extraction of specific biochemical information of the ECM. Here, we review Raman spectroscopy techniques for ECM characterizations over a variety of exciting applications and tissue systems, including native tissue assessments (bone, cartilage, cardiovascular), regenerative medicine quality assessments, and diagnostics of disease states. We further discuss the challenges in the widespread adoption of Raman spectroscopy in biomedicine. The results of the latest discovery-driven Raman studies are summarized, illustrating the current and potential future applications of Raman spectroscopy in biomedicine.",2019 Nov 1;7:303.,6.0
31737349,Pre-hospital and emergency department pathways of care for exacerbations of chronic obstructive pulmonary disease (COPD),"Exacerbations are serious complications of chronic obstructive pulmonary disease (COPD) that often require acute care from pre-hospital and emergency department (ED) services. Despite being a frequent cause of emergency presentations, gaps remain in both literature and practice for emergency care pathways of COPD exacerbations. This review seeks to address these gaps and focuses on the literature of pre-hospital and ED systems of care and how these intersect with patients experiencing an exacerbation of COPD. The literature in this area is expanding rapidly; however, more research is required to further understand exacerbations and how they are addressed by emergency medical services worldwide. For the purpose of this review, the pre-hospital domain includes ambulance and other emergency transport services, and encompasses medical interventions delivered prior to arrival at an ED or hospital. The ED domain is defined as the area of a hospital or free-standing centre where patients arrive to receive emergent medical care prior to admission. In many studies there is a significant overlap between these two domains and frequent intersection and collaboration between services. In both of these domains, for the management of COPD exacerbations, several overarching themes have been identified in the literature. These include: the appropriate delivery of oxygen in the emergency setting; strategies to improve the provision of care in accordance with diagnostic and treatment guidelines; strategies to reduce the requirement for emergency presentations; and, technological advances including machine learning which are helping to improve emergency healthcare systems.",2019 Oct;11(Suppl 17):S2221-S2229.,
31734566,Machine learning for target discovery in drug development,"The discovery of macromolecular targets for bioactive agents is currently a bottleneck for the informed design of chemical probes and drug leads. Typically, activity profiling against genetically manipulated cell lines or chemical proteomics is pursued to shed light on their biology and deconvolute drug-target networks. By taking advantage of the ever-growing wealth of publicly available bioactivity data, learning algorithms now provide an attractive means to generate statistically motivated research hypotheses and thereby prioritize biochemical screens. Here, we highlight recent successes in machine intelligence for target identification and discuss challenges and opportunities for drug discovery.",2020 Jun;56:16-22.,4.0
31733673,Biomarkers of Infection and Sepsis,"The role of biomarkers for detection of sepsis has come a long way. Molecular biomarkers are taking front stage at present, but machine learning and other computational measures using bigdata sets are promising. Clinical research in sepsis is hampered by lack of specificity of the diagnosis; sepsis is a syndrome with no uniformly agreed definition. This lack of diagnostic precision means there is no gold standard for this diagnosis. The final conclusion is expert opinion, which is not bad but not perfect. Perhaps machine learning will displace expert opinion as the final and most accurate definition for sepsis.",2020 Jan;36(1):11-22.,4.0
