pmid,title,text,date,citations
33386098,Selecting machine-learning scoring functions for structure-based virtual screening,"Interest in docking technologies has grown parallel to the ever increasing number and diversity of 3D models for macromolecular therapeutic targets. Structure-Based Virtual Screening (SBVS) aims at leveraging these experimental structures to discover the necessary starting points for the drug discovery process. It is now established that Machine Learning (ML) can strongly enhance the predictive accuracy of scoring functions for SBVS by exploiting large datasets from targets, molecules and their associations. However, with greater choice, the question of which ML-based scoring function is the most suitable for prospective use on a given target has gained importance. Here we analyse two approaches to select an existing scoring function for the target along with a third approach consisting in generating a scoring function tailored to the target. These analyses required discussing the limitations of popular SBVS benchmarks, the alternatives to benchmark scoring functions for SBVS and how to generate them or use them using freely-available software.",2019 Dec;32-33:81-87.,1.0
33386097,Practical considerations for active machine learning in drug discovery,"Active machine learning enables the automated selection of the most valuable next experiments to improve predictive modelling and hasten active retrieval in drug discovery. Although a long established theoretical concept and introduced to drug discovery approximately 15 years ago, the deployment of active learning technology in the discovery pipelines across academia and industry remains slow. With the recent re-discovered enthusiasm for artificial intelligence as well as improved flexibility of laboratory automation, active learning is expected to surge and become a key technology for molecular optimizations. This review recapitulates key findings from previous active learning studies to highlight the challenges and opportunities of applying adaptive machine learning to drug discovery. Specifically, considerations regarding implementation, infrastructural integration, and expected benefits are discussed. By focusing on these practical aspects of active learning, this review aims at providing insights for scientists planning to implement active learning workflows in their discovery pipelines.",2019 Dec;32-33:73-79.,
33386095,On failure modes in molecule generation and optimization,"There has been a wave of generative models for molecules triggered by advances in the field of Deep Learning. These generative models are often used to optimize chemical compounds towards particular properties or a desired biological activity. The evaluation of generative models remains challenging and suggested performance metrics or scoring functions often do not cover all relevant aspects of drug design projects. In this work, we highlight some unintended failure modes in molecular generation and optimization and how these evade detection by current performance metrics.",2019 Dec;32-33:55-63.,
33386093,The art of atom descriptor design,"This review provides an overview of descriptions of atoms applied to the understanding of phenomena like chemical reactivity and selectivity, pKa values, Site of Metabolism prediction, or hydrogen bond strengths, but also the substitution of quantum mechanical calculations by machine learning models for energies, forces or even spectrosocopic properties and finally the fast calculation of atomic charges for force field parametrization. The descriptor space ranges from derivatives of the wavefunctions or electron density via quantum mechanics derived descriptors to classical descriptions of atoms and their embedding in a molecule. The common denominator for all approaches is the thorough understanding of the physics of the chemical problem that guided the design of the atom descriptor. Quantum mechanics (QM) and machine learning (ML) finally are converging to a new discipline, namely QM/ML.",2019 Dec;32-33:37-43.,1.0
31782286,Global perspective on carotid intima-media thickness and plaque: should the current measurement guidelines be revisited?,"Carotid intima-media thickness (cIMT) and carotid plaque (CP) currently act as risk predictors for CVD/Stroke risk assessment. Over 2000 articles have been published that cover either use cIMT/CP or alterations of cIMT/CP and additional image-based phenotypes to associate cIMT related markers with CVD/Stroke risk. These articles have shown variable results, which likely reflect a lack of standardization in the tools for measurement, risk stratification, and risk assessment. Guidelines for cIMT/CP measurement are influenced by major factors like the atherosclerosis disease itself, conventional risk factors, 10-year measurement tools, types of CVD/Stroke risk calculators, incomplete validation of measurement tools, and the fast pace of computer technology advancements. This review discusses the following major points: 1) the American Society of Echocardiography and Mannheim guidelines for cIMT/CP measurements; 2) forces that influence the guidelines; and 3) calculators for risk stratification and assessment under the influence of advanced intelligence methods. The review also presents the knowledge-based learning strategies such as machine and deep learning which may play a future role in CVD/stroke risk assessment. We conclude that both machine learning and non-machine learning strategies will flourish for current and 10-year CVD/Stroke risk prediction as long as they integrate image-based phenotypes with conventional risk factors.",2019 Dec;38(6):451-465.,5.0
31781215,Artificial Intelligence in Interventional Radiology: A Literature Review and Future Perspectives,"The term ""artificial intelligence"" (AI) includes computational algorithms that can perform tasks considered typical of human intelligence, with partial to complete autonomy, to produce new beneficial outputs from specific inputs. The development of AI is largely based on the introduction of artificial neural networks (ANN) that allowed the introduction of the concepts of ""computational learning models,"" machine learning (ML) and deep learning (DL). AI applications appear promising for radiology scenarios potentially improving lesion detection, segmentation, and interpretation with a recent application also for interventional radiology (IR) practice, including the ability of AI to offer prognostic information to both patients and physicians about interventional oncology procedures. This article integrates evidence-reported literature and experience-based perceptions to assist not only residents and fellows who are training in interventional radiology but also practicing colleagues who are approaching to locoregional mini-invasive treatments.",2019 Nov 3;2019:6153041.,2.0
31781015,Clinical Risk Score for Predicting Recurrence Following a Cerebral Ischemic Event,"Introduction: Recurrent stroke has a higher rate of death and disability. A number of risk scores have been developed to predict short-term and long-term risk of stroke following an initial episode of stroke or transient ischemic attack (TIA) with limited clinical utilities. In this paper, we review different risk score models and discuss their validity and clinical utilities. Methods: The PubMed bibliographic database was searched for original research articles on the various risk scores for risk of stroke following an initial episode of stroke or TIA. The validation of the models was evaluated by examining the internal and external validation process as well as statistical methodology, the study power, as well as the accuracy and metrics such as sensitivity and specificity. Results: Different risk score models have been derived from different study populations. Validation studies for these risk scores have produced conflicting results. Currently, ABCD2 score with diffusion weighted imaging (DWI) and Recurrence Risk Estimator at 90 days (RRE-90) are the two acceptable models for short-term risk prediction whereas Essen Stroke Risk Score (ESRS) and Stroke Prognosis Instrument-II (SPI-II) can be useful for prediction of long-term risk. Conclusion: The clinical risk scores that currently exist for predicting short-term and long-term risk of recurrent cerebral ischemia are limited in their performance and clinical utilities. There is a need for a better predictive tool which can overcome the limitations of current predictive models. Application of machine learning methods in combination with electronic health records may provide platform for development of new-generation predictive tools.",2019 Nov 12;10:1106.,4.0
31779139,Machine Learning Approaches for the Prioritization of Genomic Variants Impacting Pre-mRNA Splicing,"Defects in pre-mRNA splicing are frequently a cause of Mendelian disease. Despite the advent of next-generation sequencing, allowing a deeper insight into a patient's variant landscape, the ability to characterize variants causing splicing defects has not progressed with the same speed. To address this, recent years have seen a sharp spike in the number of splice prediction tools leveraging machine learning approaches, leaving clinical geneticists with a plethora of choices for in silico analysis. In this review, some basic principles of machine learning are introduced in the context of genomics and splicing analysis. A critical comparative approach is then used to describe seven recent machine learning-based splice prediction tools, revealing highly diverse approaches and common caveats. We find that, although great progress has been made in producing specific and sensitive tools, there is still much scope for personalized approaches to prediction of variant impact on splicing. Such approaches may increase diagnostic yields and underpin improvements to patient care.",2019 Nov 26;8(12):1513.,4.0
31779133,A Survey on Machine-Learning Techniques for UAV-Based Communications,"Unmanned aerial vehicles (UAVs) will be an integral part of the next generation wireless communication networks. Their adoption in various communication-based applications is expected to improve coverage and spectral efficiency, as compared to traditional ground-based solutions. However, this new degree of freedom that will be included in the network will also add new challenges. In this context, the machine-learning (ML) framework is expected to provide solutions for the various problems that have already been identified when UAVs are used for communication purposes. In this article, we provide a detailed survey of all relevant research works, in which ML techniques have been used on UAV-based communications for improving various design and functional aspects such as channel modeling, resource management, positioning, and security.",2019 Nov 26;19(23):5170.,3.0
31777668,Artificial Intelligence Applications in Type 2 Diabetes Mellitus Care: Focus on Machine Learning Methods,"Objectives:                    The incidence of type 2 diabetes mellitus has increased significantly in recent years. With the development of artificial intelligence applications in healthcare, they are used for diagnosis, therapeutic decision making, and outcome prediction, especially in type 2 diabetes mellitus. This study aimed to identify the artificial intelligence (AI) applications for type 2 diabetes mellitus care.              Methods:                    This is a review conducted in 2018. We searched the PubMed, Web of Science, and Embase scientific databases, based on a combination of related mesh terms. The article selection process was based on Preferred Reporting Items for Systematic Reviews and Meta-Analyses (PRISMA). Finally, 31 articles were selected after inclusion and exclusion criteria were applied. Data gathering was done by using a data extraction form. Data were summarized and reported based on the study objectives.              Results:                    The main applications of AI for type 2 diabetes mellitus care were screening and diagnosis in different stages. Among all of the reviewed AI methods, machine learning methods with 71% (n = 22) were the most commonly applied techniques. Many applications were in multi method forms (23%). Among the machine learning algorithms applications, support vector machine (21%) and naive Bayesian (19%) were the most commonly used methods. The most important variables that were used in the selected studies were body mass index, fasting blood sugar, blood pressure, HbA1c, triglycerides, low-density lipoprotein, high-density lipoprotein, and demographic variables.              Conclusions:                    It is recommended to select optimal algorithms by testing various techniques. Support vector machine and naive Bayesian might achieve better performance than other applications due to the type of variables and targets in diabetes-related outcomes classification.",2019 Oct;25(4):248-261.,5.0
31776737,Artificial intelligence and robotics: a combination that is changing the operating room,"Purpose:                    The aim of the current narrative review was to summarize the available evidence in the literature on artificial intelligence (AI) methods that have been applied during robotic surgery.              Methods:                    A narrative review of the literature was performed on MEDLINE/Pubmed and Scopus database on the topics of artificial intelligence, autonomous surgery, machine learning, robotic surgery, and surgical navigation, focusing on articles published between January 2015 and June 2019. All available evidences were analyzed and summarized herein after an interactive peer-review process of the panel.              Literature review:                    The preliminary results of the implementation of AI in clinical setting are encouraging. By providing a readout of the full telemetry and a sophisticated viewing console, robot-assisted surgery can be used to study and refine the application of AI in surgical practice. Machine learning approaches strengthen the feedback regarding surgical skills acquisition, efficiency of the surgical process, surgical guidance and prediction of postoperative outcomes. Tension-sensors on the robotic arms and the integration of augmented reality methods can help enhance the surgical experience and monitor organ movements.              Conclusions:                    The use of AI in robotic surgery is expected to have a significant impact on future surgical training as well as enhance the surgical experience during a procedure. Both aim to realize precision surgery and thus to increase the quality of the surgical care. Implementation of AI in master-slave robotic surgery may allow for the careful, step-by-step consideration of autonomous robotic surgery.",2020 Oct;38(10):2359-2366.,4.0
31772395,Intraoperative hypotension and its prediction,"Intraoperative hypotension (IOH) very commonly accompanies general anaesthesia in patients undergoing major surgical procedures. The development of IOH is unwanted, since it is associated with adverse outcomes such as acute kidney injury and myocardial injury, stroke and mortality. Although the definition of IOH is variable, harm starts to occur below a mean arterial pressure (MAP) threshold of 65 mmHg. The odds of adverse outcome increase for increasing duration and/or magnitude of IOH below this threshold, and even short periods of IOH seem to be associated with adverse outcomes. Therefore, reducing the hypotensive burden by predicting and preventing IOH through proactive appropriate treatment may potentially improve patient outcome. In this review article, we summarise the current state of the prediction of IOH by the use of so-called machine-learning algorithms. Machine-learning algorithms that use high-fidelity data from the arterial pressure waveform, may be used to reveal 'traits' that are unseen by the human eye and are associated with the later development of IOH. These algorithms can use large datasets for 'training', and can subsequently be used by clinicians for haemodynamic monitoring and guiding therapy. A first clinically available application, the hypotension prediction index (HPI), is aimed to predict an impending hypotensive event, and additionally, to guide appropriate treatment by calculated secondary variables to asses preload (dynamic preload variables), contractility (dP/dtmax), and afterload (dynamic arterial elastance, Eadyn). In this narrative review, we summarise the current state of the prediction of hypotension using such novel, automated algorithms and we will highlight HPI and the secondary variables provided to identify the probable origin of the (impending) hypotensive event.",2019 Nov;63(11):877-885.,4.0
31771246,Wearable-Sensor-based Detection and Prediction of Freezing of Gait in Parkinson's Disease: A Review,"Freezing of gait (FOG) is a serious gait disturbance, common in mid- and late-stage Parkinson's disease, that affects mobility and increases fall risk. Wearable sensors have been used to detect and predict FOG with the ultimate aim of preventing freezes or reducing their effect using gait monitoring and assistive devices. This review presents and assesses the state of the art of FOG detection and prediction using wearable sensors, with the intention of providing guidance on current knowledge, and identifying knowledge gaps that need to be filled and challenges to be considered in future studies. This review searched the Scopus, PubMed, and Web of Science databases to identify studies that used wearable sensors to detect or predict FOG episodes in Parkinson's disease. Following screening, 74 publications were included, comprising 68 publications detecting FOG, seven predicting FOG, and one in both categories. Details were extracted regarding participants, walking task, sensor type and body location, detection or prediction approach, feature extraction and selection, classification method, and detection and prediction performance. The results showed that increasingly complex machine-learning algorithms combined with diverse feature sets improved FOG detection. The lack of large FOG datasets and highly person-specific FOG manifestation were common challenges. Transfer learning and semi-supervised learning were promising for FOG detection and prediction since they provided person-specific tuning while preserving model generalization.",2019 Nov 24;19(23):5141.,7.0
31767810,Deep biomarkers of aging and longevity: from research to applications,"Multiple recent advances in machine learning enabled computer systems to exceed human performance in many tasks including voice, text, and speech recognition and complex strategy games. Aging is a complex multifactorial process driven by and resulting in the many minute changes transpiring at every level of the human organism. Deep learning systems trained on the many measurable features changing in time can generalize and learn the many biological processes on the population and individual levels. The deep age predictors can help advance aging research by establishing causal relationships in non-linear systems. Deep aging clocks can be used for identification of novel therapeutic targets, evaluating the efficacy of the various interventions, data quality control, data economics, prediction of health trajectories, mortality, and many other applications. Here we present the current state of development of the deep aging clocks in the context of the pharmaceutical research and development and clinical applications.",2019 Nov 25;11(22):10771-10780.,7.0
31767194,"The digital surgeon: How big data, automation, and artificial intelligence will change surgical practice","Exponential growth in computing power, data storage, and sensing technology has led to a world in which we can both capture and analyze incredible amounts of data. The evolution of machine learning has further advanced the ability of computers to develop insights from massive data sets that are beyond the capacity of human analysis. The convergence of computational power, data storage, connectivity, and Artificial Intelligence (AI) has led to health technologies that, to date, have focused on diagnostic areas such as radiology and pathology. The question remains how the digital revolution will translate in the realm of surgery. There are three main areas where the authors believe that AI could impact surgery in the near future: enhancement of training modalities, cognitive enhancement of the surgeon, and procedural automation. While the promise of Big Data, AI, and Automation is high, there have been unanticipated missteps in the use of such technologies that are worth considering as we evaluate how such technologies could/should be adopted in surgical practice. Surgeons must be prepared to adopt smarter training modalities, supervise the learning of machines that can enhance cognitive function, and ultimately oversee autonomous surgery without allowing for a decay in the surgeon's operating skills.",2020 Jan;55S:47-50.,3.0
31766686,Electronic Tongues for Inedible Media,"""Electronic tongues"", ""taste sensors"", and similar devices (further named as ""multisensor systems"", or MSS) have been studied and applied mostly for the analysis of edible analytes. This is not surprising, since the MSS development was sometimes inspired by the mainstream idea that they could substitute human gustatory tests. However, the basic principle behind multisensor systems-a combination of an array of cross-sensitive chemical sensors for liquid analysis and a machine learning engine for multivariate data processing-does not imply any limitations on the application of such systems for the analysis of inedible media. This review deals with the numerous MSS applications for the analysis of inedible analytes, among other things, for agricultural and medical purposes.",2019 Nov 22;19(23):5113.,1.0
31762579,A Review of Machine Learning Approaches in Assisted Reproductive Technologies,"Introduction:                    Assisted reproductive technologies (ART) are recent improvements in infertility treatment. However, there is no significant increase in pregnancy rates with the aid of ART. Costly and complex process of ART's makes them as challenging issues. Computational prediction models could predict treatment outcome, before the start of an ART cycle.              Aim:                    This review provides an overview on machine learning-based prediction models in ART.              Methods:                    This article was executed based on a literature review through scientific databases search such as PubMed, Scopus, Web of Science and Google Scholar.              Results:                    We identified 20 papers reporting on machine learning-based prediction models in IVF or ICSI settings. All of the models were validated only by internal validation. Therefore, external validation of the models and the impact analysis of them were the missing parts of the all studies.              Conclusion:                    Machine learning-based prediction models provide a clinical decision support tool for both clinicians and patients and lead to improvement in ART success rates.",2019 Sep;27(3):205-211.,5.0
31761063,Imaging of Central Nervous System Tumors Based on the 2016 World Health Organization Classification,"The 2016 World Health Organization Classification of Tumors of the Central Nervous System (CNS) incorporated well-established molecular markers known to drive tumorigenesis and tumor behavior into the existing classification of CNS tumors based on histopathologic appearance. This integrated classification system has led to a major restructuring of the diffuse gliomas. In addition, it resulted in the categorization of medulloblastomas into four distinct molecular subgroups. Radiogenomic studies have revealed key imaging differences between certain genetic groups and may aid in the diagnosis, longitudinal assessment of treatment response, and evaluation of tumor recurrence in patients with brain tumors.",2020 Feb;38(1):95-113.,3.0
31759575,Widespread Morphometric Abnormalities in Major Depression: Neuroplasticity and Potential for Biomarker Development,Major depression is common and debilitating. Identifying neurobiological subtypes that comprise the disorder and predict clinical outcome are key challenges. Genetic and environmental factors leading to major depression are expressed in neural structure and function. Volumetric decreases in gray matter have been demonstrated in corticolimbic circuits involved in emotion regulation. MR imaging observable abnormalities reflect cytoarchitectonic alterations within a local neuroendocrine milieu with systemic effects. Multivariate pattern analysis offers the potential to identify the neurobiological subtypes and predictors of clinical outcome. It is essential to characterize disease heterogeneity by incorporating data-driven inductive and symptom-based deductive approaches in an iterative process.,2020 Feb;30(1):85-95.,
31759574,Neuroimaging in Schizophrenia,"Schizophrenia is a chronic psychotic disorder with a lifetime prevalence of about 1%. Onset is typically in adolescence or early adulthood; characteristic symptoms include positive symptoms, negative symptoms, and impairments in cognition. Neuroimaging studies have shown substantive evidence of brain structural, functional, and neurochemical alterations that are more pronounced in the association cortex and subcortical regions. These abnormalities are not sufficiently specific to be of diagnostic value, but there may be a role for imaging techniques to provide predictions of outcome. Incorporating multimodal imaging datasets using machine learning approaches may offer better diagnostic and predictive value in schizophrenia.",2020 Feb;30(1):73-83.,4.0
