pmid,citations,title,date,text
30170101,19.0,A Deep Look Into the Future of Quantitative Imaging in Oncology: A Statement of Working Principles and Proposal for Change,2018 Nov 15;102(4):1074-1082.,"The adoption of enterprise digital imaging, along with the development of quantitative imaging methods and the re-emergence of statistical learning, has opened the opportunity for more personalized cancer treatments through transformative data science research. In the last 5 years, accumulating evidence has indicated that noninvasive advanced imaging analytics (i.e., radiomics) can reveal key components of tumor phenotype for multiple lesions at multiple time points over the course of treatment. Many groups using homegrown software have extracted engineered and deep quantitative features on 3-dimensional medical images for better spatial and longitudinal understanding of tumor biology and for the prediction of diverse outcomes. These developments could augment patient stratification and prognostication, buttressing emerging targeted therapeutic approaches. Unfortunately, the rapid growth in popularity of this immature scientific discipline has resulted in many early publications that miss key information or use underpowered patient data sets, without production of generalizable results. Quantitative imaging research is complex, and key principles should be followed to realize its full potential. The fields of quantitative imaging and radiomics in particular require a renewed focus on optimal study design and reporting practices, standardization, interpretability, data sharing, and clinical trials. Standardization of image acquisition, feature calculation, and statistical analysis (i.e., machine learning) are required for the field to move forward. A new data-sharing paradigm enacted among open and diverse participants (medical institutions, vendors and associations) should be embraced for faster development and comprehensive clinical validation of imaging biomarkers. In this review and critique of the field, we propose working principles and fundamental changes to the current scientific approach, with the goal of high-impact research and development of actionable prediction models that will yield more meaningful applications of precision cancer medicine."
30169341,2.0,What we can learn from Big Data about factors influencing perioperative outcome,2018 Dec;31(6):723-731.,"Purpose of review:                    This narrative review will discuss what value Big Data has to offer anesthesiology and aims to highlight recently published articles of large databases exploring factors influencing perioperative outcome. Additionally, the future perspectives of Big Data and its major pitfalls will be discussed.              Recent findings:                    The potential of Big Data has given an incentive to create nationwide and anesthesia-initiated registries like the MPOG and NACOR. These large databases have contributed in elucidating some of the rare perioperative complications, such as declined cognition after exposure to general anesthesia and epidural hematomas in parturients. Additionally, they are useful in finding patterns such as similar outcome in subtypes of beta-blockers and lower incidence of pneumonia in preoperative influenza vaccinations in the elderly.              Summary:                    Big Data is becoming increasingly popular with the collaborative collection of registries offering anesthesia a way to explore rare perioperative complications and outcome to encourage further hypotheses testing. Although Big Data has its flaws in security, lack of expertise and methodological concerns, the future potential of analytics combined with genomics, machine learning and real-time decision support looks promising."
30168572,2.0,Perspectives and applications of machine learning for evolutionary developmental biology,2018 Oct 8;14(5):289-306.,"Evolutionary Developmental Biology (Evo-Devo) is an ever-expanding field that aims to understand how development was modulated by the evolutionary process. In this sense, ""omic"" studies emerged as a powerful ally to unravel the molecular mechanisms underlying development. In this scenario, bioinformatics tools become necessary to analyze the growing amount of information. Among computational approaches, machine learning stands out as a promising field to generate knowledge and trace new research perspectives for bioinformatics. In this review, we aim to expose the current advances of machine learning applied to evolution and development. We draw clear perspectives and argue how evolution impacted machine learning techniques."
30167371,21.0,Structural neuroimaging as clinical predictor: A review of machine learning applications,2018 Aug 10;20:506-522.,"In this paper, we provide an extensive overview of machine learning techniques applied to structural magnetic resonance imaging (MRI) data to obtain clinical classifiers. We specifically address practical problems commonly encountered in the literature, with the aim of helping researchers improve the application of these techniques in future works. Additionally, we survey how these algorithms are applied to a wide range of diseases and disorders (e.g. Alzheimer's disease (AD), Parkinson's disease (PD), autism, multiple sclerosis, traumatic brain injury, etc.) in order to provide a comprehensive view of the state of the art in different fields."
30159406,24.0,Machine learning and image-based profiling in drug discovery,2018 Aug;10:43-52.,"The increase in imaging throughput, new analytical frameworks and high-performance computational resources open new avenues for data-rich phenotypic profiling of small molecules in drug discovery. Image-based profiling assays assessing single-cell phenotypes have been used to explore mechanisms of action, target efficacy and toxicity of small molecules. Technological advances to generate large data sets together with new machine learning approaches for the analysis of high-dimensional profiling data create opportunities to improve many steps in drug discovery. In this review, we will discuss how recent studies applied machine learning approaches in functional profiling workflows with a focus on chemical genetics. While their utility in image-based screening and profiling is predictably evident, examples of novel insights beyond the status quo based on the applications of machine learning approaches are just beginning to emerge. To enable discoveries, future studies also need to develop methodologies that lower the entry barriers to high-throughput profiling experiments by streamlining image-based profiling assays and providing applications for advanced learning technologies such as easy to deploy deep neural networks."
30158822,27.0,Natural Language Processing of Social Media as Screening for Suicide Risk,2018 Aug 27;10:1178222618792860.,"Suicide is among the 10 most common causes of death, as assessed by the World Health Organization. For every death by suicide, an estimated 138 people's lives are meaningfully affected, and almost any other statistic around suicide deaths is equally alarming. The pervasiveness of social media-and the near-ubiquity of mobile devices used to access social media networks-offers new types of data for understanding the behavior of those who (attempt to) take their own lives and suggests new possibilities for preventive intervention. We demonstrate the feasibility of using social media data to detect those at risk for suicide. Specifically, we use natural language processing and machine learning (specifically deep learning) techniques to detect quantifiable signals around suicide attempts, and describe designs for an automated system for estimating suicide risk, usable by those without specialized mental health training (eg, a primary care doctor). We also discuss the ethical use of such technology and examine privacy implications. Currently, this technology is only used for intervention for individuals who have ""opted in"" for the analysis and intervention, but the technology enables scalable screening for suicide risk, potentially identifying many people who are at risk preventively and prior to any engagement with a health care system. This raises a significant cultural question about the trade-off between privacy and prevention-we have potentially life-saving technology that is currently reaching only a fraction of the possible people at risk because of respect for their privacy. Is the current trade-off between privacy and prevention the right one?"
30157513,1.0,"Sensor, Signal, and Imaging Informatics in 2017",2018 Aug;27(1):110-113.,"Objective:                     To summarize significant contributions to sensor, signal, and imaging informatics literature published in 2017.              Methods:                     PubMed® and Web of Science® were searched to identify the scientific publications published in 2017 that addressed sensors, signals, and imaging in medical informatics. Fifteen papers were selected by consensus as candidate best papers. Each candidate article was reviewed by section editors and at least two other external reviewers. The final selection of the four best papers was conducted by the editorial board of the International Medical Informatics Association (IMIA) Yearbook.              Results:                     The selected papers of 2017 demonstrate the important scientific advances in management and analysis of sensor, signal, and imaging information.              Conclusion:                    The growth of signal and imaging data and the increasing power of machine learning techniques have engendered new opportunities for research in medical informatics. This synopsis highlights cutting-edge contributions to the science of Sensor, Signal, and Imaging Informatics."
30156155,9.0,Targeting Virus-host Protein Interactions: Feature Extraction and Machine Learning Approaches,2019;20(3):177-184.,"Background:                    Targeting critical viral-host Protein-Protein Interactions (PPIs) has enormous application prospects for therapeutics. Using experimental methods to evaluate all possible virus-host PPIs is labor-intensive and time-consuming. Recent growth in computational identification of virus-host PPIs provides new opportunities for gaining biological insights, including applications in disease control. We provide an overview of recent computational approaches for studying virus-host PPI interactions.              Methods:                    In this review, a variety of computational methods for virus-host PPIs prediction have been surveyed. These methods are categorized based on the features they utilize and different machine learning algorithms including classical and novel methods.              Results:                    We describe the pivotal and representative features extracted from relevant sources of biological data, mainly include sequence signatures, known domain interactions, protein motifs and protein structure information. We focus on state-of-the-art machine learning algorithms that are used to build binary prediction models for the classification of virus-host protein pairs and discuss their abilities, weakness and future directions.              Conclusion:                    The findings of this review confirm the importance of computational methods for finding the potential protein-protein interactions between virus and host. Although there has been significant progress in the prediction of virus-host PPIs in recent years, there is a lot of room for improvement in virus-host PPI prediction."
30155978,12.0,Current state and future prospects of artificial intelligence in ophthalmology: a review,2019 Jan;47(1):128-139.,"Artificial intelligence (AI) has emerged as a major frontier in computer science research. Although AI has broad application across many medical fields, it will have particular utility in ophthalmology and will dramatically change the diagnostic and treatment pathways for many eye conditions such as corneal ectasias, glaucoma, age-related macular degeneration and diabetic retinopathy. However, given that AI has primarily been driven as a computer science, its concepts and terminology are unfamiliar to many medical professionals. Important key terms such as machine learning and deep learning are often misunderstood and incorrectly used interchangeably. This article presents an overview of AI and new developments relevant to ophthalmology."
30153635,24.0,Applications of machine learning algorithms to predict therapeutic outcomes in depression: A meta-analysis and systematic review,2018 Dec 1;241:519-532.,"Background:                    No previous study has comprehensively reviewed the application of machine learning algorithms in mood disorders populations. Herein, we qualitatively and quantitatively evaluate previous studies of machine learning-devised models that predict therapeutic outcomes in mood disorders populations.              Methods:                    We searched Ovid MEDLINE/PubMed from inception to February 8, 2018 for relevant studies that included adults with bipolar or unipolar depression; assessed therapeutic outcomes with a pharmacological, neuromodulatory, or manual-based psychotherapeutic intervention for depression; applied a machine learning algorithm; and reported predictors of therapeutic response. A random-effects meta-analysis of proportions and meta-regression analyses were conducted.              Results:                    We identified 639 records: 75 full-text publications were assessed for eligibility; 26 studies (n=17,499) and 20 studies (n=6325) were included in qualitative and quantitative review, respectively. Classification algorithms were able to predict therapeutic outcomes with an overall accuracy of 0.82 (95% confidence interval [CI] of [0.77, 0.87]). Pooled estimates of classification accuracy were significantly greater (p < 0.01) in models informed by multiple data types (e.g., composite of phenomenological patient features and neuroimaging or peripheral gene expression data; pooled proportion [95% CI] = 0.93[0.86, 0.97]) when compared to models with lower-dimension data types (pooledproportion=0.68[0.62,0.74]to0.85[0.81,0.88]).              Limitations:                    Most studies were retrospective; differences in machine learning algorithms and their implementation (e.g., cross-validation, hyperparameter tuning); cannot infer importance of individual variables fed into learning algorithm.              Conclusions:                    Machine learning algorithms provide a powerful conceptual and analytic framework capable of integrating multiple data types and sources. An integrative approach may more effectively model neurobiological components as functional modules of pathophysiology embedded within the complex, social dynamics that influence the phenomenology of mental disorders."
30149790,9.0,Hyperspectral Sensors and Imaging Technologies in Phytopathology: State of the Art,2018 Aug 25;56:535-558.,"Plant disease detection represents a tremendous challenge for research and practical applications. Visual assessment by human raters is time-consuming, expensive, and error prone. Disease rating and plant protection need new and innovative techniques to address forthcoming challenges and trends in agricultural production that require more precision than ever before. Within this context, hyperspectral sensors and imaging techniques-intrinsically tied to efficient data analysis approaches-have shown an enormous potential to provide new insights into plant-pathogen interactions and for the detection of plant diseases. This article provides an overview of hyperspectral sensors and imaging technologies for assessing compatible and incompatible plant-pathogen interactions. Within the progress of digital technologies, the vision, which is increasingly discussed in the society and industry, includes smart and intuitive solutions for assessing plant features in plant phenotyping or for making decisions on plant protection measures in the context of precision agriculture."
30149250,5.0,"Calcium detection, its quantification, and grayscale morphology-based risk stratification using machine learning in multimodality big data coronary and carotid scans: A review",2018 Oct 1;101:184-198.,"Purpose of review:                    Atherosclerosis is the leading cause of cardiovascular disease (CVD) and stroke. Typically, atherosclerotic calcium is found during the mature stage of the atherosclerosis disease. It is therefore often a challenge to identify and quantify the calcium. This is due to the presence of multiple components of plaque buildup in the arterial walls. The American College of Cardiology/American Heart Association guidelines point to the importance of calcium in the coronary and carotid arteries and further recommend its quantification for the prevention of heart disease. It is therefore essential to stratify the CVD risk of the patient into low- and high-risk bins.              Recent finding:                    Calcium formation in the artery walls is multifocal in nature with sizes at the micrometer level. Thus, its detection requires high-resolution imaging. Clinical experience has shown that even though optical coherence tomography offers better resolution, intravascular ultrasound still remains an important imaging modality for coronary wall imaging. For a computer-based analysis system to be complete, it must be scientifically and clinically validated. This study presents a state-of-the-art review (condensation of 152 publications after examining 200 articles) covering the methods for calcium detection and its quantification for coronary and carotid arteries, the pros and cons of these methods, and the risk stratification strategies. The review also presents different kinds of statistical models and gold standard solutions for the evaluation of software systems useful for calcium detection and quantification. Finally, the review concludes with a possible vision for designing the next-generation system for better clinical outcomes."
30139641,14.0,Complex-Trait Prediction in the Era of Big Data,2018 Oct;34(10):746-754.,"Accurate prediction of complex traits requires using a large number of DNA variants. Advances in statistical and machine learning methodology enable the identification of complex patterns in high-dimensional settings. However, training these highly parameterized methods requires very large data sets. Until recently, such data sets were not available. But the situation is changing rapidly as very large biomedical data sets comprising individual genotype-phenotype data for hundreds of thousands of individuals become available in public and private domains. We argue that the convergence of advances in methodology and the advent of Big Genomic Data will enable unprecedented improvements in complex-trait prediction; we review theory and evidence supporting our claim and discuss challenges and opportunities that Big Data will bring to complex-trait prediction."
30137230,1.0,Machine learning meets genome assembly,2019 Nov 27;20(6):2116-2129.,"Motivation:                    With the recent advances in DNA sequencing technologies, the study of the genetic composition of living organisms has become more accessible for researchers. Several advances have been achieved because of it, especially in the health sciences. However, many challenges which emerge from the complexity of sequencing projects remain unsolved. Among them is the task of assembling DNA fragments from previously unsequenced organisms, which is classified as an NP-hard (nondeterministic polynomial time hard) problem, for which no efficient computational solution with reasonable execution time exists. However, several tools that produce approximate solutions have been used with results that have facilitated scientific discoveries, although there is ample room for improvement. As with other NP-hard problems, machine learning algorithms have been one of the approaches used in recent years in an attempt to find better solutions to the DNA fragment assembly problem, although still at a low scale.              Results:                    This paper presents a broad review of pioneering literature comprising artificial intelligence-based DNA assemblers-particularly the ones that use machine learning-to provide an overview of state-of-the-art approaches and to serve as a starting point for further study in this field."
30136381,29.0,Machine learning in major depression: From classification to treatment outcome prediction,2018 Nov;24(11):1037-1052.,"Aims:                    Major depression disorder (MDD) is the single greatest cause of disability and morbidity, and affects about 10% of the population worldwide. Currently, there are no clinically useful diagnostic biomarkers that are able to confirm a diagnosis of MDD from bipolar disorder (BD) in the early depressive episode. Therefore, exploring translational biomarkers of mood disorders based on machine learning is in pressing need, though it is challenging, but with great potential to improve our understanding of these disorders.              Discussions:                    In this study, we review popular machine-learning methods used for brain imaging classification and predictions, and provide an overview of studies, specifically for MDD, that have used magnetic resonance imaging data to either (a) classify MDDs from controls or other mood disorders or (b) investigate treatment outcome predictors for individual patients. Finally, challenges, future directions, and potential limitations related to MDD biomarker identification are also discussed, with a goal of offering a comprehensive overview that may help readers to better understand the applications of neuroimaging data mining in depression.              Conclusions:                    We hope such efforts may highlight the need for an urgently needed paradigm shift in treatment, to guide personalized optimal clinical care."
30126707,3.0,Pharmacovigilance: An Overview,2018 Dec;40(12):1991-2004.,"Purpose:                    Pharmacovigilance (PV) is a relatively new discipline in the pharmaceutical industry. Having undergone rapid growth over the past 2 decades, PV now touches many other disciplines in the research and development enterprise. With its growth has come a heightened awareness and interest in the medical community about the roles that PV plays. This article provides insights into the background and inner workings of PV.              Methods:                    This narrative review covers the core PV activities and other major areas of the pharmaceutical enterprise in which PV makes significant contributions.              Findings:                    Drug safety monitoring activities were organized by the US Food and Drug Administration and academic medical centers in the early 1950s in response to growing concern over the occurrence of aplastic anemia and other blood dyscrasias associated with the use of chloramphenicol. This experience was codified in the 1962 Kefauver-Harris Amendments to the Federal Food, Drug and Cosmetic Act as adverse event evaluation and reporting requirements. The ensuing decades have seen the development of core PV functions for pharmaceutical companies: case management, signal management, and benefit-risk management. A broader scope of PV has developed to include the following major activities: support of patient safety during the conduct of clinical trials through assuring proper use of informed consent and institutional review boards (ethics committees); selection of the first safe dose for use in humans, based on pharmacologic data obtained in animal studies; development of the safety profile for proper use of a new molecular entity and appropriate communication of that information to the range of relevant stakeholders; attendance to surveillance activities through a set of signal management processes; monitoring the manufactured product itself through collaborative activities with manufacturing professionals; management of benefit-risk to assure appropriate use in medical care after marketing; and maintenance of inspection readiness as a corporate cultural process.              Implications:                    The extent and pace of change promise to accelerate with the integration of biomedical informatics, analytics, artificial intelligence, and machine learning. This progress has implications for the development of the next generation of PV professionals who will need to be trained in entirely new skill sets to lead continued improvements in the safe use of pharmaceuticals."
33141723,1.0,"Robots for the people, by the people: Personalizing human-machine interaction",2018 Aug 22;3(21):eaat7451.,"Multimodal, interactive, and multitask machine learning can be applied to personalize human-robot and human-machine interactions for the broad diversity of individuals and their unique needs."
