pmid,citations,title,date,text
30053138,3.0,Sequencing era methods for identifying signatures of selection in the genome,2019 Nov 27;20(6):1997-2008.,"Insights into genetic loci which are under selection and their functional roles contribute to increased understanding of the patterns of phenotypic variation we observe today. The availability of whole-genome sequence data, for humans and other species, provides opportunities to investigate adaptation and evolution at unprecedented resolution. Many analytical methods have been developed to interrogate these large data sets and characterize signatures of selection in the genome. We review here recently developed methods and consider the impact of increased computing power and data availability on the detection of selection signatures. Consideration of demography, recombination and other confounding factors is important, and use of a range of methods in combination is a powerful route to resolving different forms of selection in genome sequence data. Overall, a substantial improvement in methods for application to whole-genome sequencing is evident, although further work is required to develop robust and computationally efficient approaches which may increase reproducibility across studies."
30051792,9.0,Applications of Machine Learning Methods in Drug Toxicity Prediction,2018;18(12):987-997.,"Toxicity evaluation is an important part of the preclinical safety assessment of new drugs, which is directly related to human health and the fate of drugs. It is of importance to study how to evaluate drug toxicity accurately and economically. The traditional in vitro and in vivo toxicity tests are laborious, time-consuming, highly expensive, and even involve animal welfare issues. Computational methods developed for drug toxicity prediction can compensate for the shortcomings of traditional methods and have been considered useful in the early stages of drug development. Numerous drug toxicity prediction models have been developed using a variety of computational methods. With the advance of the theory of machine learning and molecular representation, more and more drug toxicity prediction models are developed using a variety of machine learning methods, such as support vector machine, random forest, naive Bayesian, back propagation neural network. And significant advances have been made in many toxicity endpoints, such as carcinogenicity, mutagenicity, and hepatotoxicity. In this review, we aimed to provide a comprehensive overview of the machine learning based drug toxicity prediction studies conducted in recent years. In addition, we compared the performance of the models proposed in these studies in terms of accuracy, sensitivity, and specificity, providing a view of the current state-of-the-art in this field and highlighting the issues in the current studies."
30051410,7.0,"Big-Data Analysis, Cluster Analysis, and Machine-Learning Approaches",2018;1065:607-626.,"Medicine will experience many changes in the coming years because the so-called ""medicine of the future"" will be increasingly proactive, featuring four basic elements: predictive, personalized, preventive, and participatory. Drivers for these changes include the digitization of data in medicine and the availability of computational tools that deal with massive volumes of data. Thus, the need to apply machine-learning methods to medicine has increased dramatically in recent years while facing challenges related to an unprecedented large number of clinically relevant features and highly specific diagnostic tests. Advances regarding data-storage technology and the progress concerning genome studies have enabled collecting vast amounts of patient clinical details, thus permitting the extraction of valuable information. In consequence, big-data analytics is becoming a mandatory technology to be used in the clinical domain.Machine learning and big-data analytics can be used in the field of cardiology, for example, for the prediction of individual risk factors for cardiovascular disease, for clinical decision support, and for practicing precision medicine using genomic information. Several projects employ machine-learning techniques to address the problem of classification and prediction of heart failure (HF) subtypes and unbiased clustering analysis using dense phenomapping to identify phenotypically distinct HF categories. In this chapter, these ideas are further presented, and a computerized model allowing the distinction between two major HF phenotypes on the basis of ventricular-volume data analysis is discussed in detail."
30050769,1.0,"Computer Aided Nodule Analysis and Risk Yield (CANARY) characterization of adenocarcinoma: radiologic biopsy, risk stratification and future directions",2018 Jun;7(3):313-326.,"The majority of incidentally and screen-detected lung cancers are adenocarcinomas. Optimal management of these tumors is clinically challenging due to variability in tumor histopathology and behavior. Invasive adenocarcinoma (IA) is generally aggressive while adenocarcinoma in situ (AIS) and minimally invasive adenocarcinoma (MIA) may be extremely indolent. Computer Aided Nodule Analysis and Risk Yield (CANARY) is a quantitative computed tomography (CT) analysis tool that allows non-invasive assessment of tumor characteristics. This analysis may obviate the need for tissue biopsy and facilitate the risk stratification of adenocarcinoma of the lung. CANARY was developed by unsupervised machine learning techniques using CT data of histopathologically-characterized adenocarcinomas of the lung. This technique identified 9 distinct exemplars that constitute the spectrum of CT features found in adenocarcinoma of the lung. The distributions of these features in a nodule correlate with histopathology. Further automated clustering of CANARY nodules defined three distinct groups that have distinctly different post-resection disease free survival (DFS). CANARY has been validated within the NLST cohort and multiple other cohorts. Using semi-automated segmentation as input to CANARY, there is excellent repeatability and interoperator correlation of results. Confirmation and longitudinal tracking of indolent adenocarcinoma with CANARY may ultimately add decision support in nuanced cases where surgery may not be in the best interest of the patient due to competing comorbidity. Currently under investigation is CANARY's role in detecting differing driver mutations and tumor response to targeted chemotherapeutics. Combining the results from CANARY analysis with clinical information and other quantitative techniques such as analysis of the tumor-free surrounding lung may aid in building more powerful predictive models. The next step in CANARY investigation will be its prospective application, both in selecting low-risk stage 1 adenocarcinoma for active surveillance and investigation in selecting high-risk early stage adenocarcinoma for adjuvant therapy."
30050768,4.0,Lung cancer prediction using machine learning and advanced imaging techniques,2018 Jun;7(3):304-312.,"Machine learning based lung cancer prediction models have been proposed to assist clinicians in managing incidental or screen detected indeterminate pulmonary nodules. Such systems may be able to reduce variability in nodule classification, improve decision making and ultimately reduce the number of benign nodules that are needlessly followed or worked-up. In this article, we provide an overview of the main lung cancer prediction approaches proposed to date and highlight some of their relative strengths and weaknesses. We discuss some of the challenges in the development and validation of such techniques and outline the path to clinical adoption."
30050439,21.0,The Current State and Future of CRISPR-Cas9 gRNA Design Tools,2018 Jul 12;9:749.,"Recent years have seen the development of computational tools to assist researchers in performing CRISPR-Cas9 experiment optimally. More specifically, these tools aim to maximize on-target activity (guide efficiency) while also minimizing potential off-target effects (guide specificity) by analyzing the features of the target site. Nonetheless, currently available tools cannot robustly predict experimental success as prediction accuracy depends on the approximations of the underlying model and how closely the experimental setup matches the data the model was trained on. Here, we present an overview of the available computational tools, their current limitations and future considerations. We discuss new trends around personalized health by taking genomic variants into account when predicting target sites as well as discussing other governing factors that can improve prediction accuracy."
30049875,74.0,Inverse molecular design using machine learning: Generative models for matter engineering,2018 Jul 27;361(6400):360-365.,"The discovery of new materials can bring enormous societal and technological progress. In this context, exploring completely the large space of potential materials is computationally intractable. Here, we review methods for achieving inverse design, which aims to discover tailored materials from the starting point of a particular desired functionality. Recent advances from the rapidly growing field of artificial intelligence, mostly from the subfield of machine learning, have resulted in a fertile exchange of ideas, where approaches to inverse molecular design are being proposed and employed at a rapid pace. Among these, deep generative models have been applied to numerous classes of materials: rational design of prospective drugs, synthetic routes to organic compounds, and optimization of photovoltaics and redox flow batteries, as well as a variety of other solid-state materials."
30049358,12.0,The Emerging Role of Wearable Technologies in Detection of Arrhythmia,2018 Aug;34(8):1083-1087.,"Over the past decade, there has been an explosion of consumer devices for the purposes of health and fitness tracking. The wearable technology market, composed of devices that monitor physiological parameters, such as heart rate and sleep pattern, is anticipated to grow to 929 million connected devices in 2021. These devices encompass wristbands, glasses, in-ear monitors, or electronic shirts, with varying capacity to monitor heart rate, heart rhythm, blood pressure, physical activity, respiratory rate, blood glucose, and sleep patterns. For heart-rate monitoring, most wearable devices use photoplethysmography (PPG) technology, meaning they are inherently less accurate than conventional electrocardiography monitoring techniques (reference standard). However, a growing body of evidence suggests that these technologies can be harnessed to facilitate arrhythmia detection in the appropriate context. Studies evaluating PPG-based wearables in conjunction with machine-learning algorithms have shown promise in detection of such arrhythmias, as atrial fibrillation. Limitations of wearable technologies include their accuracy and accessibility and the clinical implications of wearable-detected arrhythmias. Despite this, wearable technologies represent an important frontier in health evaluation. Future wearables will benefit from improved reliability and accuracy, collect additional health and fitness parameters, support management of chronic disease, and provide real-time connectivity and feedback that may supplant conventional medical monitoring. Wearables have the potential to become truly disruptive in our health care sector, with large segments of the population soon to have readily available health data that the physician must interpret."
30049182,12.0,Diagnostic Accuracy of Different Machine Learning Algorithms for Breast Cancer Risk Calculation: a Meta-Analysis,2018 Jul 27;19(7):1747-1752.,"Objective: The aim of this study was to determine the diagnostic accuracy of different machine learning algorithms for breast cancer risk calculation. Methods: A meta-analysis was conducted of published research articles on diagnostic test accuracy of different machine learning algorithms for breast cancer risk calculation published between January 2000 and May 2018 in the online article databases of PubMed, ProQuest and EBSCO. Paired forest plots were employed for the analysis. Numerical values for sensitivity and specificity were obtained from false negative (FN), false positive (FP), true negative (TN) and true positive (TP) rates, presented alongside graphical representations with boxes marking the values and horizontal lines showing the confidence intervals (CIs). Summary receiver operating characteristic (SROC) curves were applied to assess the performance of diagnostic tests. Data were processed using Review Manager 5.3 (RevMan 5.3). Results: A total of 1,879 articles were reviewed, of which 11 were selected for systematic review and meta-analysis. Fve algorithms for machine learning able to predict breast cancer risk were identified: Super Vector Machine (SVM); Artificial Neural Networks (ANN); Decision Tree (DT); Naive Bayes (NB); and K-Nearest Neighbor (KNN). With the SVM, the Area Under Curve (AUC) from the SROC was > 90%, therefore classified into the excellent category. Conclusion: The meta-analysis confirmed that the SVM algorithm is able to calculate breast cancer risk with better accuracy value than other machine learning algorithms."
30048078,,Artificial Intelligence and Machine Learning to Accelerate Translational Research: Proceedings of a Workshop—in Brief,,"The big data revolution, accompanied by the development and deployment of wearable medical devices and mobile health applications, has enabled the biomedical community to apply artificial intelligence (AI) and machine learning algorithms to vast amounts of data. This shift has created new research opportunities in predictive analytics, precision medicine, virtual diagnosis, patient monitoring, and drug discovery and delivery, which has garnered the interests of government, academic, and industry researchers alike and is already putting new tools in the hands of practitioners.                This boom in digital health opportunities has also raised numerous questions concerning the future of biomedical research and healthcare practices. How reliable are deployed AI-driven diagnostic tools, and what is the impact of these tools on doctors and patients? How vulnerable are algorithms to bias and unfairness? How can research improve the process of detecting unfairness in machine learning algorithms? How are other fields simultaneously advancing AI applications? How will academia prepare scientists with the skills to meet the demands of the newly transformed industry? Informed answers to these and other questions require interdisciplinary discussion and collaboration. On February 13 and 14, 2018, the National Academies of Sciences, Engineering, and Medicine convened a workshop to explore these and other questions related to the emerging use of AI and machine learning technologies in translational research. This publication summarizes the presentations and discussions from the workshop."
30048614,25.0,"Representation, Pattern Information, and Brain Signatures: From Neurons to Neuroimaging",2018 Jul 25;99(2):257-273.,"Human neuroimaging research has transitioned from mapping local effects to developing predictive models of mental events that integrate information distributed across multiple brain systems. Here we review work demonstrating how multivariate predictive models have been utilized to provide quantitative, falsifiable predictions; establish mappings between brain and mind with larger effects than traditional approaches; and help explain how the brain represents mental constructs and processes. Although there is increasing progress toward the first two of these goals, models are only beginning to address the latter objective. By explicitly identifying gaps in knowledge, research programs can move deliberately and programmatically toward the goal of identifying brain representations underlying mental states and processes."
30046072,114.0,Machine learning for molecular and materials science,2018 Jul;559(7715):547-555.,"Here we summarize recent progress in machine learning for the chemical sciences. We outline machine-learning techniques that are suitable for addressing research questions in this domain, as well as future directions for the field. We envisage a future in which the design, synthesis, characterization and application of molecules and materials is accelerated by artificial intelligence."
30044996,2.0,Machine learning detects EEG microstate alterations in patients living with temporal lobe epilepsy,2018 Oct;61:8-13.,"Purpose:                    Quasi-stable electrical distribution in EEG called microstates could carry useful information on the dynamics of large scale brain networks. Using machine learning techniques we explored if abnormalities in microstates can identify patients with Temporal Lobe Epilepsy (TLE) in the absence of an interictal discharge (IED).              Method:                    4 Classes of microstates were computed from 2 min artefact free EEG epochs in 42 subjects (21 TLE and 21 controls). The percentage of time coverage, frequency of occurrence and duration for each of these microstates were computed and redundancy reduced using feature selection methods. Subsequently, Fishers Linear Discriminant Analysis (FLDA) and logistic regression were used for classification.              Result:                    FLDA distinguished TLE with 76.1% accuracy (85.0% sensitivity, 66.6% specificity) considering frequency of occurrence and percentage of time coverage of microstate C as features.              Conclusion:                    Microstate alterations are present in patients with TLE. This feature might be useful in the diagnosis of epilepsy even in the absence of an IED."
30044963,4.0,Machine learning approaches infer vitamin D signaling: Critical impact of vitamin D receptor binding within topologically associated domains,2019 Jan;185:103-109.,"The vitamin D-modulated transcriptome of highly responsive human cells, such as THP-1 monocytes, comprises more than 500 genes, half of which are primary targets. Recently, we proposed a chromatin model of vitamin D signaling demonstrating that nearly all vitamin D target genes are located within vitamin D-modulated topologically associated domains (TADs). This model is based on genome-wide binding patterns of the vitamin D receptor (VDR), the pioneer transcription factor PU.1, the chromatin organizer CTCF and histone markers of active promoter regions (H3K4me3) and active chromatin (H3K27ac). In addition, time-dependent data on accessible chromatin and mRNA expression are implemented. For the interrogation and in deep inspection of these high-dimensional datasets unsupervised and supervised machine learning algorithms were applied. Unsupervised methods, such as the vector quantization tool K-means and the dimensionality reduction algorithm self-organizing map, generated descriptions of how attributes, such as VDR binding and chromatin accessibility, affect each other as a function of time and/or co-localization within the same genomic region. Supervised algorithms, such as random forests, allowed the data to be classified into pre-existing categories like persistent (i.e. constant) and time-dependent (i.e. transient) VDR binding sites. The relative amounts of these VDR categories in TADs showed to be the main discriminator for sorting the latter into five classes carrying vitamin D target genes involved in distinct biological processes. In conclusion, via the application of machine learning methods we identified the spatio-temporal VDR binding pattern in TADs as the most critical attribute for specific regulation of vitamin D target genes and the segregation of vitamin D's physiologic function."
30041284,13.0,Understanding Neurogastroenterology From Neuroimaging Perspective: A Comprehensive Review of Functional and Structural Brain Imaging in Functional Gastrointestinal Disorders,2018 Oct 1;24(4):512-527.,"This review provides a comprehensive overview of brain imaging studies of the brain-gut interaction in functional gastrointestinal disorders (FGIDs). Functional neuroimaging studies during gut stimulation have shown enhanced brain responses in regions related to sensory processing of the homeostatic condition of the gut (homeostatic afferent) and responses to salience stimuli (salience network), as well as increased and decreased brain activity in the emotional response areas and reduced activation in areas associated with the top-down modulation of visceral afferent signals. Altered central regulation of the endocrine and autonomic nervous responses, the key mediators of the brain-gut axis, has been demonstrated. Studies using resting-state functional magnetic resonance imaging reported abnormal local and global connectivity in the areas related to pain processing and the default mode network (a physiological baseline of brain activity at rest associated with self-awareness and memory) in FGIDs. Structural imaging with brain morphometry and diffusion imaging demonstrated altered gray- and white-matter structures in areas that also showed changes in functional imaging studies, although this requires replication. Molecular imaging by magnetic resonance spectroscopy and positron emission tomography in FGIDs remains relatively sparse. Progress using analytical methods such as machine learning algorithms may shift neuroimaging studies from brain mapping to predicting clinical outcomes. Because several factors contribute to the pathophysiology of FGIDs and because its population is quite heterogeneous, a new model is needed in future studies to assess the importance of the factors and brain functions that are responsible for an optimal homeostatic state."
30034462,,Mining Big Neuron Morphological Data,2018 Jun 24;2018:8234734.,"The advent of automatic tracing and reconstruction technology has led to a surge in the number of neurons 3D reconstruction data and consequently the neuromorphology research. However, the lack of machine-driven annotation schema to automatically detect the types of the neurons based on their morphology still hinders the development of this branch of science. Neuromorphology is important because of the interplay between the shape and functionality of neurons and the far-reaching impact on the diagnostics and therapeutics in neurological disorders. This survey paper provides a comprehensive research in the field of automatic neurons classification and presents the existing challenges, methods, tools, and future directions for automatic neuromorphology analytics. We summarize the major automatic techniques applicable in the field and propose a systematic data processing pipeline for automatic neuron classification, covering data capturing, preprocessing, analyzing, classification, and retrieval. Various techniques and algorithms in machine learning are illustrated and compared to the same dataset to facilitate ongoing research in the field."
30017512,15.0,A review of statistical and machine learning methods for modeling cancer risk using structured clinical data,2018 Aug;90:1-14.,"Advancements are constantly being made in oncology, improving prevention and treatment of cancers. To help reduce the impact and deadliness of cancers, they must be detected early. Additionally, there is a risk of cancers recurring after potentially curative treatments are performed. Predictive models can be built using historical patient data to model the characteristics of patients that developed cancer or relapsed. These models can then be deployed into clinical settings to determine if new patients are at high risk for cancer development or recurrence. For large-scale predictive models to be built, structured data must be captured for a wide range of diverse patients. This paper explores current methods for building cancer risk models using structured clinical patient data. Trends in statistical and machine learning techniques are explored, and gaps are identified for future research. The field of cancer risk prediction is a high-impact one, and research must continue for these models to be embraced for clinical decision support of both practitioners and patients."
30013818,1.0,Development of a Behavioral Health Stigma Measure and Application of Machine Learning for Classification,2018 Jun 1;15(5-6):34-42.,"Objective: Given the growing public health importance of measuring the change in mental health stigma over time, the goal of this study was to demonstrate the potential for using machine learning as a tool to analyze patterns of social stigma as a complement to traditional research methods. Methods: A total of 1,904 participants were recruited through Sona Systems, Ltd (Tallinn, Estonia), an experiment management system for online research, to complete a self-reported survey. The collected data were used to develop a new measure of mental (behavioral) health stigma. To build a classification predictive model of stigma, a decision tree was used as the data mining tool, wherein a set of classification rules was generated and tested for its ability to examine the prevalence of stigma. Results: A three-factor stigma model was supported and confirmed. Results indicate that the measure is content-valid and internally consistent. Performance evaluation of the machine learning-based classification algorithm revealed a sufficient inter-rater reliability with a predictive accuracy of 92.4 percent. Conclusion: This study illustrates the potential for applying machine learning to derive a data-driven understanding of the extent to which stigma is prevalent in society. It establishes a framework for the development of an index to track stigma over time and to assist healthcare decision-makers with improving the health of populations and the experience of care for patients."
