pmid,citations,title,date,text
28902409,10.0,Binswanger's disease: biomarkers in the inflammatory form of vascular cognitive impairment and dementia,2018 Mar;144(5):634-643.,"Vascular cognitive impairment and dementia (VCID) is a major public health concern because of the increased incidence of vascular disease in the aging population and the impact of vascular disease on Alzheimer's disease. VCID is a heterogeneous group of diseases for which there are no proven treatments. Biomarkers can be used to select more homogeneous populations. Small vessel disease is the most prevalent form of VCID and is the optimal form for treatment trials because there is a progressive course with characteristic pathological changes. Subcortical ischemic vascular disease of the Binswanger type (SIVD-BD) has a characteristic set of features that can be used both to identify patients and to follow treatment. SIVD-BD patients have clinical, neuropsychological, cerebrospinal fluid (CSF) and imaging features that can be used as biomarkers. No one feature is diagnostic, but a multimodal approach defines the SIVD-BD spectrum disorder. The most important features are large white matter lesions with axonal damage, blood-brain barrier disruption as shown by magnetic resonance imaging and CSF, and neuropsychological evidence of executive dysfunction. We have used these features to create a Binswanger Disease Scale and a probability of SIVD-BD, using a machine-learning algorithm. The patients discussed in this review are derived from published studies. Biomarkers not only aid in early diagnosis before the disease process has progressed too far for treatment, but also can indicate response to treatment. Refining the use of biomarkers will allow dementia treatment to enter the era of precision medicine. This article is part of the Special Issue ""Vascular Dementia""."
28893404,2.0,3D Quantitative Chemical Imaging of Tissues by Spectromics,2017 Dec;35(12):1194-1207.,"Mid-infrared (IR), Raman, and X-ray fluorescence (XRF) spectroscopy methods, as well as mass spectrometry (MS), can be used for 3D chemical imaging. These techniques offer an invaluable opportunity to access chemical features of biological samples in a nonsupervised way. The global chemical information they provide enables the exploitation of a large array of chemical species or parameters, so-called 'spectromics'. Extracting chemical data from spectra is critical for the high-quality chemical analysis of biosamples. Furthermore, these are the only currently available techniques that can quantitatively analyze tissue content (e.g., molecular concentrations) and substructures (e.g., cells or blood vessels). The development of chemical-derived biological metadata appears to be a new way to exploit spectral information with machine learning algorithms."
28892073,37.0,Progress and roadblocks in the search for brain-based biomarkers of autism and attention-deficit/hyperactivity disorder,2017 Aug 22;7(8):e1218.,"Children with neurodevelopmental disorders benefit most from early interventions and treatments. The development and validation of brain-based biomarkers to aid in objective diagnosis can facilitate this important clinical aim. The objective of this review is to provide an overview of current progress in the use of neuroimaging to identify brain-based biomarkers for autism spectrum disorder (ASD) and attention-deficit/hyperactivity disorder (ADHD), two prevalent neurodevelopmental disorders. We summarize empirical work that has laid the foundation for using neuroimaging to objectively quantify brain structure and function in ways that are beginning to be used in biomarker development, noting limitations of the data currently available. The most successful machine learning methods that have been developed and applied to date are discussed. Overall, there is increasing evidence that specific features (for example, functional connectivity, gray matter volume) of brain regions comprising the salience and default mode networks can be used to discriminate ASD from typical development. Brain regions contributing to successful discrimination of ADHD from typical development appear to be more widespread, however there is initial evidence that features derived from frontal and cerebellar regions are most informative for classification. The identification of brain-based biomarkers for ASD and ADHD could potentially assist in objective diagnosis, monitoring of treatment response and prediction of outcomes for children with these neurodevelopmental disorders. At present, however, the field has yet to identify reliable and reproducible biomarkers for these disorders, and must address issues related to clinical heterogeneity, methodological standardization and cross-site validation before further progress can be achieved."
28881183,51.0,From machine learning to deep learning: progress in machine intelligence for rational drug discovery,2017 Nov;22(11):1680-1685.,"Machine intelligence, which is normally presented as artificial intelligence, refers to the intelligence exhibited by computers. In the history of rational drug discovery, various machine intelligence approaches have been applied to guide traditional experiments, which are expensive and time-consuming. Over the past several decades, machine-learning tools, such as quantitative structure-activity relationship (QSAR) modeling, were developed that can identify potential biological active molecules from millions of candidate compounds quickly and cheaply. However, when drug discovery moved into the era of 'big' data, machine learning approaches evolved into deep learning approaches, which are a more powerful and efficient way to deal with the massive amounts of data generated from modern drug discovery approaches. Here, we summarize the history of machine learning and provide insight into recently developed deep learning approaches and their applications in rational drug discovery. We suggest that this evolution of machine intelligence now provides a guide for early-stage drug design and discovery in the current big data era."
28879175,4.0,Computer Vision Malaria Diagnostic Systems-Progress and Prospects,2017 Aug 21;5:219.,"Accurate malaria diagnosis is critical to prevent malaria fatalities, curb overuse of antimalarial drugs, and promote appropriate management of other causes of fever. While several diagnostic tests exist, the need for a rapid and highly accurate malaria assay remains. Microscopy and rapid diagnostic tests are the main diagnostic modalities available, yet they can demonstrate poor performance and accuracy. Automated microscopy platforms have the potential to significantly improve and standardize malaria diagnosis. Based on image recognition and machine learning algorithms, these systems maintain the benefits of light microscopy and provide improvements such as quicker scanning time, greater scanning area, and increased consistency brought by automation. While these applications have been in development for over a decade, recently several commercial platforms have emerged. In this review, we discuss the most advanced computer vision malaria diagnostic technologies and investigate several of their features which are central to field use. Additionally, we discuss the technological and policy barriers to implementing these technologies in low-resource settings world-wide."
28867500,1.0,Review of combinations of experimental and computational techniques to identify and understand genes involved in innate immunity and effector-triggered defence,2017 Dec 1;131:120-127.,"The innate immune system includes a first layer of defence that recognises conserved pathogen-associated molecular patterns that are essential for microbial fitness. Resistance (R) gene-based recognition of pathogen effectors, which function in modulation or avoidance of host immunity, activates a second layer of plant defence. In this review, experimental and computational techniques are considered to improve understanding of the plant immune system. Biocomputation contributes to discovery of the molecular genetic basis of host resistance against pathogens. Sequenced genomes have been used to identify R genes in plants. Resistance gene enrichment sequencing based on conserved protein domains has increased the number of R genes with nucleotide-binding site and leucine-rich repeat domains. Network analysis will contribute to an improved understanding of the innate immune system and identify novel genes for partial disease resistance. Machine learning algorithms are expected to become important in defining aspects of the immune system that are less well characterised, including identification of R genes that lack conserved protein domains."
28864356,12.0,Lensless digital holographic microscopy and its applications in biomedicine and environmental monitoring,2018 Mar 1;136:4-16.,"Optical compound microscope has been a major tool in biomedical imaging for centuries. Its performance relies on relatively complicated, bulky and expensive lenses and alignment mechanics. In contrast, the lensless microscope digitally reconstructs microscopic images of specimens without using any lenses, as a result of which it can be made much smaller, lighter and lower-cost. Furthermore, the limited space-bandwidth product of objective lenses in a conventional microscope can be significantly surpassed by a lensless microscope. Such lensless imaging designs have enabled high-resolution and high-throughput imaging of specimens using compact, portable and cost-effective devices to potentially address various point-of-care, global-health and telemedicine related challenges. In this review, we discuss the operation principles and the methods behind lensless digital holographic on-chip microscopy. We also go over various applications that are enabled by cost-effective and compact implementations of lensless microscopy, including some recent work on air quality monitoring, which utilized machine learning for high-throughput and accurate quantification of particulate matter in air. Finally, we conclude with a brief future outlook of this computational imaging technology."
28861708,3.0,Breast cancer cell nuclei classification in histopathology images using deep neural networks,2018 Feb;13(2):179-191.,"Purpose:                    Cell nuclei classification in breast cancer histopathology images plays an important role in effective diagnose since breast cancer can often be characterized by its expression in cell nuclei. However, due to the small and variant sizes of cell nuclei, and heavy noise in histopathology images, traditional machine learning methods cannot achieve desirable recognition accuracy. To address this challenge, this paper aims to present a novel deep neural network which performs representation learning and cell nuclei recognition in an end-to-end manner.              Methods:                    The proposed model hierarchically maps raw medical images into a latent space in which robustness is achieved by employing a stacked denoising autoencoder. A supervised classifier is further developed to improve the discrimination of the model by maximizing inter-subject separability in the latent space. The proposed method involves a cascade model which jointly learns a set of nonlinear mappings and a classifier from the given raw medical images. Such an on-the-shelf learning strategy makes obtaining discriminative features possible, thus leading to better recognition performance.              Results:                    Extensive experiments with benign and malignant breast cancer datasets are conducted to verify the effectiveness of the proposed method. Better performance was obtained when compared with other feature extraction methods, and higher recognition rate was achieved when compared with other seven classification methods.              Conclusions:                    We propose an end-to-end DNN model for cell nuclei and non-nuclei classification of histopathology images. It demonstrates that the proposed method can achieve promising performance in cell nuclei classification, and the proposed method is suitable for the cell nuclei classification task."
28845200,,Nature-Inspired Chemical Reaction Optimisation Algorithms,2017;9(4):411-422.,Nature-inspired meta-heuristic algorithms have dominated the scientific literature in the areas of machine learning and cognitive computing paradigm in the last three decades. Chemical reaction optimisation (CRO) is a population-based meta-heuristic algorithm based on the principles of chemical reaction. A chemical reaction is seen as a process of transforming the reactants (or molecules) through a sequence of reactions into products. This process of transformation is implemented in the CRO algorithm to solve optimisation problems. This article starts with an overview of the chemical reactions and how it is applied to the optimisation problem. A review of CRO and its variants is presented in the paper. Guidelines from the literature on the effective choice of CRO parameters for solution of optimisation problems are summarised.
28841086,152.0,Choosing Prediction Over Explanation in Psychology: Lessons From Machine Learning,2017 Nov;12(6):1100-1122.,"Psychology has historically been concerned, first and foremost, with explaining the causal mechanisms that give rise to behavior. Randomized, tightly controlled experiments are enshrined as the gold standard of psychological research, and there are endless investigations of the various mediating and moderating variables that govern various behaviors. We argue that psychology's near-total focus on explaining the causes of behavior has led much of the field to be populated by research programs that provide intricate theories of psychological mechanism but that have little (or unknown) ability to predict future behaviors with any appreciable accuracy. We propose that principles and techniques from the field of machine learning can help psychology become a more predictive science. We review some of the fundamental concepts and tools of machine learning and point out examples where these concepts have been used to conduct interesting and important psychological research that focuses on predictive research questions. We suggest that an increased focus on prediction, rather than explanation, can ultimately lead us to greater understanding of behavior."
28838801,4.0,Optimization of infobutton design and Implementation: A systematic review,2017 Oct;74:10-19.,"Objective:                    Infobuttons are clinical decision tools embedded in the electronic health record that attempt to link clinical data with context sensitive knowledge resources. We systematically reviewed technical approaches that contribute to improved infobutton design, implementation and functionality.              Methods:                    We searched databases including MEDLINE, EMBASE, and the Cochrane Library database from inception to March 1, 2016 for studies describing the use of infobuttons. We selected full review comparative studies, usability studies, and qualitative studies examining infobutton design and implementation. We abstracted usability measures such as user satisfaction, impact, and efficiency, as well as prediction accuracy of infobutton content retrieval algorithms and infobutton adoption/interoperability.              Results:                    We found 82 original research studies on infobuttons. Twelve studies met criteria for detailed abstraction. These studies investigated infobutton interoperability (1 study); tools to help tailor infobutton functionality (1 study); interventions to improve user experience (7 studies); and interventions to improve content retrieval by improving prediction of relevant knowledge resources and information needs (3 studies). In-depth interviews with implementers showed the Health Level Seven (HL7) Infobutton standard to be simple and easy to implement. A usability study demonstrated the feasibility of a tool to help medical librarians tailor infobutton functionality. User experience studies showed that access to resources with which users are familiar increased user satisfaction ratings; and that links to specific subsections of drug monographs increased information seeking efficiency. However, none of the user experience improvements led to increased usage uptake. Recommender systems based on machine learning algorithms outperformed hand-crafted rules in the prediction of relevant resources and clinicians' information needs in a laboratory setting, but no studies were found using these techniques in clinical settings. Improved content indexing in one study led to improved content retrieval across three health care organizations.              Conclusion:                    Best practice technical approaches to ensure optimal infobutton functionality, design and implementation remain understudied. The HL7 Infobutton standard has supported wide adoption of infobutton functionality among clinical information systems and knowledge resources. Limited evidence supports infobutton enhancements such as links to specific subtopics, configuration of optimal resources for specific tasks and users, and improved indexing and content coverage. Further research is needed to investigate user experience improvements to increase infobutton use and effectiveness."
28831921,5.0,In Silico Studies in Drug Research Against Neurodegenerative Diseases,2018;16(6):664-725.,"Background:                    Neurodegenerative diseases such as Alzheimer's disease (AD), amyotrophic lateral sclerosis, Parkinson's disease (PD), spinal cerebellar ataxias, and spinal and bulbar muscular atrophy are described by slow and selective degeneration of neurons and axons in the central nervous system (CNS) and constitute one of the major challenges of modern medicine. Computeraided or in silico drug design methods have matured into powerful tools for reducing the number of ligands that should be screened in experimental assays.              Methods:                    In the present review, the authors provide a basic background about neurodegenerative diseases and in silico techniques in the drug research. Furthermore, they review the various in silico studies reported against various targets in neurodegenerative diseases, including homology modeling, molecular docking, virtual high-throughput screening, quantitative structure activity relationship (QSAR), hologram quantitative structure activity relationship (HQSAR), 3D pharmacophore mapping, proteochemometrics modeling (PCM), fingerprints, fragment-based drug discovery, Monte Carlo simulation, molecular dynamic (MD) simulation, quantum-mechanical methods for drug design, support vector machines, and machine learning approaches.              Results:                    Detailed analysis of the recently reported case studies revealed that the majority of them use a sequential combination of ligand and structure-based virtual screening techniques, with particular focus on pharmacophore models and the docking approach.              Conclusion:                    Neurodegenerative diseases have a multifactorial pathoetiological origin, so scientists have become persuaded that a multi-target therapeutic strategy aimed at the simultaneous targeting of multiple proteins (and therefore etiologies) involved in the development of a disease is recommended in future."
28831290,1.0,An Update on Statistical Boosting in Biomedicine,2017;2017:6083072.,"Statistical boosting algorithms have triggered a lot of research during the last decade. They combine a powerful machine learning approach with classical statistical modelling, offering various practical advantages like automated variable selection and implicit regularization of effect estimates. They are extremely flexible, as the underlying base-learners (regression functions defining the type of effect for the explanatory variables) can be combined with any kind of loss function (target function to be optimized, defining the type of regression setting). In this review article, we highlight the most recent methodological developments on statistical boosting regarding variable selection, functional regression, and advanced time-to-event modelling. Additionally, we provide a short overview on relevant applications of statistical boosting in biomedicine."
28830106,12.0,Digital Pharmacovigilance and Disease Surveillance: Combining Traditional and Big-Data Systems for Better Public Health,2016 Dec 1;214(suppl_4):S399-S403.,"The digital revolution has contributed to very large data sets (ie, big data) relevant for public health. The two major data sources are electronic health records from traditional health systems and patient-generated data. As the two data sources have complementary strengths-high veracity in the data from traditional sources and high velocity and variety in patient-generated data-they can be combined to build more-robust public health systems. However, they also have unique challenges. Patient-generated data in particular are often completely unstructured and highly context dependent, posing essentially a machine-learning challenge. Some recent examples from infectious disease surveillance and adverse drug event monitoring demonstrate that the technical challenges can be solved. Despite these advances, the problem of verification remains, and unless traditional and digital epidemiologic approaches are combined, these data sources will be constrained by their intrinsic limits."
28828993,3.0,"General Machine Learning Model, Review, and Experimental-Theoretic Study of Magnolol Activity in Enterotoxigenic Induced Oxidative Stress",2017;17(26):2977-2988.,"This study evaluated the antioxidative effects of magnolol based on the mouse model induced by Enterotoxigenic Escherichia coli (E. coli, ETEC). All experimental mice were equally treated with ETEC suspensions (3.45×109 CFU/ml) after oral administration of magnolol for 7 days at the dose of 0, 100, 300 and 500 mg/kg Body Weight (BW), respectively. The oxidative metabolites and antioxidases for each sample (organism of mouse) were determined: Malondialdehyde (MDA), Nitric Oxide (NO), Glutathione (GSH), Myeloperoxidase (MPO), Catalase (CAT), Superoxide Dismutase (SOD), and Glutathione Peroxidase (GPx). In addition, we also determined the corresponding mRNA expressions of CAT, SOD and GPx as well as the Total Antioxidant Capacity (T-AOC). The experiment was completed with a theoretical study that predicts a series of 79 ChEMBL activities of magnolol with 47 proteins in 18 organisms using a Quantitative Structure- Activity Relationship (QSAR) classifier based on the Moving Averages (MAs) of Rcpi descriptors in three types of experimental conditions (biological activity with specific units, protein target and organisms). Six Machine Learning methods from Weka software were tested and the best QSAR classification model was provided by Random Forest with True Positive Rate (TPR) of 0.701 and Area under Receiver Operating Characteristic (AUROC) of 0.790 (test subset, 10-fold crossvalidation). The model is predicting if the new ChEMBL activities are greater or lower than the average values for the magnolol targets in different organisms."
28812204,8.0,Multivariable Adaptive Artificial Pancreas System in Type 1 Diabetes,2017 Aug 15;17(10):88.,"Purpose of review:                    The review summarizes the current state of the artificial pancreas (AP) systems and introduces various new modules that should be included in future AP systems.              Recent findings:                    A fully automated AP must be able to detect and mitigate the effects of meals, exercise, stress and sleep on blood glucose concentrations. This can only be achieved by using a multivariable approach that leverages information from wearable devices that provide real-time streaming data about various physiological variables that indicate imminent changes in blood glucose concentrations caused by meals, exercise, stress and sleep. The development of a fully automated AP will necessitate the design of multivariable and adaptive systems that use information from wearable devices in addition to glucose sensors and modify the models used in their model-predictive alarm and control systems to adapt to the changes in the metabolic state of the user. These AP systems will also integrate modules for controller performance assessment, fault detection and diagnosis, machine learning and classification to interpret various signals and achieve fault-tolerant control. Advances in wearable devices, computational power, and safe and secure communications are enabling the development of fully automated multivariable AP systems."
