pmid,citations,title,date,text
28520598,19.0,Imaging plus X: multimodal models of neurodegenerative disease,2017 Aug;30(4):371-379.,"Purpose of review:                    This article argues that the time is approaching for data-driven disease modelling to take centre stage in the study and management of neurodegenerative disease. The snowstorm of data now available to the clinician defies qualitative evaluation; the heterogeneity of data types complicates integration through traditional statistical methods; and the large datasets becoming available remain far from the big-data sizes necessary for fully data-driven machine-learning approaches. The recent emergence of data-driven disease progression models provides a balance between imposed knowledge of disease features and patterns learned from data. The resulting models are both predictive of disease progression in individual patients and informative in terms of revealing underlying biological patterns.              Recent findings:                    Largely inspired by observational models, data-driven disease progression models have emerged in the last few years as a feasible means for understanding the development of neurodegenerative diseases. These models have revealed insights into frontotemporal dementia, Huntington's disease, multiple sclerosis, Parkinson's disease and other conditions. For example, event-based models have revealed finer graded understanding of progression patterns; self-modelling regression and differential equation models have provided data-driven biomarker trajectories; spatiotemporal models have shown that brain shape changes, for example of the hippocampus, can occur before detectable neurodegeneration; and network models have provided some support for prion-like mechanistic hypotheses of disease propagation. The most mature results are in sporadic Alzheimer's disease, in large part because of the availability of the Alzheimer's disease neuroimaging initiative dataset. Results generally support the prevailing amyloid-led hypothetical model of Alzheimer's disease, while revealing finer detail and insight into disease progression.              Summary:                    The emerging field of disease progression modelling provides a natural mechanism to integrate different kinds of information, for example from imaging, serum and cerebrospinal fluid markers and cognitive tests, to obtain new insights into progressive diseases. Such insights include fine-grained longitudinal patterns of neurodegeneration, from early stages, and the heterogeneity of these trajectories over the population. More pragmatically, such models enable finer precision in patient staging and stratification, prediction of progression rates and earlier and better identification of at-risk individuals. We argue that this will make disease progression modelling invaluable for recruitment and end-points in future clinical trials, potentially ameliorating the high failure rate in trials of, e.g., Alzheimer's disease therapies. We review the state of the art in these techniques and discuss the future steps required to translate the ideas to front-line application."
28520235,24.0,First Principles Neural Network Potentials for Reactive Simulations of Large Molecular and Condensed Systems,2017 Oct 9;56(42):12828-12840.,"Modern simulation techniques have reached a level of maturity which allows a wide range of problems in chemistry and materials science to be addressed. Unfortunately, the application of first principles methods with predictive power is still limited to rather small systems, and despite the rapid evolution of computer hardware no fundamental change in this situation can be expected. Consequently, the development of more efficient but equally reliable atomistic potentials to reach an atomic level understanding of complex systems has received considerable attention in recent years. A promising new development has been the introduction of machine learning (ML) methods to describe the atomic interactions. Once trained with electronic structure data, ML potentials can accelerate computer simulations by several orders of magnitude, while preserving quantum mechanical accuracy. This Review considers the methodology of an important class of ML potentials that employs artificial neural networks."
28508479,2.0,Prediction of complex traits: Conciliating genetics and statistics,2017 Jun;134(3):178-183.,"This review focuses on methods used to predict complex traits. Main characteristics of prediction approaches are given: the deterministic or stochastic nature of prediction, the objects of prediction, the sources of information and the main statistical methods. Sources of information discussed are the traditional genealogies and phenotypes, nucleotide sequences, expression data and epigenetics marks. Statistical methods are presented as successive degrees of generalization from the definition of the conditional expectation as the prediction rule, to best linear unbiased prediction, then Bayesian and, recently, machine learning methods, including meta-methods. We highlight the contributions of Daniel Gianola to this methodological evolution."
28505027,4.0,Automated surveillance of healthcare-associated infections: state of the art,2017 Aug;30(4):425-431.,"Purpose of review:                    This review describes recent advances in the field of automated surveillance of healthcare-associated infections (HAIs), with a focus on data sources and the development of semiautomated or fully automated algorithms.              Recent findings:                    The availability of high-quality data in electronic health records and a well-designed information technology (IT) infrastructure to access these data are indispensable for successful implementation of automated HAI surveillance. Previous studies have demonstrated that reliance on stand-alone administrative data is generally unsuited as sole case-finding strategy. Recent attempts to combine multiple administrative and clinical data sources in algorithms yielded more reliable results. Current surveillance practices are mostly limited to single healthcare facilities, but future linkage of multiple databases in a network may allow interfacility surveillance. Although prior surveillance algorithms were often straightforward decision trees based on structured data, recent studies have used a wide variety of techniques for case-finding, including logistic regression and various machine learning methods. In the future, natural language processing may enable the use of unstructured narrative data.              Summary:                    Developments in healthcare IT are rapidly changing the landscape of HAI surveillance. The electronic availability and incorporation of routine care data in surveillance algorithms enhances the reliability, efficiency and standardization of surveillance practices."
28497663,2.0,Mortality risk prediction models for coronary artery bypass graft surgery: current scenario and future direction,2017 Dec;58(6):931-942.,"Introduction:                    Many risk prediction models are currently in use for predicting short-term mortality following coronary artery bypass graft (CABG) surgery. This review critically appraised the methods that were used for developing these models to assess their applicability in current practice setting as well as for the necessity of up-gradation.              Evidence acquisition:                    Medline via Ovid was searched for articles published between 1946 and 2016 and EMBASE via Ovid between 1974 and 2016 to identify risk prediction models for CABG. Article selection and data extraction was conducted using the CHARMS checklist for review of prediction model studies. Association between model development methods and model's discrimination was assessed using Kruskal-Wallis one-way analysis of variance and Mann-Whitney U-test.              Evidence synthesis:                    A total of 53 risk prediction models for short-term mortality following CABG were identified. The review found a wide variation in development methodology of risk prediction models in the field. Ambiguous predictor and outcome definition, sub-optimum sample size, inappropriate handling of missing data and inefficient predictor selection technique are major issues identified in the review. Quantitative synthesis in the review showed ""missing value imputation"" and ""adopting machine learning algorithms"" may result in better discrimination power of the models.              Conclusions:                    There are aspects in current risk modeling, where there is room for improvement to reflect current clinical practice. Future risk modelling needs to adopt a standardized approach to defining both outcome and predictor variables, rational treatment of missing data and robust statistical techniques to enhance performance of the mortality risk prediction."
28494725,3.0,Computational Methods for Predicting ncRNA-protein Interactions,2017;13(6):515-525.,"Background:                    RNA-protein interactions (RPIs) play an important role in many cellular processes. In particular, noncoding RNA-protein interactions (ncRPIs) are involved in various gene regulations and human complex diseases. High-throughput experiments have provided a large number of valuable information about ncRPIs, but these experiments are expensive and timeconsuming. Therefore, some computational approaches have been developed to predict ncRPIs efficiently and effectively.              Methods:                    In this work, we will describe the recent advance of predicting ncRPIs from the following aspects: i) the dataset construction; ii) the sequence and structural feature representation, and iii) the machine learning algorithm.              Results:                    The current methods have successfully predicted ncRPIs, but most of them trained and tested on the small benchmark datasets derived from ncRNA-protein complexes in PDB database. The generalization performance and robust of these existing methods need to be further improved.              Conclusion:                    Concomitant with the large numbers of ncRPIs generated by high-throughput technologies, three future directions for predicting ncRPIs with machine learning should be paid attention. One direction is that how to effectively construct the negative sample set. Another is the selection of novel and effective features from the sequences and structures of ncRNAs and proteins. The third is the design of powerful predictor."
28494123,28.0,Ecological momentary interventions for depression and anxiety,2017 Jun;34(6):540-545.,"Ecological momentary interventions (EMIs) are becoming more popular and more powerful resources for the treatment and prevention of depression and anxiety due to advances in technological capacity and analytic sophistication. Previous work has demonstrated that EMIs can be effective at reducing symptoms of depression and anxiety as well as related outcomes of stress and at increasing positive psychological functioning. In this review, we highlight the differences between EMIs and other forms of treatment due to the nature of EMIs to be deeply integrated into the fabric of people's day-to-day lives. EMIs require unique considerations in their design, deployment, and evaluation. Furthermore, given that EMIs have been advanced by changes in technologies and that the use of behavioral intervention technologies for mental health has been increasing, we discuss how technologies and analytics might usher in a new era of EMIs. Future EMIs might reduce user burden and increase intervention personalization and sophistication by leveraging digital sensors and advances in natural language processing and machine learning. Thus, although current EMIs are effective, the EMIs of the future might be more engaging, responsive, and adaptable to different people and different contexts."
28490262,15.0,Methods for safety signal detection in healthcare databases: a literature review,2017 Jun;16(6):721-732.,"With increasing availability, the use of healthcare databases as complementary data source for drug safety signal detection has been explored to circumvent the limitations inherent in spontaneous reporting. Areas covered: To review the methods proposed for safety signal detection in healthcare databases and their performance. Expert opinion: Fifteen different data mining methods were identified. They are based on disproportionality analysis, traditional pharmacoepidemiological designs (e.g. self-controlled designs), sequence symmetry analysis (SSA), sequential statistical testing, temporal association rules, supervised machine learning (SML), and the tree-based scan statistic. When considering the performance of these methods, the self-controlled designs, the SSA, and the SML seemed the most interesting approaches. In the perspective of routine signal detection from healthcare databases, pragmatic aspects such as the need for stakeholders to understand the method in order to be confident in the results must be considered. From this point of view, the SSA could appear as the most suitable method for signal detection in healthcare databases owing to its simple principle and its ability to provide a risk estimate. However, further developments, such as automated prioritization, are needed to help stakeholders handle the multiplicity of signals."
28481395,5.0,A Systematic Review on Machine Learning in Neurosurgery: The Future of Decision-Making in Patient Care,2018;28(2):167-173.,"Current practice of neurosurgery depends on clinical practice guidelines and evidence-based research publications that derive results using statistical methods. However, statistical analysis methods have some limitations such as the inability to analyze nonlinear variables, requiring setting a level of significance, being impractical for analyzing large amounts of data and the possibility of human bias. Machine learning is an emerging method for analyzing massive amounts of complex data which relies on algorithms that allow computers to learn and make accurate predictions. During the past decade, machine learning has been increasingly implemented in medical research as well as neurosurgical publications. This systematical review aimed to assemble the current neurosurgical literature that machine learning has been utilized, and to inform neurosurgeons on this novel method of data analysis."
28456584,44.0,Inference in the age of big data: Future perspectives on neuroscience,2017 Jul 15;155:549-564.,"Neuroscience is undergoing faster changes than ever before. Over 100 years our field qualitatively described and invasively manipulated single or few organisms to gain anatomical, physiological, and pharmacological insights. In the last 10 years neuroscience spawned quantitative datasets of unprecedented breadth (e.g., microanatomy, synaptic connections, and optogenetic brain-behavior assays) and size (e.g., cognition, brain imaging, and genetics). While growing data availability and information granularity have been amply discussed, we direct attention to a less explored question: How will the unprecedented data richness shape data analysis practices? Statistical reasoning is becoming more important to distill neurobiological knowledge from healthy and pathological brain measurements. We argue that large-scale data analysis will use more statistical models that are non-parametric, generative, and mixing frequentist and Bayesian aspects, while supplementing classical hypothesis testing with out-of-sample predictions."
28455151,15.0,Symptom severity prediction from neuropsychiatric clinical records: Overview of 2016 CEGS N-GRID shared tasks Track 2,2017 Nov;75S:S62-S70.,"The second track of the CEGS N-GRID 2016 natural language processing shared tasks focused on predicting symptom severity from neuropsychiatric clinical records. For the first time, initial psychiatric evaluation records have been collected, de-identified, annotated and shared with the scientific community. One-hundred-ten researchers organized in twenty-four teams participated in this track and submitted sixty-five system runs for evaluation. The top ten teams each achieved an inverse normalized macro-averaged mean absolute error score over 0.80. The top performing system employed an ensemble of six different machine learning-based classifiers to achieve a score 0.86. The task resulted to be generally easy with the exception of two specific classes of records: records with very few but crucial positive valence signals, and records describing patients predominantly affected by negative rather than positive valence. Those cases proved to be very challenging for most of the systems. Further research is required to consider the task solved. Overall, the results of this track demonstrate the effectiveness of data-driven approaches to the task of symptom severity classification."
28451550,7.0,Improving the Prediction of Survival in Cancer Patients by Using Machine Learning Techniques: Experience of Gene Expression Data: A Narrative Review,2017 Feb;46(2):165-172.,"Background:                    Today, despite the many advances in early detection of diseases, cancer patients have a poor prognosis and the survival rates in them are low. Recently, microarray technologies have been used for gathering thousands data about the gene expression level of cancer cells. These types of data are the main indicators in survival prediction of cancer. This study highlights the improvement of survival prediction based on gene expression data by using machine learning techniques in cancer patients.              Methods:                    This review article was conducted by searching articles between 2000 to 2016 in scientific databases and e-Journals. We used keywords such as machine learning, gene expression data, survival and cancer.              Results:                    Studies have shown the high accuracy and effectiveness of gene expression data in comparison with clinical data in survival prediction. Because of bewildering and high volume of such data, studies have highlighted the importance of machine learning algorithms such as Artificial Neural Networks (ANN) to find out the distinctive signatures of gene expression in cancer patients. These algorithms improve the efficiency of probing and analyzing gene expression in cancer profiles for survival prediction of cancer.              Conclusion:                    By attention to the capabilities of machine learning techniques in proteomics and genomics applications, developing clinical decision support systems based on these methods for analyzing gene expression data can prevent potential errors in survival estimation, provide appropriate and individualized treatments to patients and improve the prognosis of cancers."
28436837,28.0,"Passive BCI in Operational Environments: Insights, Recent Advances, and Future Trends",2017 Jul;64(7):1431-1436.,"Goal:                    This minireview aims to highlight recent important aspects to consider and evaluate when passive brain-computer interface (pBCI) systems would be developed and used in operational environments, and remarks future directions of their applications.              Methods:                    Electroencephalography (EEG) based pBCI has become an important tool for real-time analysis of brain activity since it could potentially provide covertly-without distracting the user from the main task-and objectively-not affected by the subjective judgment of an observer or the user itself-information about the operator cognitive state.              Results:                    Different examples of pBCI applications in operational environments and new adaptive interface solutions have been presented and described. In addition, a general overview regarding the correct use of machine learning techniques (e.g., which algorithm to use, common pitfalls to avoid, etc.) in the pBCI field has been provided.              Conclusion:                    Despite recent innovations on algorithms and neurotechnology, pBCI systems are not completely ready to enter the market yet, mainly due to limitations of the EEG electrodes technology, and algorithms reliability and capability in real settings.              Significance:                    High complexity and safety critical systems (e.g., airplanes, ATM interfaces) should adapt their behaviors and functionality accordingly to the user' actual mental state. Thus, technologies (i.e., pBCIs) able to measure in real time the user's mental states would result very useful in such ""high risk"" environments to enhance human machine interaction, and so increase the overall safety."
28436590,61.0,Identification of small molecules using accurate mass MS/MS search,2018 Jul;37(4):513-532.,"Tandem mass spectral library search (MS/MS) is the fastest way to correctly annotate MS/MS spectra from screening small molecules in fields such as environmental analysis, drug screening, lipid analysis, and metabolomics. The confidence in MS/MS-based annotation of chemical structures is impacted by instrumental settings and requirements, data acquisition modes including data-dependent and data-independent methods, library scoring algorithms, as well as post-curation steps. We critically discuss parameters that influence search results, such as mass accuracy, precursor ion isolation width, intensity thresholds, centroiding algorithms, and acquisition speed. A range of publicly and commercially available MS/MS databases such as NIST, MassBank, MoNA, LipidBlast, Wiley MSforID, and METLIN are surveyed. In addition, software tools including NIST MS Search, MS-DIAL, Mass Frontier, SmileMS, Mass++, and XCMS2 to perform fast MS/MS search are discussed. MS/MS scoring algorithms and challenges during compound annotation are reviewed. Advanced methods such as the in silico generation of tandem mass spectra using quantum chemistry and machine learning methods are covered. Community efforts for curation and sharing of tandem mass spectra that will allow for faster distribution of scientific discoveries are discussed."
28434256,2.0,A bioinformatics roadmap for the human vaccines project,2017 Jun;16(6):535-544.,"Biomedical research has become a data intensive science in which high throughput experimentation is producing comprehensive data about biological systems at an ever-increasing pace. The Human Vaccines Project is a new public-private partnership, with the goal of accelerating development of improved vaccines and immunotherapies for global infectious diseases and cancers by decoding the human immune system. To achieve its mission, the Project is developing a Bioinformatics Hub as an open-source, multidisciplinary effort with the overarching goal of providing an enabling infrastructure to support the data processing, analysis and knowledge extraction procedures required to translate high throughput, high complexity human immunology research data into biomedical knowledge, to determine the core principles driving specific and durable protective immune responses."
28418201,,"Chemoinformatics at IFP Energies Nouvelles: Applications in the Fields of Energy, Transport, and Environment",2017 Oct;36(10).,"The objective of the present paper is to summarize chemoinformatics based research, and more precisely, the development of quantitative structure property relationships performed at IFP Energies nouvelles (IFPEN) during the last decade. A special focus is proposed on research activities performed in the ""Thermodynamics and Molecular Simulation"" department, i. e. the use of multiscale molecular simulation methods in responses to projects. Molecular simulation techniques can be envisaged to supplement dataset when experimental information lacks, thus the review includes a section dedicated to molecular simulation codes, development of intermolecular potentials, and some of their possible applications. Know-how and feedback from our experiences in terms of machine learning application for thermophysical property predictions are included in a section dealing with methodological aspects. The generic character of chemoinformatics is emphasized through applications in the fields of energy, transport, and environment, with illustrations for three IFPEN business units: ""Transports"", ""Energy Resources"", and ""Processes"". More precisely, the review focus on different challenges such as the prediction of properties for alternative fuels, the prediction of fuel compatibility with polymeric materials, the prediction of properties for surfactants usable in chemical enhanced oil recovery, and the prediction of guest-host interactions between gases and nanoporous materials in the frame of carbon dioxide capture or gas separation activities."
