pmid,citations,title,date,text
28125523,4.0,Machine Learning-Based Classification of 38 Years of Spine-Related Literature Into 100 Research Topics,2017 Jun 1;42(11):863-870.,"Study design:                    Retrospective review.              Objective:                    To identify the top 100 spine research topics.              Summary of background data:                    Recent advances in ""machine learning,"" or computers learning without explicit instructions, have yielded broad technological advances. Topic modeling algorithms can be applied to large volumes of text to discover quantifiable themes and trends.              Methods:                    Abstracts were extracted from the National Library of Medicine PubMed database from five prominent peer-reviewed spine journals (European Spine Journal [ESJ], The Spine Journal [SpineJ], Spine, Journal of Spinal Disorders and Techniques [JSDT], Journal of Neurosurgery: Spine [JNS]). Each abstract was entered into a latent Dirichlet allocation model specified to discover 100 topics, resulting in each abstract being assigned a probability of belonging in a topic. Topics were named using the five most frequently appearing terms within that topic. Significance of increasing (""hot"") or decreasing (""cold"") topic popularity over time was evaluated with simple linear regression.              Results:                    From 1978 to 2015, 25,805 spine-related research articles were extracted and classified into 100 topics. Top two most published topics included ""clinical, surgeons, guidelines, information, care"" (n = 496 articles) and ""pain, back, low, treatment, chronic"" (424). Top two hot trends included ""disc, cervical, replacement, level, arthroplasty"" (+0.05%/yr, P < 0.001), and ""minimally, invasive, approach, technique"" (+0.05%/yr, P < 0.001). By journal, the most published topics were ESJ-""operative, surgery, postoperative, underwent, preoperative""; SpineJ-""clinical, surgeons, guidelines, information, care""; Spine-""pain, back, low, treatment, chronic""; JNS- ""tumor, lesions, rare, present, diagnosis""; JSDT-""cervical, anterior, plate, fusion, ACDF.""              Conclusion:                    Topics discovered through latent Dirichlet allocation modeling represent unbiased meaningful themes relevant to spine care. Topic dynamics can provide historical context and direction for future research for aspiring investigators and trainees interested in spine careers. Please explore https://singdc.shinyapps.io/spinetopics.              Level of evidence:                    N A."
28125274,61.0,Implementing Machine Learning in Radiology Practice and Research,2017 Apr;208(4):754-760.,"Objective:                    The purposes of this article are to describe concepts that radiologists should understand to evaluate machine learning projects, including common algorithms, supervised as opposed to unsupervised techniques, statistical pitfalls, and data considerations for training and evaluation, and to briefly describe ethical dilemmas and legal risk.              Conclusion:                    Machine learning includes a broad class of computer programs that improve with experience. The complexity of creating, training, and monitoring machine learning indicates that the success of the algorithms will require radiologist involvement for years to come, leading to engagement rather than replacement."
28116551,13.0,Tensor Factorization for Precision Medicine in Heart Failure with Preserved Ejection Fraction,2017 Jun;10(3):305-312.,"Heart failure with preserved ejection fraction (HFpEF) is a heterogeneous clinical syndrome that may benefit from improved subtyping in order to better characterize its pathophysiology and to develop novel targeted therapies. The United States Precision Medicine Initiative comes amid the rapid growth in quantity and modality of clinical data for HFpEF patients ranging from deep phenotypic to trans-omic data. Tensor factorization, a form of machine learning, allows for the integration of multiple data modalities to derive clinically relevant HFpEF subtypes that may have significant differences in underlying pathophysiology and differential response to therapies. Tensor factorization also allows for better interpretability by supporting dimensionality reduction and identifying latent groups of data for meaningful summarization of both features and disease outcomes. In this narrative review, we analyze the modest literature on the application of tensor factorization to related biomedical fields including genotyping and phenotyping. Based on the cited work including work of our own, we suggest multiple tensor factorization formulations capable of integrating the deep phenotypic and trans-omic modalities of data for HFpEF, or accounting for interactions between genetic variants at different omic hierarchies. We encourage extensive experimental studies to tackle challenges in applying tensor factorization for precision medicine in HFpEF, including effectively incorporating existing medical knowledge, properly accounting for uncertainty, and efficiently enforcing sparsity for better interpretability."
28092576,6.0,Multiple-Instance Learning for Medical Image and Video Analysis,2017;10:213-234.,"Multiple-instance learning (MIL) is a recent machine-learning paradigm that is particularly well suited to medical image and video analysis (MIVA) tasks. Based solely on class labels assigned globally to images or videos, MIL algorithms learn to detect relevant patterns locally in images or videos. These patterns are then used for classification at a global level. Because supervision relies on global labels, manual segmentations are not needed to train MIL algorithms, unlike traditional single-instance learning (SIL) algorithms. Consequently, these solutions are attracting increasing interest from the MIVA community: since the term was coined by Dietterich et al. in 1997, 73 research papers about MIL have been published in the MIVA literature. This paper reviews the existing strategies for modeling MIVA tasks as MIL problems, recommends general-purpose MIL algorithms for each type of MIVA tasks, and discusses MIVA-specific MIL algorithms. Various experiments performed in medical image and video datasets are compiled in order to back up these discussions. This meta-analysis shows that, besides being more convenient than SIL solutions, MIL algorithms are also more accurate in many cases. In other words, MIL is the ideal solution for many MIVA tasks. Recent trends are discussed, and future directions are proposed for this emerging paradigm."
28092510,7.0,Unobtrusive and Wearable Systems for Automatic Dietary Monitoring,2017 Sep;64(9):2075-2089.,"The threat of obesity, diabetes, anorexia, and bulimia in our society today has motivated extensive research on dietary monitoring. Standard self-report methods such as 24-h recall and food frequency questionnaires are expensive, burdensome, and unreliable to handle the growing health crisis. Long-term activity monitoring in daily living is a promising approach to provide individuals with quantitative feedback that can encourage healthier habits. Although several studies have attempted automating dietary monitoring using wearable, handheld, smart-object, and environmental systems, it remains an open research problem. This paper aims to provide a comprehensive review of wearable and hand-held approaches from 2004 to 2016. Emphasis is placed on sensor types used, signal analysis and machine learning methods, as well as a benchmark of state-of-the art work in this field. Key issues, challenges, and gaps are highlighted to motivate future work toward development of effective, reliable, and robust dietary monitoring systems."
28087243,74.0,Using deep learning to investigate the neuroimaging correlates of psychiatric and neurological disorders: Methods and applications,2017 Mar;74(Pt A):58-75.,"Deep learning (DL) is a family of machine learning methods that has gained considerable attention in the scientific community, breaking benchmark records in areas such as speech and visual recognition. DL differs from conventional machine learning methods by virtue of its ability to learn the optimal representation from the raw data through consecutive nonlinear transformations, achieving increasingly higher levels of abstraction and complexity. Given its ability to detect abstract and complex patterns, DL has been applied in neuroimaging studies of psychiatric and neurological disorders, which are characterised by subtle and diffuse alterations. Here we introduce the underlying concepts of DL and review studies that have used this approach to classify brain-based disorders. The results of these studies indicate that DL could be a powerful tool in the current search for biomarkers of psychiatric and neurologic disease. We conclude our review by discussing the main promises and challenges of using DL to elucidate brain-based disorders, as well as possible directions for future research."
28060710,5.0,A Review on Methods for Detecting SNP Interactions in High-Dimensional Genomic Data,Mar-Apr 2018;15(2):599-612.,"In this era of genome-wide association studies (GWAS), the quest for understanding the genetic architecture of complex diseases is rapidly increasing more than ever before. The development of high throughput genotyping and next generation sequencing technologies enables genetic epidemiological analysis of large scale data. These advances have led to the identification of a number of single nucleotide polymorphisms (SNPs) responsible for disease susceptibility. The interactions between SNPs associated with complex diseases are increasingly being explored in the current literature. These interaction studies are mathematically challenging and computationally complex. These challenges have been addressed by a number of data mining and machine learning approaches. This paper reviews the current methods and the related software packages to detect the SNP interactions that contribute to diseases. The issues that need to be considered when developing these models are addressed in this review. The paper also reviews the achievements in data simulation to evaluate the performance of these models. Further, it discusses the future of SNP interaction analysis."
28057825,29.0,Machine vision methods for analyzing social interactions,2017 Jan 1;220(Pt 1):25-34.,"Recent developments in machine vision methods for automatic, quantitative analysis of social behavior have immensely improved both the scale and level of resolution with which we can dissect interactions between members of the same species. In this paper, we review these methods, with a particular focus on how biologists can apply them to their own work. We discuss several components of machine vision-based analyses: methods to record high-quality video for automated analyses, video-based tracking algorithms for estimating the positions of interacting animals, and machine learning methods for recognizing patterns of interactions. These methods are extremely general in their applicability, and we review a subset of successful applications of them to biological questions in several model systems with very different types of social behaviors."
28057585,7.0,An Overview of data science uses in bioimage informatics,2017 Feb 15;115:110-118.,"This review aims at providing a practical overview of the use of statistical features and associated data science methods in bioimage informatics. To achieve a quantitative link between images and biological concepts, one typically replaces an object coming from an image (a segmented cell or intracellular object, a pattern of expression or localisation, even a whole image) by a vector of numbers. They range from carefully crafted biologically relevant measurements to features learnt through deep neural networks. This replacement allows for the use of practical algorithms for visualisation, comparison and inference, such as the ones from machine learning or multivariate statistics. While originating mainly, for biology, in high content screening, those methods are integral to the use of data science for the quantitative analysis of microscopy images to gain biological insight, and they are sure to gather more interest as the need to make sense of the increasing amount of acquired imaging data grows more pressing."
28055930,121.0,Deep Learning for Health Informatics,2017 Jan;21(1):4-21.,"With a massive influx of multimodality data, the role of data analytics in health informatics has grown rapidly in the last decade. This has also prompted increasing interests in the generation of analytical, data driven models based on machine learning in health informatics. Deep learning, a technique with its foundation in artificial neural networks, is emerging in recent years as a powerful tool for machine learning, promising to reshape the future of artificial intelligence. Rapid improvements in computational power, fast data storage, and parallelization have also contributed to the rapid uptake of the technology in addition to its predictive power and ability to generate automatically optimized high-level features and semantic interpretation from the input data. This article presents a comprehensive up-to-date review of research employing deep learning in health informatics, providing a critical analysis of the relative merit, and potential pitfalls of the technique as well as its future outlook. The paper mainly focuses on key applications of deep learning in the fields of translational bioinformatics, medical imaging, pervasive sensing, medical informatics, and public health."
28055887,19.0,EEG-Based Strategies to Detect Motor Imagery for Control and Rehabilitation,2017 Apr;25(4):392-401.,"Advances in brain-computer interface (BCI) technology have facilitated the detection of Motor Imagery (MI) from electroencephalography (EEG). First, we present three strategies of using BCI to detect MI from EEG: operant conditioning that employed a fixed model, machine learning that employed a subject-specific model computed from calibration, and adaptive strategy that continuously compute the subject-specific model. Second, we review prevailing works that employed the operant conditioning and machine learning strategies. Third, we present our past work on six stroke patients who underwent a BCI rehabilitation clinical trial with averaged accuracies of 79.8% during calibration and 69.5% across 18 online feedback sessions. Finally, we perform an offline study in this paper on our work employing the adaptive strategy. The results yielded significant improvements of 12% (p < 0.001) and 9% (p < 0.001) using all the data and using limited preceding data respectively in the feedback accuracies. The results showed an increase in the amount of training data yielded improvements. Nevertheless, results of using limited preceding data showed a larger part of the improvement was due to the adaptive strategy and changing subject-specific models did not deteriorate the accuracies. Hence the adaptive strategy is effective in addressing the non-stationarity between calibration and feedback sessions."
28042575,13.0,Long Noncoding RNA Identification: Comparing Machine Learning Based Tools for Long Noncoding Transcripts Discrimination,2016;2016:8496165.,"Long noncoding RNA (lncRNA) is a kind of noncoding RNA with length more than 200 nucleotides, which aroused interest of people in recent years. Lots of studies have confirmed that human genome contains many thousands of lncRNAs which exert great influence over some critical regulators of cellular process. With the advent of high-throughput sequencing technologies, a great quantity of sequences is waiting for exploitation. Thus, many programs are developed to distinguish differences between coding and long noncoding transcripts. Different programs are generally designed to be utilised under different circumstances and it is sensible and practical to select an appropriate method according to a certain situation. In this review, several popular methods and their advantages, disadvantages, and application scopes are summarised to assist people in employing a suitable method and obtaining a more reliable result."
28035989,15.0,"Neuroblastoma, a Paradigm for Big Data Science in Pediatric Oncology",2016 Dec 27;18(1):37.,"Pediatric cancers rarely exhibit recurrent mutational events when compared to most adult cancers. This poses a challenge in understanding how cancers initiate, progress, and metastasize in early childhood. Also, due to limited detected driver mutations, it is difficult to benchmark key genes for drug development. In this review, we use neuroblastoma, a pediatric solid tumor of neural crest origin, as a paradigm for exploring ""big data"" applications in pediatric oncology. Computational strategies derived from big data science-network- and machine learning-based modeling and drug repositioning-hold the promise of shedding new light on the molecular mechanisms driving neuroblastoma pathogenesis and identifying potential therapeutics to combat this devastating disease. These strategies integrate robust data input, from genomic and transcriptomic studies, clinical data, and in vivo and in vitro experimental models specific to neuroblastoma and other types of cancers that closely mimic its biological characteristics. We discuss contexts in which ""big data"" and computational approaches, especially network-based modeling, may advance neuroblastoma research, describe currently available data and resources, and propose future models of strategic data collection and analyses for neuroblastoma and other related diseases."
28034409,20.0,Visualizing the knowledge structure and evolution of big data research in healthcare informatics,2017 Feb;98:22-32.,"Background:                    In recent years, the literature associated with healthcare big data has grown rapidly, but few studies have used bibliometrics and a visualization approach to conduct deep mining and reveal a panorama of the healthcare big data field.              Methods:                    To explore the foundational knowledge and research hotspots of big data research in the field of healthcare informatics, this study conducted a series of bibliometric analyses on the related literature, including papers' production trends in the field and the trend of each paper's co-author number, the distribution of core institutions and countries, the core literature distribution, the related information of prolific authors and innovation paths in the field, a keyword co-occurrence analysis, and research hotspots and trends for the future.              Results:                    By conducting a literature content analysis and structure analysis, we found the following: (a) In the early stage, researchers from the United States, the People's Republic of China, the United Kingdom, and Germany made the most contributions to the literature associated with healthcare big data research and the innovation path in this field. (b) The innovation path in healthcare big data consists of three stages: the disease early detection, diagnosis, treatment, and prognosis phase, the life and health promotion phase, and the nursing phase. (c) Research hotspots are mainly concentrated in three dimensions: the disease dimension (e.g., epidemiology, breast cancer, obesity, and diabetes), the technical dimension (e.g., data mining and machine learning), and the health service dimension (e.g., customized service and elderly nursing).              Conclusion:                    This study will provide scholars in the healthcare informatics community with panoramic knowledge of healthcare big data research, as well as research hotspots and future research directions."
28032396,24.0,Computational neuroscience approach to biomarkers and treatments for mental disorders,2017 Apr;71(4):215-237.,"Psychiatry research has long experienced a stagnation stemming from a lack of understanding of the neurobiological underpinnings of phenomenologically defined mental disorders. Recently, the application of computational neuroscience to psychiatry research has shown great promise in establishing a link between phenomenological and pathophysiological aspects of mental disorders, thereby recasting current nosology in more biologically meaningful dimensions. In this review, we highlight recent investigations into computational neuroscience that have undertaken either theory- or data-driven approaches to quantitatively delineate the mechanisms of mental disorders. The theory-driven approach, including reinforcement learning models, plays an integrative role in this process by enabling correspondence between behavior and disorder-specific alterations at multiple levels of brain organization, ranging from molecules to cells to circuits. Previous studies have explicated a plethora of defining symptoms of mental disorders, including anhedonia, inattention, and poor executive function. The data-driven approach, on the other hand, is an emerging field in computational neuroscience seeking to identify disorder-specific features among high-dimensional big data. Remarkably, various machine-learning techniques have been applied to neuroimaging data, and the extracted disorder-specific features have been used for automatic case-control classification. For many disorders, the reported accuracies have reached 90% or more. However, we note that rigorous tests on independent cohorts are critically required to translate this research into clinical applications. Finally, we discuss the utility of the disorder-specific features found by the data-driven approach to psychiatric therapies, including neurofeedback. Such developments will allow simultaneous diagnosis and treatment of mental disorders using neuroimaging, thereby establishing 'theranostics' for the first time in clinical psychiatry."
28011753,75.0,A review on machine learning principles for multi-view biological data integration,2018 Mar 1;19(2):325-340.,"Driven by high-throughput sequencing techniques, modern genomic and clinical studies are in a strong need of integrative machine learning models for better use of vast volumes of heterogeneous information in the deep understanding of biological systems and the development of predictive models. How data from multiple sources (called multi-view data) are incorporated in a learning system is a key step for successful analysis. In this article, we provide a comprehensive review on omics and clinical data integration techniques, from a machine learning perspective, for various analyses such as prediction, clustering, dimension reduction and association. We shall show that Bayesian models are able to use prior information and model measurements with various distributions; tree-based methods can either build a tree with all features or collectively make a final decision based on trees learned from each view; kernel methods fuse the similarity matrices learned from individual views together for a final similarity matrix or learning model; network-based fusion methods are capable of inferring direct and indirect associations in a heterogeneous network; matrix factorization models have potential to learn interactions among features from different views; and a range of deep neural networks can be integrated in multi-modal learning for capturing the complex mechanism of biological systems."
28011145,8.0,A Functional Genomic Meta-Analysis of Clinical Trials in Systemic Sclerosis: Toward Precision Medicine and Combination Therapy,2017 May;137(5):1033-1041.,"Systemic sclerosis is an orphan, systemic autoimmune disease with no FDA-approved treatments. Its heterogeneity and rarity often result in underpowered clinical trials making the analysis and interpretation of associated molecular data challenging. We performed a meta-analysis of gene expression data from skin biopsies of patients with systemic sclerosis treated with five therapies: mycophenolate mofetil, rituximab, abatacept, nilotinib, and fresolimumab. A common clinical improvement criterion of -20% or -5 modified Rodnan skin score was applied to each study. We applied a machine learning approach that captured features beyond differential expression and was better at identifying targets of therapies than the differential expression alone. Regardless of treatment mechanism, abrogation of inflammatory pathways accompanied clinical improvement in multiple studies suggesting that high expression of immune-related genes indicates active and targetable disease. Our framework allowed us to compare different trials and ask if patients who failed one therapy would likely improve on a different therapy, based on changes in gene expression. Genes with high expression at baseline in fresolimumab nonimprovers were downregulated in mycophenolate mofetil improvers, suggesting that immunomodulatory or combination therapy may have benefitted these patients. This approach can be broadly applied to increase tissue specificity and sensitivity of differential expression results."
