pmid,citations,title,date,text
28319238,1.0,Behavioral and neural constraints on hierarchical representations,2017 Mar 1;17(3):13.,"Central to behavior and cognition is the way that sensory stimuli are represented in neural systems. The distributions over such stimuli enjoy rich structure; however, how the brain captures and exploits these regularities is unclear. Here, we consider different sources of perhaps the most prevalent form of structure, namely hierarchies, in one of its most prevalent cases, namely the representation of images. We review experimental approaches across a range of subfields, spanning inference, memory recall, and visual adaptation, to investigate how these constrain hierarchical representations. We also discuss progress in building hierarchical models of the representation of images-this has the potential to clarify how the structure of the world is reflected in biological systems. We suggest there is a need for a closer embedding of recent advances in machine learning and computer vision into the design and interpretation of experiments, notably by utilizing the understanding of the structure of natural scenes and through the creation of hierarchically structured synthetic stimuli."
28315224,1.0,An Overview of Bioinformatics Tools and Resources in Allergy,2017;1592:223-245.,"The rapidly increasing number of characterized allergens has created huge demands for advanced information storage, retrieval, and analysis. Bioinformatics and machine learning approaches provide useful tools for the study of allergens and epitopes prediction, which greatly complement traditional laboratory techniques. The specific applications mainly include identification of B- and T-cell epitopes, and assessment of allergenicity and cross-reactivity. In order to facilitate the work of clinical and basic researchers who are not familiar with bioinformatics, we review in this chapter the most important databases, bioinformatic tools, and methods with relevance to the study of allergens."
28315069,12.0,Toolkits and Libraries for Deep Learning,2017 Aug;30(4):400-405.,"Deep learning is an important new area of machine learning which encompasses a wide range of neural network architectures designed to complete various tasks. In the medical imaging domain, example tasks include organ segmentation, lesion detection, and tumor classification. The most popular network architecture for deep learning for images is the convolutional neural network (CNN). Whereas traditional machine learning requires determination and calculation of features from which the algorithm learns, deep learning approaches learn the important features as well as the proper weighting of those features to make predictions for new data. In this paper, we will describe some of the libraries and tools that are available to aid in the construction and efficient execution of deep learning as applied to medical images."
28302041,,Promises of Machine Learning Approaches in Prediction of Absorption of Compounds,2018;18(3):196-207.,"The Machine Learning (ML) is one of the fastest developing techniques in the prediction and evaluation of important pharmacokinetic properties such as absorption, distribution, metabolism and excretion. The availability of a large number of robust validation techniques for prediction models devoted to pharmacokinetics has significantly enhanced the trust and authenticity in ML approaches. There is a series of prediction models generated and used for rapid screening of compounds on the basis of absorption in last one decade. Prediction of absorption of compounds using ML models has great potential across the pharmaceutical industry as a non-animal alternative to predict absorption. However, these prediction models still have to go far ahead to develop the confidence similar to conventional experimental methods for estimation of drug absorption. Some of the general concerns are selection of appropriate ML methods and validation techniques in addition to selecting relevant descriptors and authentic data sets for the generation of prediction models. The current review explores published models of ML for the prediction of absorption using physicochemical properties as descriptors and their important conclusions. In addition, some critical challenges in acceptance of ML models for absorption are also discussed."
28301734,358.0,Deep Learning in Medical Image Analysis,2017 Jun 21;19:221-248.,"This review covers computer-assisted analysis of images in the field of medical imaging. Recent advances in machine learning, especially with regard to deep learning, are helping to identify, classify, and quantify patterns in medical images. At the core of these advances is the ability to exploit hierarchical feature representations learned solely from data, instead of features designed by hand according to domain-specific knowledge. Deep learning is rapidly becoming the state of the art, leading to enhanced performance in various medical applications. We introduce the fundamentals of deep learning methods and review their successes in image registration, detection of anatomical and cellular structures, tissue segmentation, computer-aided disease diagnosis and prognosis, and so on. We conclude by discussing research issues and suggesting future directions for further improvement."
28301733,3.0,Big Data Analytics in Chemical Engineering,2017 Jun 7;8:63-85.,"Big data analytics is the journey to turn data into insights for more informed business and operational decisions. As the chemical engineering community is collecting more data (volume) from different sources (variety), this journey becomes more challenging in terms of using the right data and the right tools (analytics) to make the right decisions in real time (velocity). This article highlights recent big data advancements in five industries, including chemicals, energy, semiconductors, pharmaceuticals, and food, and then discusses technical, platform, and culture challenges. To reach the next milestone in multiplying successes to the enterprise level, government, academia, and industry need to collaboratively focus on workforce development and innovation."
28294138,26.0,Machine learning applications in cell image analysis,2017 Jul;95(6):525-530.,"Machine learning (ML) refers to a set of automatic pattern recognition methods that have been successfully applied across various problem domains, including biomedical image analysis. This review focuses on ML applications for image analysis in light microscopy experiments with typical tasks of segmenting and tracking individual cells, and modelling of reconstructed lineage trees. After describing a typical image analysis pipeline and highlighting challenges of automatic analysis (for example, variability in cell morphology, tracking in presence of clutters) this review gives a brief historical outlook of ML, followed by basic concepts and definitions required for understanding examples. This article then presents several example applications at various image processing stages, including the use of supervised learning methods for improving cell segmentation, and the application of active learning for tracking. The review concludes with remarks on parameter setting and future directions."
28285459,19.0,A Critical Review for Developing Accurate and Dynamic Predictive Models Using Machine Learning Methods in Medicine and Health Care,2017 Apr;41(4):69.,"Recently, Artificial Intelligence (AI) has been used widely in medicine and health care sector. In machine learning, the classification or prediction is a major field of AI. Today, the study of existing predictive models based on machine learning methods is extremely active. Doctors need accurate predictions for the outcomes of their patients' diseases. In addition, for accurate predictions, timing is another significant factor that influences treatment decisions. In this paper, existing predictive models in medicine and health care have critically reviewed. Furthermore, the most famous machine learning methods have explained, and the confusion between a statistical approach and machine learning has clarified. A review of related literature reveals that the predictions of existing predictive models differ even when the same dataset is used. Therefore, existing predictive models are essential, and current methods must be improved."
28283186,42.0,Imaging Genetics and Genomics in Psychiatry: A Critical Review of Progress and Potential,2017 Aug 1;82(3):165-175.,"Imaging genetics and genomics research has begun to provide insight into the molecular and genetic architecture of neural phenotypes and the neural mechanisms through which genetic risk for psychopathology may emerge. As it approaches its third decade, imaging genetics is confronted by many challenges, including the proliferation of studies using small sample sizes and diverse designs, limited replication, problems with harmonization of neural phenotypes for meta-analysis, unclear mechanisms, and evidence that effect sizes may be more modest than originally posited, with increasing evidence of polygenicity. These concerns have encouraged the field to grow in many new directions, including the development of consortia and large-scale data collection projects and the use of novel methods (e.g., polygenic approaches, machine learning) that enhance the quality of imaging genetic studies but also introduce new challenges. We critically review progress in imaging genetics and offer suggestions and highlight potential pitfalls of novel approaches. Ultimately, the strength of imaging genetics and genomics lies in their translational and integrative potential with other research approaches (e.g., nonhuman animal models, psychiatric genetics, pharmacologic challenge) to elucidate brain-based pathways that give rise to the vast individual differences in behavior as well as risk for psychopathology."
28277804,23.0,Cardiac imaging: working towards fully-automated machine analysis & interpretation,2017 Mar;14(3):197-212.,"Non-invasive imaging plays a critical role in managing patients with cardiovascular disease. Although subjective visual interpretation remains the clinical mainstay, quantitative analysis facilitates objective, evidence-based management, and advances in clinical research. This has driven developments in computing and software tools aimed at achieving fully automated image processing and quantitative analysis. In parallel, machine learning techniques have been used to rapidly integrate large amounts of clinical and quantitative imaging data to provide highly personalized individual patient-based conclusions. Areas covered: This review summarizes recent advances in automated quantitative imaging in cardiology and describes the latest techniques which incorporate machine learning principles. The review focuses on the cardiac imaging techniques which are in wide clinical use. It also discusses key issues and obstacles for these tools to become utilized in mainstream clinical practice. Expert commentary: Fully-automated processing and high-level computer interpretation of cardiac imaging are becoming a reality. Application of machine learning to the vast amounts of quantitative data generated per scan and integration with clinical data also facilitates a move to more patient-specific interpretation. These developments are unlikely to replace interpreting physicians but will provide them with highly accurate tools to detect disease, risk-stratify, and optimize patient-specific treatment. However, with each technological advance, we move further from human dependence and closer to fully-automated machine interpretation."
28272810,57.0,Deep learning for computational chemistry,2017 Jun 15;38(16):1291-1307.,"The rise and fall of artificial neural networks is well documented in the scientific literature of both computer science and computational chemistry. Yet almost two decades later, we are now seeing a resurgence of interest in deep learning, a machine learning algorithm based on multilayer neural networks. Within the last few years, we have seen the transformative impact of deep learning in many domains, particularly in speech recognition and computer vision, to the extent that the majority of expert practitioners in those field are now regularly eschewing prior established models in favor of deep learning models. In this review, we provide an introductory overview into the theory of deep neural networks and their unique properties that distinguish them from traditional machine learning algorithms used in cheminformatics. By providing an overview of the variety of emerging applications of deep neural networks, we highlight its ubiquity and broad applicability to a wide range of challenges in the field, including quantitative structure activity relationship, virtual screening, protein structure prediction, quantum chemistry, materials design, and property prediction. In reviewing the performance of deep neural networks, we observed a consistent outperformance against non-neural networks state-of-the-art models across disparate research topics, and deep neural network-based models often exceeded the ""glass ceiling"" expectations of their respective tasks. Coupled with the maturity of GPU-accelerated computing for training deep neural networks and the exponential growth of chemical data on which to train these networks on, we anticipate that deep learning algorithms will be a valuable tool for computational chemistry. © 2017 Wiley Periodicals, Inc."
28272367,,How Open Data Shapes In Silico Transporter Modeling,2017 Mar 7;22(3):422.,"Chemical compound bioactivity and related data are nowadays easily available from open data sources and the open medicinal chemistry literature for many transmembrane proteins. Computational ligand-based modeling of transporters has therefore experienced a shift from local (quantitative) models to more global, qualitative, predictive models. As the size and heterogeneity of the data set rises, careful data curation becomes even more important. This includes, for example, not only a tailored cutoff setting for the generation of binary classes, but also the proper assessment of the applicability domain. Powerful machine learning algorithms (such as multi-label classification) now allow the simultaneous prediction of multiple related targets. However, the more complex, the less interpretable these models will get. We emphasize that transmembrane transporters are very peculiar, some of which act as off-targets rather than as real drug targets. Thus, careful selection of the right modeling technique is important, as well as cautious interpretation of results. We hope that, as more and more data will become available, we will be able to ameliorate and specify our models, coming closer towards function elucidation and the development of safer medicine."
28268288,1.0,Difficulty understanding speech in noise by the hearing impaired: underlying causes and technological solutions,2016 Aug;2016:89-92.,"A primary complaint of hearing-impaired individuals involves poor speech understanding when background noise is present. Hearing aids and cochlear implants often allow good speech understanding in quiet backgrounds. But hearing-impaired individuals are highly noise intolerant, and existing devices are not very effective at combating background noise. As a result, speech understanding in noise is often quite poor. In accord with the significance of the problem, considerable effort has been expended toward understanding and remedying this issue. Fortunately, our understanding of the underlying issues is reasonably good. In sharp contrast, effective solutions have remained elusive. One solution that seems promising involves a single-microphone machine-learning algorithm to extract speech from background noise. Data from our group indicate that the algorithm is capable of producing vast increases in speech understanding by hearing-impaired individuals. This paper will first provide an overview of the speech-in-noise problem and outline why hearing-impaired individuals are so noise intolerant. An overview of our approach to solving this problem will follow."
28268284,1.0,Intelligent hearing aids: the next revolution,2016 Aug;2016:72-76.,"The first revolution in hearing aids came from nonlinear amplification, which allows better compensation for both soft and loud sounds. The second revolution stemmed from the introduction of digital signal processing, which allows better programmability and more sophisticated algorithms. The third revolution in hearing aids is wireless, which allows seamless connectivity between a pair of hearing aids and with more and more external devices. Each revolution has fundamentally transformed hearing aids and pushed the entire industry forward significantly. Machine learning has received significant attention in recent years and has been applied in many other industries, e.g., robotics, speech recognition, genetics, and crowdsourcing. We argue that the next revolution in hearing aids is machine intelligence. In fact, this revolution is already quietly happening. We will review the development in at least three major areas: applications of machine learning in speech enhancement; applications of machine learning in individualization and customization of signal processing algorithms; applications of machine learning in improving the efficiency and effectiveness of clinical tests. With the advent of the internet of things, the above developments will accelerate. This revolution will bring patient satisfactions to a new level that has never been seen before."
28265788,22.0,A review of supervised machine learning applied to ageing research,2017 Apr;18(2):171-188.,"Broadly speaking, supervised machine learning is the computational task of learning correlations between variables in annotated data (the training set), and using this information to create a predictive model capable of inferring annotations for new data, whose annotations are not known. Ageing is a complex process that affects nearly all animal species. This process can be studied at several levels of abstraction, in different organisms and with different objectives in mind. Not surprisingly, the diversity of the supervised machine learning algorithms applied to answer biological questions reflects the complexities of the underlying ageing processes being studied. Many works using supervised machine learning to study the ageing process have been recently published, so it is timely to review these works, to discuss their main findings and weaknesses. In summary, the main findings of the reviewed papers are: the link between specific types of DNA repair and ageing; ageing-related proteins tend to be highly connected and seem to play a central role in molecular pathways; ageing/longevity is linked with autophagy and apoptosis, nutrient receptor genes, and copper and iron ion transport. Additionally, several biomarkers of ageing were found by machine learning. Despite some interesting machine learning results, we also identified a weakness of current works on this topic: only one of the reviewed papers has corroborated the computational results of machine learning algorithms through wet-lab experiments. In conclusion, supervised machine learning has contributed to advance our knowledge and has provided novel insights on ageing, yet future work should have a greater emphasis in validating the predictions."
28263938,56.0,Analysis of Machine Learning Techniques for Heart Failure Readmissions,2016 Nov;9(6):629-640.,"Background:                    The current ability to predict readmissions in patients with heart failure is modest at best. It is unclear whether machine learning techniques that address higher dimensional, nonlinear relationships among variables would enhance prediction. We sought to compare the effectiveness of several machine learning algorithms for predicting readmissions.              Methods and results:                    Using data from the Telemonitoring to Improve Heart Failure Outcomes trial, we compared the effectiveness of random forests, boosting, random forests combined hierarchically with support vector machines or logistic regression (LR), and Poisson regression against traditional LR to predict 30- and 180-day all-cause readmissions and readmissions because of heart failure. We randomly selected 50% of patients for a derivation set, and a validation set comprised the remaining patients, validated using 100 bootstrapped iterations. We compared C statistics for discrimination and distributions of observed outcomes in risk deciles for predictive range. In 30-day all-cause readmission prediction, the best performing machine learning model, random forests, provided a 17.8% improvement over LR (mean C statistics, 0.628 and 0.533, respectively). For readmissions because of heart failure, boosting improved the C statistic by 24.9% over LR (mean C statistic 0.678 and 0.543, respectively). For 30-day all-cause readmission, the observed readmission rates in the lowest and highest deciles of predicted risk with random forests (7.8% and 26.2%, respectively) showed a much wider separation than LR (14.2% and 16.4%, respectively).              Conclusions:                    Machine learning methods improved the prediction of readmission after hospitalization for heart failure compared with LR and provided the greatest predictive range in observed readmission rates."
28254083,4.0,Classification techniques on computerized systems to predict and/or to detect Apnea: A systematic review,2017 Mar;140:265-274.,"Background and objective:                    Sleep apnea syndrome (SAS), which can significantly decrease the quality of life is associated with a major risk factor of health implications such as increased cardiovascular disease, sudden death, depression, irritability, hypertension, and learning difficulties. Thus, it is relevant and timely to present a systematic review describing significant applications in the framework of computational intelligence-based SAS, including its performance, beneficial and challenging effects, and modeling for the decision-making on multiple scenarios.              Methods:                    This study aims to systematically review the literature on systems for the detection and/or prediction of apnea events using a classification model.              Results:                    Forty-five included studies revealed a combination of classification techniques for the diagnosis of apnea, such as threshold-based (14.75%) and machine learning (ML) models (85.25%). In addition, the ML models, were clustered in a mind map, include neural networks (44.26%), regression (4.91%), instance-based (11.47%), Bayesian algorithms (1.63%), reinforcement learning (4.91%), dimensionality reduction (8.19%), ensemble learning (6.55%), and decision trees (3.27%).              Conclusions:                    A classification model should provide an auto-adaptive and no external-human action dependency. In addition, the accuracy of the classification models is related with the effective features selection. New high-quality studies based on randomized controlled trials and validation of models using a large and multiple sample of data are recommended."
28251040,14.0,Analytic Complexity and Challenges in Identifying Mixtures of Exposures Associated with Phenotypes in the Exposome Era,2017;4(1):22-30.,"Purpose of review:                    Mixtures, or combinations and interactions between multiple environmental exposures, are hypothesized to be causally linked with disease and health-related phenotypes. Established and emerging molecular measurement technologies to assay the exposome, the comprehensive battery of exposures encountered from birth to death, promise a new way of identifying mixtures in disease in the epidemiological setting. In this opinion, we describe the analytic complexity and challenges in identifying mixtures associated with phenotype and disease.              Recent findings:                    Existing and emerging machine-learning methods and data analytic approaches (e.g., ""environment-wide association studies"" [EWASs]), as well as large cohorts may enhance possibilities to identify mixtures of correlated exposures associated with phenotypes; however, the analytic complexity of identifying mixtures is immense.              Summary:                    If the exposome concept is realized, new analytical methods and large sample sizes will be required to ascertain how mixtures are associated with disease. The author recommends documenting prevalent correlated exposures and replicated main effects prior to identifying mixtures."
28242295,17.0,"Analysis of live cell images: Methods, tools and opportunities",2017 Feb 15;115:65-79.,"Advances in optical microscopy, biosensors and cell culturing technologies have transformed live cell imaging. Thanks to these advances live cell imaging plays an increasingly important role in basic biology research as well as at all stages of drug development. Image analysis methods are needed to extract quantitative information from these vast and complex data sets. The aim of this review is to provide an overview of available image analysis methods for live cell imaging, in particular required preprocessing image segmentation, cell tracking and data visualisation methods. The potential opportunities recent advances in machine learning, especially deep learning, and computer vision provide are being discussed. This review includes overview of the different available software packages and toolkits."
