pmid,citations,title,date,text
28241858,20.0,Machine learning identifies a compact gene set for monitoring the circadian clock in human blood,2017 Feb 28;9(1):19.,"Background:                    The circadian clock and the daily rhythms it produces are crucial for human health, but are often disrupted by the modern environment. At the same time, circadian rhythms may influence the efficacy and toxicity of therapeutics and the metabolic response to food intake. Developing treatments for circadian dysfunction, as well as optimizing the daily timing of treatments for other health conditions, will require a simple and accurate method to monitor the molecular state of the circadian clock.              Methods:                    Here we used a recently developed method called ZeitZeiger to predict circadian time (CT, time of day according to the circadian clock) from genome-wide gene expression in human blood.              Results:                    In cross-validation on 498 samples from 60 individuals across three publicly available datasets, ZeitZeiger predicted CT in single samples with a median absolute error of 2.1 h. The predictor trained on all 498 samples used 15 genes, only two of which are part of the core circadian clock. By then applying ZeitZeiger to 475 additional samples from the same three datasets, we quantified how the circadian clock in the blood was affected by various perturbations to the sleep-wake and light-dark cycles. Finally, we extended ZeitZeiger (1) to handle intra-individual variation by making predictions based on multiple samples taken a known time apart, and (2) to handle inter-individual variation by personalizing predictions based on samples from the respective individual. Each of these strategies improved prediction of CT by ~20%.              Conclusions:                    Our results are an important step towards precision circadian medicine. In addition, our generalizable extensions to ZeitZeiger may be applicable to the growing number of biological datasets that contain multiple observations per individual."
28236531,9.0,Neuroadaptive Bayesian Optimization and Hypothesis Testing,2017 Mar;21(3):155-167.,"Cognitive neuroscientists are often interested in broad research questions, yet use overly narrow experimental designs by considering only a small subset of possible experimental conditions. This limits the generalizability and reproducibility of many research findings. Here, we propose an alternative approach that resolves these problems by taking advantage of recent developments in real-time data analysis and machine learning. Neuroadaptive Bayesian optimization is a powerful strategy to efficiently explore more experimental conditions than is currently possible with standard methodology. We argue that such an approach could broaden the hypotheses considered in cognitive science, improving the generalizability of findings. In addition, Bayesian optimization can be combined with preregistration to cover exploration, mitigating researcher bias more broadly and improving reproducibility."
28232122,23.0,"Functional connectomics from a ""big data"" perspective",2017 Oct 15;160:152-167.,"In the last decade, explosive growth regarding functional connectome studies has been observed. Accumulating knowledge has significantly contributed to our understanding of the brain's functional network architectures in health and disease. With the development of innovative neuroimaging techniques, the establishment of large brain datasets and the increasing accumulation of published findings, functional connectomic research has begun to move into the era of ""big data"", which generates unprecedented opportunities for discovery in brain science and simultaneously encounters various challenging issues, such as data acquisition, management and analyses. Big data on the functional connectome exhibits several critical features: high spatial and/or temporal precision, large sample sizes, long-term recording of brain activity, multidimensional biological variables (e.g., imaging, genetic, demographic, cognitive and clinic) and/or vast quantities of existing findings. We review studies regarding functional connectomics from a big data perspective, with a focus on recent methodological advances in state-of-the-art image acquisition (e.g., multiband imaging), analysis approaches and statistical strategies (e.g., graph theoretical analysis, dynamic network analysis, independent component analysis, multivariate pattern analysis and machine learning), as well as reliability and reproducibility validations. We highlight the novel findings in the application of functional connectomic big data to the exploration of the biological mechanisms of cognitive functions, normal development and aging and of neurological and psychiatric disorders. We advocate the urgent need to expand efforts directed at the methodological challenges and discuss the direction of applications in this field."
28230848,46.0,Computational approaches to fMRI analysis,2017 Feb 23;20(3):304-313.,"Analysis methods in cognitive neuroscience have not always matched the richness of fMRI data. Early methods focused on estimating neural activity within individual voxels or regions, averaged over trials or blocks and modeled separately in each participant. This approach mostly neglected the distributed nature of neural representations over voxels, the continuous dynamics of neural activity during tasks, the statistical benefits of performing joint inference over multiple participants and the value of using predictive models to constrain analysis. Several recent exploratory and theory-driven methods have begun to pursue these opportunities. These methods highlight the importance of computational techniques in fMRI analysis, especially machine learning, algorithmic optimization and parallel computing. Adoption of these techniques is enabling a new generation of experiments and analyses that could transform our understanding of some of the most complex-and distinctly human-signals in the brain: acts of cognition such as thoughts, intentions and memories."
28222333,15.0,Immunoprofiling as a predictor of patient's response to cancer therapy-promises and challenges,2017 Apr;45:60-72.,"Immune cell infiltration is common to many tumors and has been recognized by pathologists for more than 100 years. The application of digital imaging and objective assessment software allowed a concise determination of the type and quantity of immune cells and their location relative to the tumor and, in the case of colon cancer, characterized overall survival better than AJCC TNM staging. Subsequently, expression of PD-L1, by 50% or more tumor cells, identified NSCLC patients with double the response rate to anti-PD-1. Soon, automated staining methods will improve reproducibility of multiplex staining and allow for CLIA standards so that multiplex staining can be used to make clinical decisions. Ultimately, machine-learning algorithms will help interpret data from tissue images and lead to improved delivery of precision medicine."
28212054,136.0,Machine Learning for Medical Imaging,Mar-Apr 2017;37(2):505-515.,"Machine learning is a technique for recognizing patterns that can be applied to medical images. Although it is a powerful tool that can help in rendering medical diagnoses, it can be misapplied. Machine learning typically begins with the machine learning algorithm system computing the image features that are believed to be of importance in making the prediction or diagnosis of interest. The machine learning algorithm system then identifies the best combination of these image features for classifying the image or computing some metric for the given image region. There are several methods that can be used, each with different strengths and weaknesses. There are open-source versions of most of these machine learning methods that make them easy to try and apply to images. Several metrics for measuring the performance of an algorithm exist; however, one must be aware of the possible associated pitfalls that can result in misleading metrics. More recently, deep learning has started to be used; this method has the benefit that it does not require image feature identification and calculation as a first step; rather, features are identified as part of the learning process. Machine learning has been used in medical imaging and will have a greater influence in the future. Those working in medical imaging must be aware of how machine learning works. ©RSNA, 2017."
28211015,31.0,"Fifty years of computer analysis in chest imaging: rule-based, machine learning, deep learning",2017 Mar;10(1):23-32.,"Half a century ago, the term ""computer-aided diagnosis"" (CAD) was introduced in the scientific literature. Pulmonary imaging, with chest radiography and computed tomography, has always been one of the focus areas in this field. In this study, I describe how machine learning became the dominant technology for tackling CAD in the lungs, generally producing better results than do classical rule-based approaches, and how the field is now rapidly changing: in the last few years, we have seen how even better results can be obtained with deep learning. The key differences among rule-based processing, machine learning, and deep learning are summarized and illustrated for various applications of CAD in the chest."
28190189,1.0,Towards Precision in HF Pharmacotherapy,2017 Feb;14(1):1-6.,"Purpose of review:                    Heart failure (HF) is a disease state with great heterogeneity, which complicates the therapeutic process. Identifying more precise HF phenotypes will allow for the development of more targeted therapies and improvement in patient outcomes. This review explores the future for precision medicine in HF treatment.              Recent findings:                    Rather than a continuous disease spectrum with a uniform pathogenesis, HF has phenotypes with different underlying pathophysiologic features. The challenge is to establish clinical phenotypic characterizations to direct therapy. Phenomapping, a process of using machine learning algorithms applied to clinical data sets, has been used to identify phenotypically distinct and clinically meaningful HF groups. As powerful technologies extend our knowledge, future analyses may be able to compile more comprehensive phenotypic profiles using genetic, epigenetic, proteomic, and metabolomic measurements. Identifying clinical characterizations of particular HF patients that would be uniquely or disproportionately responsive to a specific treatment would allow for more direct selection of optimal therapy, reduce trial-and-error prescribing, and help avoid adverse drug reactions."
28183433,41.0,Mechanisms of the Development of Allergy (MeDALL): Introducing novel concepts in allergy phenotypes,2017 Feb;139(2):388-399.,"Asthma, rhinitis, and eczema are complex diseases with multiple genetic and environmental factors interlinked through IgE-associated and non-IgE-associated mechanisms. Mechanisms of the Development of ALLergy (MeDALL; EU FP7-CP-IP; project no: 261357; 2010-2015) studied the complex links of allergic diseases at the clinical and mechanistic levels by linking epidemiologic, clinical, and mechanistic research, including in vivo and in vitro models. MeDALL integrated 14 European birth cohorts, including 44,010 participants and 160 cohort follow-ups between pregnancy and age 20 years. Thirteen thousand children were prospectively followed after puberty by using a newly standardized MeDALL Core Questionnaire. A microarray developed for allergen molecules with increased IgE sensitivity was obtained for 3,292 children. Estimates of air pollution exposure from previous studies were available for 10,000 children. Omics data included those from historical genome-wide association studies (23,000 children) and DNA methylation (2,173), targeted multiplex biomarker (1,427), and transcriptomic (723) studies. Using classical epidemiology and machine-learning methods in 16,147 children aged 4 years and 11,080 children aged 8 years, MeDALL showed the multimorbidity of eczema, rhinitis, and asthma and estimated that only 38% of multimorbidity was attributable to IgE sensitization. MeDALL has proposed a new vision of multimorbidity independent of IgE sensitization, and has shown that monosensitization and polysensitization represent 2 distinct phenotypes. The translational component of MeDALL is shown by the identification of a novel allergic phenotype characterized by polysensitization and multimorbidity, which is associated with the frequency, persistence, and severity of allergic symptoms. The results of MeDALL will help integrate personalized, predictive, preventative, and participatory approaches in allergic diseases."
28154052,4.0,Predicting human behavior: The next frontiers,2017 Feb 3;355(6324):489.,"Machine learning has provided researchers with new tools for understanding human behavior. In this article, we briefly describe some successes in predicting behaviors and describe the challenges over the next few years."
28154050,15.0,Beyond prediction: Using big data for policy problems,2017 Feb 3;355(6324):483-485.,"Machine-learning prediction methods have been extremely productive in applications ranging from medicine to allocating fire and health inspectors in cities. However, there are a number of gaps between making a prediction and making a decision, and underlying assumptions need to be understood in order to optimize data-driven decision-making."
28144827,9.0,Biomarkers for Musculoskeletal Pain Conditions: Use of Brain Imaging and Machine Learning,2017 Jan;19(1):5.,"Chronic musculoskeletal pain condition often shows poor correlations between tissue abnormalities and clinical pain. Therefore, classification of pain conditions like chronic low back pain, osteoarthritis, and fibromyalgia depends mostly on self report and less on objective findings like X-ray or magnetic resonance imaging (MRI) changes. However, recent advances in structural and functional brain imaging have identified brain abnormalities in chronic pain conditions that can be used for illness classification. Because the analysis of complex and multivariate brain imaging data is challenging, machine learning techniques have been increasingly utilized for this purpose. The goal of machine learning is to train specific classifiers to best identify variables of interest on brain MRIs (i.e., biomarkers). This report describes classification techniques capable of separating MRI-based brain biomarkers of chronic pain patients from healthy controls with high accuracy (70-92%) using machine learning, as well as critical scientific, practical, and ethical considerations related to their potential clinical application. Although self-report remains the gold standard for pain assessment, machine learning may aid in the classification of chronic pain disorders like chronic back pain and fibromyalgia as well as provide mechanistic information regarding their neural correlates."
28144341,72.0,Computational methods in drug discovery,2016 Dec 12;12:2694-2718.,"The process for drug discovery and development is challenging, time consuming and expensive. Computer-aided drug discovery (CADD) tools can act as a virtual shortcut, assisting in the expedition of this long process and potentially reducing the cost of research and development. Today CADD has become an effective and indispensable tool in therapeutic development. The human genome project has made available a substantial amount of sequence data that can be used in various drug discovery projects. Additionally, increasing knowledge of biological structures, as well as increasing computer power have made it possible to use computational methods effectively in various phases of the drug discovery and development pipeline. The importance of in silico tools is greater than ever before and has advanced pharmaceutical research. Here we present an overview of computational methods used in different facets of drug discovery and highlight some of the recent successes. In this review, both structure-based and ligand-based drug discovery methods are discussed. Advances in virtual high-throughput screening, protein structure prediction methods, protein-ligand docking, pharmacophore modeling and QSAR techniques are reviewed."
28141576,1.0,Mathematical modelling of the electric sense of fish: the role of multi-frequency measurements and movement,2017 Jan 31;12(2):025002.,"Understanding active electrolocation in weakly electric fish remains a challenging issue. In this article we propose a mathematical formulation of this problem, in terms of partial differential equations. This allows us to detail two algorithms: one for localizing a target using the multi-frequency aspect of the signal, and another one for identifying the shape of this target. Shape recognition is designed in a machine learning point of view, and takes advantage of both the multi-frequency setup and the movement of the fish around its prey. Numerical simulations are shown for the computation of the electric field emitted and sensed by the fish; they are then used as an input for the two algorithms."
28138367,78.0,Machine Learning and Data Mining Methods in Diabetes Research,2017 Jan 8;15:104-116.,"The remarkable advances in biotechnology and health sciences have led to a significant production of data, such as high throughput genetic data and clinical information, generated from large Electronic Health Records (EHRs). To this end, application of machine learning and data mining methods in biosciences is presently, more than ever before, vital and indispensable in efforts to transform intelligently all available information into valuable knowledge. Diabetes mellitus (DM) is defined as a group of metabolic disorders exerting significant pressure on human health worldwide. Extensive research in all aspects of diabetes (diagnosis, etiopathophysiology, therapy, etc.) has led to the generation of huge amounts of data. The aim of the present study is to conduct a systematic review of the applications of machine learning, data mining techniques and tools in the field of diabetes research with respect to a) Prediction and Diagnosis, b) Diabetic Complications, c) Genetic Background and Environment, and e) Health Care and Management with the first category appearing to be the most popular. A wide range of machine learning algorithms were employed. In general, 85% of those used were characterized by supervised learning approaches and 15% by unsupervised ones, and more specifically, association rules. Support vector machines (SVM) arise as the most successful and widely used algorithm. Concerning the type of data, clinical datasets were mainly used. The title applications in the selected articles project the usefulness of extracting valuable knowledge leading to new hypotheses targeting deeper understanding and further investigation in DM."
28133810,34.0,Systems serology for evaluation of HIV vaccine trials,2017 Jan;275(1):262-270.,"The scale and scope of the global epidemic, coupled to challenges with traditional vaccine development approaches, point toward a need for novel methodologies for HIV vaccine research. While the development of vaccines able to induce broadly neutralizing antibodies remains the ultimate goal, to date, vaccines continue to fail to induce these rare humoral immune responses. Conversely, growing evidence across vaccine platforms in both non-human primates and humans points to a role for polyclonal vaccine-induced antibody responses in protection from infection. These candidate vaccines, despite employing disparate viral vectors and immunization strategies, consistently identify a role for functional or non-traditional antibody activities as correlates of immunity. However, the precise mechanism(s) of action of these ""binding"" antibodies, their specific characteristics, and their ability to be selectively induced and/or potentiated to result in complete protection merits parallel investigation to neutralizing antibody-based vaccine design approaches. Ultimately, while neutralizing and functional antibody-based vaccine strategies need not be mutually exclusive, defining the specific characteristics of ""protective"" functional antibodies may provide a target immune profile to potentially induce more robust immunity against HIV. Specifically, one approach to guide the development of functional antibody-based vaccine strategies, termed ""systems serology"", offers an unbiased and comprehensive approach to systematically survey humoral immune responses, capturing the array of functions and humoral response characteristics that may be induced following vaccination with high resolution. Coupled to machine learning tools, large datasets that explore the ""antibody-ome"" offer a means to step back from anticipated correlates and mechanisms of protection and toward a more fundamental understanding of coordinated aspects of humoral immune responses, to more globally differentiate among vaccine candidates, and most critically, to identify the features of humoral immunity that distinguish protective from non-protective responses. Overall, the systematic serological approach described here aimed at broadly capturing the enormous biodiversity in antibody profiles that may emerge following vaccination, complements the existing cutting edge tools in the cellular immunology space that survey vaccine-induced polyfunctional cellular activity by flow cytometry, transcriptional profiling, epigenetic, and metabolomic analysis to offer a means to develop both a more nuanced and a more complete understanding of correlates of protection to support the design of functional vaccine strategies."
28132481,3.0,Tackling the problem of HIV drug resistance,2016;62(3):273-279.,"The virally-encoded HIV-1 protease is an effective target for antiviral drugs, however, treatment for HIV infections is limited by the prevalence of drug resistant viral mutants. In this review, we describe our three-pronged approach to analyze and combat drug resistance. Understanding the molecular basis for resistance due to protease inhibitors is a key initial step in this approach. This knowledge is being employed for the design of new, improved inhibitors with high affinity for resistant mutants as well as wild type enzyme. In parallel with experimental studies of diverse mutants and inhibitory compounds, we are developing efficient algorithms to predict drug resistance phenotype from genotype data. This approach has important practical applications in the clinic where genotyping is recommended for individuals with new infections."
28127429,34.0,Machine learning and systems genomics approaches for multi-omics data,2017 Jan 20;5:2.,"In light of recent advances in biomedical computing, big data science, and precision medicine, there is a mammoth demand for establishing algorithms in machine learning and systems genomics (MLSG), together with multi-omics data, to weigh probable phenotype-genotype relationships. Software frameworks in MLSG are extensively employed to analyze hundreds of thousands of multi-omics data by high-throughput technologies. In this study, we reviewed the MLSG software frameworks and future directions with respect to multi-omics data analysis and integration. Our review was targeted at researching recent approaches and technical solutions for the MLSG software frameworks using multi-omics platforms."
