pmid,title,date,text,citations
32578067,Machine Learning Within Studies of Early-Life Environmental Exposures and Child Health: Review of the Current Literature and Discussion of Next Steps,2020 Sep;7(3):170-184.,"Purpose of review:                    The goal of this article is to review the use of machine learning (ML) within studies of environmental exposures and children's health, identify common themes across studies, and provide recommendations to advance their use in research and practice.              Recent findings:                    We identified 42 articles reporting upon the use of ML within studies of environmental exposures and children's health between 2017 and 2019. The common themes among the articles were analysis of mixture data, exposure prediction, disease prediction and forecasting, analysis of complex data, and causal inference. With the increasing complexity of environmental health data, we anticipate greater use of ML to address the challenges that cannot be handled by traditional analytics. In order for these methods to beneficially impact public health, the ML techniques we use need to be appropriate for our study questions, rigorously evaluated and reported in a way that can be critically assessed by the scientific community.",
32576276,"""Right-to-Try"" experimental drugs: an overview",2020 Jun 23;18(1):253.,"The ""Right-to-Try"" experimental drugs act passed by Donald Trump in 2018 provides an opportunity of early access to experimental drugs for the treatment of life-threatening diseases and a potential boon to many young and under-capitalized biotechnology or pharmaceutical companies. The pros and cons of experimental drugs, including a number of ""cutting edge"" scientific, clinical, and a number of synergistic approaches such as artificial intelligence, machine learning, big data, data refineries, electronic health records, data driven clinical decisions and risk mitigation are reviewed.",
32575560,"Current Applications, Opportunities, and Limitations of AI for 3D Imaging in Dental Research and Practice",2020 Jun 19;17(12):4424.,"The increasing use of three-dimensional (3D) imaging techniques in dental medicine has boosted the development and use of artificial intelligence (AI) systems for various clinical problems. Cone beam computed tomography (CBCT) and intraoral/facial scans are potential sources of image data to develop 3D image-based AI systems for automated diagnosis, treatment planning, and prediction of treatment outcome. This review focuses on current developments and performance of AI for 3D imaging in dentomaxillofacial radiology (DMFR) as well as intraoral and facial scanning. In DMFR, machine learning-based algorithms proposed in the literature focus on three main applications, including automated diagnosis of dental and maxillofacial diseases, localization of anatomical landmarks for orthodontic and orthognathic treatment planning, and general improvement of image quality. Automatic recognition of teeth and diagnosis of facial deformations using AI systems based on intraoral and facial scanning will very likely be a field of increased interest in the future. The review is aimed at providing dental practitioners and interested colleagues in healthcare with a comprehensive understanding of the current trend of AI developments in the field of 3D imaging in dental medicine.",1.0
32570374,Emerging Concepts and Applied Machine Learning Research in Patients with Drug-Induced Repolarization Disorders,2020 Jun 16;270:198-202.,"The paper presents a review of current research to develop predictive models for automated detection of drug-induced repolarization disorders and shows a feasibility study for developing machine learning tools trained on massive multimodal datasets of narrative, textual and electrocardiographic records. The goal is to reduce drug-induced long QT and associated complications (Torsades-de-Pointes, sudden cardiac death), by identifying prescription patterns with pro-arrhythmic propensity using a validated electronic application for the detection of adverse drug events with data mining and natural language processing; and to compute individual-based predictive scores in order to further identify clinical conditions, concomitant diseases, or other variables that correlate with higher risk of pro-arrhythmic situations.",
32568489,An Examination of Emerging Bioethical Issues in Biomedical Research: Proceedings of a Workshop,,"On February 26, 2020, the Board on Health Sciences Policy of the National Academies of Sciences, Engineering, and Medicine hosted a 1-day public workshop in Washington, DC, to examine current and emerging bioethical issues that might arise in the context of biomedical research and to consider research topics in bioethics that could benefit from further attention. The scope of bioethical issues in research is broad, but this workshop focused on issues related to the development and use of digital technologies, artificial intelligence, and machine learning in research and clinical practice; issues emerging as nontraditional approaches to health research become more widespread; the role of bioethics in addressing racial and structural inequalities in health; and enhancing the capacity and diversity of the bioethics workforce. This publication summarizes the presentations and discussions from the workshop.",
32567390,In silico models for genotoxicity and drug regulation,2020 Aug;16(8):651-662.,"Introduction:                    Whereas in the past, (Q)SAR methods have been largely used to support the design of new drugs, in the last few decades, there has been a new interest in its applications for the assessment of drug safety. In particular, the ICH M7 guideline has introduced the concept that (Q)SAR predictions for the Ames mutagenicity of drug impurities can be used for regulatory purposes.              Areas covered:                    This review introduces the ICH M7 conceptual framework and illustrates the most updated evaluations of the in silico approaches for the prediction of genotoxicity. The strengths and weaknesses of the state-of-the-art are presented and future perspectives are discussed.              Expert opinion:                    Given the growing recognition of (Q)SAR approaches, more investment will be devoted to its improvement. The major areas of research should be the expansion and curation of the experimental training sets, with particular attention to the portions of chemical space which are poorly represented. New modeling methodologies (e.g. machine-learning methods) may support this effort, particularly for treating proprietary data without disclosure. Research on new integrative approaches for regulatory decisions will also be important.",1.0
32567255,Drawing Guidelines for Receiver Operating Characteristic Curve in Preparation of Manuscripts,2020 Jun 22;35(24):e171.,"The appropriate plot effectively conveys the author's conclusions to the readers. The Journal of Korean Medical Science provides a series of special articles to show you how to make consistent and excellent plots easier. In the second article, drawing receiver operating characteristic (ROC) curve is introduced. A ROC curve is a graphic plot that illustrates the diagnostic ability as its discrimination threshold is varied. It is widely used as logistic regression analysis as machine learning becomes widespread. It has great visual effect in comparing various diagnostic tools.",
32566759,Machine learning approaches to drug response prediction: challenges and recent progress,2020 Jun 15;4:19.,"Cancer is a leading cause of death worldwide. Identifying the best treatment using computational models to personalize drug response prediction holds great promise to improve patient's chances of successful recovery. Unfortunately, the computational task of predicting drug response is very challenging, partially due to the limitations of the available data and partially due to algorithmic shortcomings. The recent advances in deep learning may open a new chapter in the search for computational drug response prediction models and ultimately result in more accurate tools for therapy response. This review provides an overview of the computational challenges and advances in drug response prediction, and focuses on comparing the machine learning techniques to be of utmost practical use for clinicians and machine learning non-experts. The incorporation of new data modalities such as single-cell profiling, along with techniques that rapidly find effective drug combinations will likely be instrumental in improving cancer care.",5.0
32563708,The compatibility of theoretical frameworks with machine learning analyses in psychological research,2020 Dec;36:83-88.,"Supervised machine learning has been increasingly used in psychology and psychiatry research. Machine learning offers an important advantage over traditional statistical analyses: statistical model training in example data to enhance predictions in external test data. Additional advantages include advanced, improved statistical algorithms, and empirical methods to select a smaller set of predictor variables. Yet machine learning researchers often use large numbers of predictor variables, without using theory to guide variable selection. Such approach leads to Type I error, spurious findings, and decreased generalizability. We discuss the importance of theory to the psychology field. We offer suggestions for using theory to drive variable selection and data analyses using machine learning in psychological research, including an example from the cyberpsychology field.",
32562154,Artificial Intelligence-Enabled ECG: a Modern Lens on an Old Technology,2020 Jun 19;22(8):57.,"Purpose of review:                    To (i) review the concept of artificial intelligence (AI); (ii) summarize recent developments in artificial intelligence-enabled electrocardiogram (AI-ECG); (iii) address notable inherent limitations and challenges of AI-ECG; and (iv) discuss the future direction of the field.              Recent findings:                    Advancements in machine learning and computing methods have led to application of AI-ECG and potential new applications to patient care. Further study is needed to verify previous findings in diverse populations as well as begin to confront the limitations needed for clinical implementation. Nearly one century after the Nobel Prize was awarded to Willem Einthoven for demonstrating that an electrocardiogram (ECG) could record the electrical signature of the heart, the ECG remains one of the most important diagnostic tests in modern medicine. We now stand at the edge of true ECG innovation. Simultaneous advancements in computing power, wireless technology, digitized data availability, and machine learning have led to the birth of AI-ECG algorithms with novel capabilities and real potential for clinical application. AI has the potential to improve diagnostic accuracy and efficiency by providing fully automated, unbiased, and unambiguous ECG analysis along with promising new findings that may unlock new value in the ECG. These breakthroughs may cause a paradigm shift in clinical workflow as well as patient monitoring and management.",1.0
32562100,Machine Learning-Based Segmentation of Left Ventricular Myocardial Fibrosis from Magnetic Resonance Imaging,2020 Jun 19;22(8):65.,"Purpose of review:                    Myocardial fibrosis (MF) arises due to myocardial infarction and numerous cardiac diseases. MF may lead to several heart disorders, such as heart failure, arrhythmias, and ischemia. Cardiac magnetic resonance (CMR) imaging techniques, such as late gadolinium enhancement (LGE) CMR, enable non-invasive assessment of MF in the left ventricle (LV). Manual assessment of MF on CMR is a tedious and time-consuming task that is subject to high observer variability. Automated segmentation and quantification of MF is important for risk stratification and treatment planning in patients with heart disorders. This article aims to review the machine learning (ML)-based methodologies developed for MF quantification in the LV using CMR images.              Recent findings:                    With the availability of relatively large labeled datasets supervised learning methods based on both conventional ML and state-of-the-art deep learning (DL) methods have been successfully applied for automated segmentation of MF. The incorporation of ML algorithms into imaging techniques such as 3D LGE CMR permits fast characterization of MF on CMR imaging and may enhance the diagnosis and prognosis of patients with heart disorders. Concurrently, the studies using cine CMR images have revealed that accurate segmentation of MF on non-contrast CMR imaging might be possible. The application of ML/DL tools in CMR image interpretation is likely to result in accurate and efficient quantification of MF.",
32561444,Recent advances of HCI in decision-making tasks for optimized clinical workflows and precision medicine,2020 Aug;108:103479.,"The ever-increasing amount of biomedical data is enabling new large-scale studies, even though ad hoc computational solutions are required. The most recent Machine Learning (ML) and Artificial Intelligence (AI) techniques have been achieving outstanding performance and an important impact in clinical research, aiming at precision medicine, as well as improving healthcare workflows. However, the inherent heterogeneity and uncertainty in the healthcare information sources pose new compelling challenges for clinicians in their decision-making tasks. Only the proper combination of AI and human intelligence capabilities, by explicitly taking into account effective and safe interaction paradigms, can permit the delivery of care that outperforms what either can do separately. Therefore, Human-Computer Interaction (HCI) plays a crucial role in the design of software oriented to decision-making in medicine. In this work, we systematically review and discuss several research fields strictly linked to HCI and clinical decision-making, by subdividing the articles into six themes, namely: Interfaces, Visualization, Electronic Health Records, Devices, Usability, and Clinical Decision Support Systems. However, these articles typically present overlaps among the themes, revealing that HCI inter-connects multiple topics. With the goal of focusing on HCI and design aspects, the articles under consideration were grouped into four clusters. The advances in AI can effectively support the physicians' cognitive processes, which certainly play a central role in decision-making tasks because the human mental behavior cannot be completely emulated and captured; the human mind might solve a complex problem even without a statistically significant amount of data by relying upon domain knowledge. For this reason, technology must focus on interactive solutions for supporting the physicians effectively in their daily activities, by exploiting their unique knowledge and evidence-based reasoning, as well as improving the various aspects highlighted in this review.",2.0
32561299,Image-based high-content screening in drug discovery,2020 Aug;25(8):1348-1361.,"While target-based drug discovery strategies rely on the precise knowledge of the identity and function of the drug targets, phenotypic drug discovery (PDD) approaches allow the identification of novel drugs based on knowledge of a distinct phenotype. Image-based high-content screening (HCS) is a potent PDD strategy that characterizes small-molecule effects through the quantification of features that depict cellular changes among or within cell populations, thereby generating valuable data sets for subsequent data analysis. However, these data can be complex, making image analysis from large HCS campaigns challenging. Technological advances in image acquisition, processing, and analysis as well as machine-learning (ML) approaches for the analysis of multidimensional data sets have rendered HCS as a viable technology for small-molecule drug discovery. Here, we discuss HCS concepts, current workflows as well as opportunities and challenges of image-based phenotypic screening and data analysis.",
32560091,"COVID-19 Diagnostics, Tools, and Prevention",2020 Jun 16;10(6):409.,"The Coronavirus Disease 2019 (COVID-19), caused by the severe acute respiratory syndrome coronavirus-2 (SARS-CoV-2), outbreak from Wuhan City, Hubei province, China in 2019 has become an ongoing global health emergency. The emerging virus, SARS-CoV-2, causes coughing, fever, muscle ache, and shortness of breath or dyspnea in symptomatic patients. The pathogenic particles that are generated by coughing and sneezing remain suspended in the air or attach to a surface to facilitate transmission in an aerosol form. This review focuses on the recent trends in pandemic biology, diagnostics methods, prevention tools, and policies for COVID-19 management. To meet the growing demand for medical supplies during the COVID-19 era, a variety of personal protective equipment (PPE) and ventilators have been developed using do-it-yourself (DIY) manufacturing. COVID-19 diagnosis and the prediction of virus transmission are analyzed by machine learning algorithms, simulations, and digital monitoring. Until the discovery of a clinically approved vaccine for COVID-19, pandemics remain a public concern. Therefore, technological developments, biomedical research, and policy development are needed to decipher the coronavirus mechanism and epidemiological characteristics, prevent transmission, and develop therapeutic drugs.",13.0
32560074,The Future of Protein Secondary Structure Prediction Was Invented by Oleg Ptitsyn,2020 Jun 16;10(6):910.,"When Oleg Ptitsyn and his group published the first secondary structure prediction for a protein sequence, they started a research field that is still active today. Oleg Ptitsyn combined fundamental rules of physics with human understanding of protein structures. Most followers in this field, however, use machine learning methods and aim at the highest (average) percentage correctly predicted residues in a set of proteins that were not used to train the prediction method. We show that one single method is unlikely to predict the secondary structure of all protein sequences, with the exception, perhaps, of future deep learning methods based on very large neural networks, and we suggest that some concepts pioneered by Oleg Ptitsyn and his group in the 70s of the previous century likely are today's best way forward in the protein secondary structure prediction field.",
32559068,Machine Learning Force Fields and Coarse-Grained Variables in Molecular Dynamics: Application to Materials and Biological Systems,2020 Aug 11;16(8):4757-4775.,"Machine learning encompasses tools and algorithms that are now becoming popular in almost all scientific and technological fields. This is true for molecular dynamics as well, where machine learning offers promises of extracting valuable information from the enormous amounts of data generated by simulation of complex systems. We provide here a review of our current understanding of goals, benefits, and limitations of machine learning techniques for computational studies on atomistic systems, focusing on the construction of empirical force fields from ab initio databases and the determination of reaction coordinates for free energy computation and enhanced sampling.",2.0
32558902,Automated video monitoring of insect pollinators in the field,2020 Jul 2;4(1):87-97.,"Ecosystems are at increasing risk from the global pollination crisis. Gaining better knowledge about pollinators and their interactions with plants is an urgent need. However, conventional methods of manually recording pollinator activity in the field can be time- and cost-consuming in terms of labour. Field-deployable video recording systems have become more common in ecological studies as they enable the capture of plant-insect interactions in fine detail. Standard video recording can be effective, although there are issues with hardware reliability under field-conditions (e.g. weatherproofing), and reviewing raw video manually is a time-consuming task. Automated video monitoring systems based on motion detection partly overcome these issues by only recording when activity occurs hence reducing the time needed to review footage during post-processing. Another advantage of these systems is that the hardware has relatively low power requirements. A few systems have been tested in the field which permit the collection of large datasets. Compared with other systems, automated monitoring allows vast increases in sampling at broad spatiotemporal scales. Some tools such as post-recording computer vision software and data-import scripts exist, further reducing users' time spent processing and analysing the data. Integrated computer vision and automated species recognition using machine learning models have great potential to further the study of pollinators in the field. Together, it is predicted that future advances in technology-based field monitoring methods will contribute significantly to understanding the causes underpinning pollinator declines and, hence, developing effective solutions for dealing with this global challenge.",1.0
32552005,The application of machine learning techniques to innovative antibacterial discovery and development,2020 Oct;15(10):1165-1180.,"Introduction:                    After the initial wave of antibiotic discovery, few novel classes of antibiotics have emerged, with the latest dating back to the 1980's. Furthermore, the pace of antibiotic drug discovery is unable to keep up with the increasing prevalence of antibiotic drug resistance. However, the increasing amount of available data promotes the use of machine learning techniques (MLT) in drug discovery projects (e.g. construction of regression/classification models and ranking/virtual screening of compounds).              Areas covered:                    In this review, the authors cover some of the applications of MLT in medicinal chemistry, focusing on the development of new antibiotics, the prediction of resistance and its mechanisms. The aim of this review is to illustrate the main advantages and disadvantages and the major trends from studies over the past 5 years.              Expert opinion:                    The application of MLT to antibacterial drug discovery can aid the selection of new and potent lead compounds, with desirable pharmacokinetic and toxic profiles for further optimization. The increasing volume of available data along with the constant improvement in computational power and algorithms has meant that we are experiencing a transition in the way we face modern issues such as drug resistance, where our decisions are data-driven and experiments can be focused by data-suggested hypotheses.",2.0
32547805,Quantified Self-Using Consumer Wearable Device: Predicting Physical and Mental Health,2020 Apr;26(2):83-92.,"Objectives:                    Recently, wearable device technology has gained more popularity in supporting a healthy lifestyle. Hence, researchers have begun to put significant efforts into studying the direct and indirect benefits of wearable devices for health and wellbeing. This paper summarizes recent studies on the use of consumer wearable devices to improve physical activity, mental health, and health consciousness.              Methods:                    A thorough literature search was performed from several reputable databases, such as PubMed, Scopus, ScienceDirect, arXiv, and bioRxiv mainly using ""wearable device research"" as a keyword, no earlier than 2018. As a result, 25 of the most recent and relevant papers included in this review cover several topics, such as previous literature reviews (9 papers), wearable device accuracy (3 papers), self-reported data collection tools (3 papers), and wearable device intervention (10 papers).              Results:                    All the chosen studies are discussed based on the wearable device used, complementary data, study design, and data processing method. All these previous studies indicate that wearable devices are used either to validate their benefits for general wellbeing or for more serious medical contexts, such as cardiovascular disorders and post-stroke treatment.              Conclusions:                    Despite their huge potential for adoption in clinical settings, wearable device accuracy and validity remain the key challenge to be met. Some lessons learned and future projections, such as combining traditional study design with statistical and machine learning methods, are highlighted in this paper to provide a useful overview for other researchers carrying out similar research.",
